{"run":83,"commit":"e7aa367","metric":52,"metrics":{"remaining_gates":0},"status":"keep","description":"Validate persisted owner-event payloads against their catalog schemas.","timestamp":1786680303250,"segment":5,"confidence":4.333333333333333,"asi":{"hypothesis":"Every persisted Inventory, Accounting, and Sales owner-event payload should decode through its exported catalog schema, and Accounting must reject non-UUID order identities before publishing its PUBLIC event.","result":"All three PostgreSQL publication proofs decode stored payloads through owner declarations; PostRevenueForOrderInput now validates order UUIDs, with unit and PostgreSQL fixtures aligned to the PUBLIC accounting.revenue.posted contract.","validation":"All fifty-two readiness gates passed; full formatting, lint, type, skills, boundary, contract, and 134-test portfolio passed.","retry_note":"This rerun fixed the root trust-boundary mismatch exposed by the prior checks_failed experiment rather than weakening the payload proof."}}
{"run":84,"commit":"bb94f2e","metric":53,"metrics":{"remaining_gates":0},"status":"keep","description":"Align Accounting revenue reversal identities with the PUBLIC revenue event contract.","timestamp":1786681880966,"segment":5,"confidence":4.416666666666667,"asi":{"hypothesis":"Revenue reversal should accept and report the same UUID order identity enforced by revenue posting and accounting.revenue.posted, preventing a looser lookup boundary after publication.","result":"ReverseRevenueForOrderInput and RevenueJournalNotFound now validate order UUIDs; the public contract test rejects malformed reversal identities while existing Process cancellation continues with Sales-owned UUIDs.","validation":"All fifty-three readiness gates passed; full formatting, lint, type, skills, boundary, contract, and 135-test portfolio passed."}}
{"run":85,"commit":"bb94f2e","metric":53,"metrics":{"remaining_gates":1},"status":"discard","description":"Type the Process order-confirmation completed event payload.","timestamp":1786682098687,"segment":5,"confidence":4.24,"asi":{"hypothesis":"The Process-owned order-confirmation completion event should validate workflow, order, reservation, and journal UUIDs before appending to Messaging.","rollback_reason":"The implementation and full 136-test validation portfolio passed, but the readiness gate required an export string with a trailing comma while the formatter placed the export differently, so the primary metric did not improve.","next_action_hint":"Reapply the unchanged typed payload and make the gate check the exported identifier without depending on comma formatting."}}
{"run":86,"commit":"bb94f2e","metric":53,"metrics":{"remaining_gates":1},"status":"discard","description":"Type the Process order-confirmation completed event payload.","timestamp":1786682264504,"segment":5,"confidence":4.076923076923077,"asi":{"hypothesis":"The Process-owned order-confirmation completion event should validate workflow, order, reservation, and journal UUIDs before appending to Messaging.","rollback_reason":"The unchanged implementation and all 136 tests passed again, but the readiness gate still did not match; the failure is in the gate expression rather than behavior.","next_action_hint":"Reapply once more, execute the new gate clauses individually to identify the mismatched clause, then correct only the harness expression."}}
{"run":87,"commit":"c7a3e4c","metric":54,"metrics":{"remaining_gates":0},"status":"keep","description":"Type the Process order-confirmation completed event payload.","timestamp":1786682431692,"segment":5,"confidence":4.153846153846154,"asi":{"hypothesis":"The Process-owned order-confirmation completion event should validate workflow, order, reservation, and journal UUIDs before appending to Messaging.","result":"Process now exports and decodes OrderConfirmationCompletedEventPayload inside the ambient transaction before append; malformed reservation identities are rejected by the public contract test.","validation":"All fifty-four readiness gates passed; full formatting, lint, type, skills, boundary, contract, and 136-test portfolio passed.","retry_note":"The implementation was unchanged across retries; the final run corrected an earlier exact occurrence-count gate invalidated by the new schema."}}
{"run":88,"commit":"7c83b90","metric":55,"metrics":{"remaining_gates":0},"status":"keep","description":"Type the Process order-cancellation completed event payload.","timestamp":1786682655346,"segment":5,"confidence":4.230769230769231,"asi":{"hypothesis":"The Process-owned order-cancellation completion event should validate workflow, confirmation, order, reservation, and reversal-journal UUIDs before Messaging append.","result":"Process now exports and decodes OrderCancellationCompletedEventPayload inside the cancellation transaction; malformed reversal journal identities are rejected by the public contract test.","validation":"All fifty-five readiness gates passed; full formatting, lint, type, skills, boundary, contract, and 137-test portfolio passed."}}
{"run":89,"commit":"14bf0b9","metric":56,"metrics":{"remaining_gates":0},"status":"keep","description":"Type the Process order-fulfillment completed event payload.","timestamp":1786682850274,"segment":5,"confidence":4.3076923076923075,"asi":{"hypothesis":"The Process-owned order-fulfillment completion event should validate workflow, confirmation, order, and reservation UUIDs before Messaging append.","result":"Process now exports and decodes OrderFulfillmentCompletedEventPayload inside the fulfillment transaction; malformed workflow identities are rejected by the public contract test.","validation":"All fifty-six readiness gates passed; full formatting, lint, type, skills, boundary, contract, and 138-test portfolio passed."}}
{"run":90,"commit":"14bf0b9","metric":56,"metrics":{"remaining_gates":1},"status":"discard","description":"Type every Process post-commit job payload before persistence.","timestamp":1786683091720,"segment":5,"confidence":4.3076923076923075,"asi":{"hypothesis":"Confirmation, cancellation, and fulfillment jobs should share one validated durable payload contract before insertion into process.jobs.","rollback_reason":"The implementation and full 139-test portfolio passed, but the readiness gate did not match the formatted source; behavior was valid and changes were reverted.","next_action_hint":"Reapply unchanged, inspect each gate clause and any earlier exact field-count gates affected by the new eventId/workflowRunId schema fields, then correct only the harness."}}
{"run":91,"commit":"7c86947","metric":57,"metrics":{"remaining_gates":0},"status":"keep","description":"Type every Process post-commit job payload before persistence.","timestamp":1786683294791,"segment":5,"confidence":4.222222222222222,"asi":{"hypothesis":"Confirmation, cancellation, and fulfillment jobs should share one validated durable payload contract before insertion into process.jobs.","result":"ProcessPostCommitJobPayload now validates event/workflow UUIDs and distinct execution metadata for all three lifecycle job inserts; malformed event identities are rejected by the public contract test.","validation":"All fifty-seven readiness gates passed; full formatting, lint, type, skills, boundary, contract, and 139-test portfolio passed.","retry_note":"The implementation was unchanged on retry; an earlier exact idempotency-field count was relaxed after the new shared schema legitimately added one field."}}
{"run":92,"commit":"db7af25","metric":58,"metrics":{"remaining_gates":0},"status":"keep","description":"Validate persisted Process post-commit job payloads.","timestamp":1786683575457,"segment":5,"confidence":4.142857142857143,"asi":{"hypothesis":"The durable process.jobs rows for confirmation, cancellation, and fulfillment should decode through the same public ProcessPostCommitJobPayload contract used before insertion.","result":"PostgreSQL tests now decode all three stored lifecycle job payloads; fulfillment additionally verifies every persisted identity and execution-metadata field against the command result.","validation":"All fifty-eight readiness gates passed; full formatting, lint, type, skills, boundary, contract, and 139-test portfolio passed."}}
{"run":93,"commit":"e7d4ead","metric":59,"metrics":{"remaining_gates":0},"status":"keep","description":"Validate persisted Process lifecycle event payloads.","timestamp":1786683762008,"segment":5,"confidence":4.214285714285714,"asi":{"hypothesis":"Stored confirmation, cancellation, and fulfillment events should decode through their Process-owned payload contracts, not only match ad hoc test objects.","result":"PostgreSQL tests now decode all three event_outbox payloads through the exported Process schemas; fulfillment additionally verifies every workflow, order, and reservation identity.","validation":"All fifty-nine readiness gates passed; full formatting, lint, type, skills, boundary, contract, and 139-test portfolio passed."}}
{"run":94,"commit":"7374517","metric":60,"metrics":{"remaining_gates":0},"status":"keep","description":"Publish typed Process lifecycle event catalog declarations.","timestamp":1786684004769,"segment":5,"confidence":4.285714285714286,"asi":{"hypothesis":"Process-owned confirmation, cancellation, and fulfillment events should be discoverable through the same typed catalog contract as Inventory, Accounting, and Sales owner events.","result":"Process now exports three PUBLIC event declarations with typed payloads, identity/version, scope, correlation, filtering, delivery, and sensitivity metadata; catalog compatibility validates all six domain-event contributors.","validation":"All sixty readiness gates passed; full formatting, lint, type, skills, boundary, contract, and 139-test portfolio passed."}}
{"run":95,"commit":"917e22f","metric":61,"metrics":{"remaining_gates":0},"status":"keep","description":"Bind Process event publication to its typed catalog declarations.","timestamp":1786684257613,"segment":5,"confidence":4.206896551724138,"asi":{"hypothesis":"Process publication must derive event type, version, aggregate type, and payload schema from one owner declaration rather than duplicating identity literals in the service.","result":"Process event schemas now live with their catalog declarations, and confirmation/cancellation/fulfillment append paths use the declaration IDs, versions, and aggregate types directly without a service/catalog cycle.","validation":"All sixty-one readiness gates passed; full formatting, lint, type, skills, boundary, contract, and 139-test portfolio passed."}}
{"run":96,"commit":"2ee49e4","metric":62,"metrics":{"remaining_gates":0},"status":"keep","description":"Restrict Process jobs to registered lifecycle job types.","timestamp":1786684490332,"segment":5,"confidence":4.133333333333334,"asi":{"hypothesis":"The public ProcessJob contract and durable inserts should use one registered job-type vocabulary instead of accepting arbitrary nonempty strings and duplicating type literals.","result":"ProcessPostCommitJobType and ProcessPostCommitJobTypes now define the confirmation, cancellation, and fulfillment vocabulary; all inserts derive from it and contract decoding rejects unknown job types.","validation":"All sixty-two readiness gates passed; full formatting, lint, type, skills, boundary, contract, and 139-test portfolio passed."}}
{"run":97,"commit":"2ee49e4","metric":62,"metrics":{"remaining_gates":1},"status":"checks_failed","description":"Validate complete persisted Process job rows against the public contract.","timestamp":1786684653877,"segment":5,"confidence":4.133333333333334,"asi":{"hypothesis":"Confirmation, cancellation, and fulfillment PostgreSQL rows should decode through ProcessJob so durable IDs, registered job types, status, counters, timestamps, metadata, and payload shape cannot drift from the public contract.","failure":"PostgreSQL scheduled_at::text emits a space-separated timestamp, while ProcessJob correctly requires an ISO timezone-qualified instant with T.","rollback_reason":"All three new full-row decodes failed at scheduledAt; correctness checks failed and the experiment must be reverted.","next_action_hint":"Reapply the full-row decodes but project scheduled_at and lease_until with to_json(...) so PostgreSQL emits ISO timestamp strings accepted by InstantString."}}
{"run":98,"commit":"e34f303","metric":63,"metrics":{"remaining_gates":0},"status":"keep","description":"Validate complete persisted Process job rows against the public contract.","timestamp":1786684825610,"segment":5,"confidence":4.2,"asi":{"hypothesis":"Confirmation, cancellation, and fulfillment PostgreSQL rows should decode through ProcessJob so durable IDs, registered job types, status, counters, timestamps, metadata, and payload shape cannot drift from the public contract.","result":"All three lifecycle PostgreSQL tests now decode complete process.jobs projections through ProcessJob and verify their registered job type; PostgreSQL timestamps are projected as ISO JSON strings matching the public instant contract.","validation":"All sixty-three readiness gates passed; full formatting, lint, type, skills, boundary, contract, and 139-test portfolio passed.","prior_failure_resolved":"Replaced PostgreSQL space-separated timestamp text projection with to_json(timestamptz), preserving timezone-qualified ISO format."}}
{"run":99,"commit":"e34f303","metric":63,"metrics":{"remaining_gates":1},"status":"checks_failed","description":"Validate persisted Process lifecycle envelopes against the Messaging contract.","timestamp":1786684931900,"segment":5,"confidence":4.2,"asi":{"hypothesis":"Confirmation, cancellation, and fulfillment outbox rows should decode through EventEnvelope and match their owner catalog identity so the complete durable messaging contract cannot drift.","rollback_reason":"The implementation was valid but two long event-version assertions did not match deno fmt; checks stopped before behavioral tests.","next_action_hint":"Reapply the same envelope projections and assertions with formatter-compliant multiline assert.strictEqual calls."}}
{"run":100,"commit":"2aac802","metric":64,"metrics":{"remaining_gates":0},"status":"keep","description":"Validate persisted Process lifecycle envelopes against the Messaging contract.","timestamp":1786685101061,"segment":5,"confidence":4.266666666666667,"asi":{"hypothesis":"Confirmation, cancellation, and fulfillment outbox rows should decode through EventEnvelope and match their owner catalog identity so the complete durable messaging contract cannot drift.","result":"All three Process lifecycle PostgreSQL tests now decode complete messaging.event_outbox projections through EventEnvelope and verify persisted type/version against the owning catalog declaration.","validation":"All sixty-four readiness gates passed; full formatting, lint, type, skills, boundary, contract, and 139-test portfolio passed.","prior_failure_resolved":"Reapplied the valid assertions in deno-fmt compliant form."}}
{"run":101,"commit":"e696eb4","metric":65,"metrics":{"remaining_gates":0},"status":"keep","description":"Register and verify Process lifecycle workflow types.","timestamp":1786685378189,"segment":5,"confidence":4.193548387096774,"asi":{"hypothesis":"Confirmation, cancellation, and fulfillment workflow rows should use one exported registered type vocabulary so service routing, public validation, and persisted identities cannot drift through duplicated strings.","result":"ProcessWorkflowType and ProcessWorkflowTypes now own the three lifecycle workflow identities; service constants derive from them, unknown workflow types fail schema decoding, and PostgreSQL tests verify each stored lifecycle row against the registered value.","validation":"All sixty-five readiness gates passed; full formatting, lint, type, skills, boundary, contract, and 139-test portfolio passed."}}
{"run":102,"commit":"7c9ffff","metric":66,"metrics":{"remaining_gates":0},"status":"keep","description":"Validate complete persisted Process workflow rows.","timestamp":1786692661214,"segment":5,"confidence":4.4,"asi":{"hypothesis":"Confirmation, cancellation, and fulfillment workflow rows should decode through the public WorkflowRun contract so registered type, identity, state, recovery, and completion metadata cannot drift.","result":"WorkflowRun now accepts the registered lifecycle workflow vocabulary, and all three PostgreSQL lifecycle tests decode complete workflow-run projections and verify their durable identity and type.","validation":"All sixty-six readiness gates passed; full formatting, lint, type, skills, boundary, contract, and 139-test portfolio passed."}}
{"run":103,"commit":"7c9ffff","metric":67,"metrics":{"remaining_gates":0},"status":"checks_failed","description":"Validate persisted lifecycle workflow results against public schemas.","timestamp":1786693110071,"segment":5,"confidence":4.4,"asi":{"hypothesis":"The durable result JSON for confirmation, cancellation, and fulfillment should decode through the corresponding public result schema and equal the command result used for replay.","rollback_reason":"The new Process assertions were not among failures; three unrelated PostgreSQL tests timed out at the repository-wide 30-second limit, so checks failed and changes were reverted.","next_action_hint":"Reapply the same result decodes and rerun unchanged; the failure pattern indicates transient database contention rather than a behavioral defect."}}
{"run":104,"commit":"5d86224","metric":67,"metrics":{"remaining_gates":0},"status":"keep","description":"Validate persisted lifecycle workflow results against public schemas.","timestamp":1786693315363,"segment":5,"confidence":4.466666666666667,"asi":{"hypothesis":"The durable result JSON for confirmation, cancellation, and fulfillment should decode through the corresponding public result schema and equal the command result used for replay.","result":"All three lifecycle PostgreSQL tests now decode process.workflow_runs.result through the owner result schema and compare the complete durable result with the returned command result.","validation":"All sixty-seven readiness gates passed; full formatting, lint, type, skills, boundary, contract, and 139-test portfolio passed.","prior_failure_resolved":"Unchanged retry passed, confirming the prior unrelated PostgreSQL timeouts were transient."}}
{"run":105,"commit":"65fa306","metric":68,"metrics":{"remaining_gates":0},"status":"keep","description":"Validate persisted lifecycle workflow inputs against public schemas.","timestamp":1786693560236,"segment":5,"confidence":4.387096774193548,"asi":{"hypothesis":"The durable input payload for confirmation, cancellation, and fulfillment should decode through the corresponding public payload schema and preserve every command, correlation, causation, and idempotency field used for replay.","result":"All three lifecycle PostgreSQL tests now decode process.workflow_runs.payload through the owner payload schema and compare it with the exact persisted command metadata and aggregate inputs.","validation":"All sixty-eight readiness gates passed; full formatting, lint, type, skills, boundary, contract, and 139-test portfolio passed."}}
{"run":106,"commit":"16a715e","metric":69,"metrics":{"remaining_gates":0},"status":"keep","description":"Verify complete Process lifecycle event routing metadata.","timestamp":1786693795927,"segment":5,"confidence":4.3125,"asi":{"hypothesis":"Every persisted Process lifecycle envelope should preserve tenant, aggregate, command, correlation, causation, idempotency, actor, and initial delivery state in addition to its type/version and payload.","result":"Confirmation, cancellation, and fulfillment PostgreSQL proofs now compare the complete decoded EventEnvelope routing metadata with the command input, owner catalog aggregate type, result event identity, and pending delivery state.","validation":"All sixty-nine readiness gates passed; full formatting, lint, type, skills, boundary, contract, and 139-test portfolio passed."}}
{"run":107,"commit":"16a715e","metric":69,"metrics":{"remaining_gates":1},"status":"checks_failed","description":"Verify complete Process lifecycle job routing metadata.","timestamp":1786693973749,"segment":5,"confidence":4.3125,"asi":{"hypothesis":"Every persisted lifecycle post-commit job should preserve tenant, registered type, idempotency, priority, status, lease, attempts, and correlation metadata in addition to its typed payload.","failure":"All three full-row assertions exposed that lifecycle post-commit jobs intentionally persist priority 100, not the table default 0.","rollback_reason":"The proof expectation was wrong; correctness checks failed and changes were reverted.","next_action_hint":"Reapply the same complete metadata assertions with priority 100, matching the owner-controlled enqueue policy in all three service paths."}}
{"run":108,"commit":"e1090d8","metric":70,"metrics":{"remaining_gates":0},"status":"keep","description":"Verify complete Process lifecycle job routing metadata.","timestamp":1786751228196,"segment":5,"confidence":4.375,"asi":{"hypothesis":"Every persisted lifecycle post-commit job should preserve tenant, registered type, idempotency, owner enqueue priority, status, lease, attempts, and correlation metadata in addition to its typed payload.","result":"Confirmation, cancellation, and fulfillment PostgreSQL proofs now compare complete decoded ProcessJob routing metadata, and all three enqueue paths derive priority from the exported ProcessLifecycleJobPriority constant.","validation":"All seventy readiness gates passed; full formatting, lint, type, skills, boundary, contract, and 139-test portfolio passed.","prior_failure_resolved":"Corrected the proof to the intentional owner-controlled priority 100 rather than the table default."}}
