{"run":179,"commit":"73f6150","metric":124,"metrics":{"remaining_gates":0},"status":"keep","description":"Reject self-linked cancellation reversal journals.","timestamp":1786889020027,"segment":5,"confidence":4.679245283018868,"asi":{"hypothesis":"A cancellation replay must not accept a reversal journal whose ID equals its source confirmation journal; even with a reversed state and inverse lines, self-linkage is not a durable reversal artifact.","result":"Cancellation replay now requires a distinct reversal journal ID from the posted confirmation journal, with a PostgreSQL self-reversal regression.","next_action_hint":"Continue with another distinct lifecycle identity check, avoiding duplicate confirmation journal validations."}}
{"run":180,"commit":"4d88f4e","metric":125,"metrics":{"remaining_gates":0},"status":"keep","description":"Validate confirmed order totals against line prices.","timestamp":1786889208395,"segment":5,"confidence":4.62962962962963,"asi":{"hypothesis":"A schema-valid confirmation result must preserve the Sales order arithmetic; changing a line price while leaving the order total and posted journal balanced would otherwise replay a financially inconsistent order.","result":"confirmationResultMatches now recomputes order total in minor units from quantity and unit prices, with a PostgreSQL regression for a mismatched line price.","next_action_hint":"Continue with a distinct lifecycle invariant, preferably around durable journal or event linkage."}}
{"run":181,"commit":"8117fa9","metric":126,"metrics":{"remaining_gates":0},"status":"keep","description":"Require lifecycle order facts to match confirmation.","timestamp":1786889401026,"segment":5,"confidence":4.666666666666667,"asi":{"hypothesis":"Cancellation and fulfillment replay results must preserve the confirmed order's customer, quotation, confirmation timestamp, total, and lines; status is the only expected SalesOrder difference for cancellation.","result":"Added orderFactsMatch to lifecycle replay validation, with corruption regressions for altered cancellation line prices and fulfillment customer identity.","next_action_hint":"Continue with a distinct lifecycle invariant, preferably around event/job or reversal artifact linkage."}}
{"run":182,"commit":"dbd1cd4","metric":127,"metrics":{"remaining_gates":0},"status":"keep","description":"Bind confirmation workflow identity to its payload.","timestamp":1786889623783,"segment":5,"confidence":4.703703703703703,"asi":{"hypothesis":"loadConfirmation must reject a workflow row whose durable idempotency key no longer matches its decoded confirmation payload; otherwise lifecycle commands can execute against a re-keyed confirmation row.","result":"Added row.idempotencyKey === payload.idempotencyKey validation and a PostgreSQL regression that temporarily rekeys the confirmation workflow before cancellation.","next_action_hint":"Continue with a distinct durable workflow identity check, avoiding another confirmation payload-field duplicate."}}
{"run":183,"commit":"96f7976","metric":128,"metrics":{"remaining_gates":0},"status":"keep","description":"Require confirmation timestamps for confirmed orders.","timestamp":1786889791642,"segment":5,"confidence":4.654545454545454,"asi":{"hypothesis":"A confirmed Sales order in a persisted Process confirmation result must carry a confirmation timestamp; allowing confirmedAt null would make a draft-like state replayable with reservations and revenue posted.","result":"confirmationResultMatches now requires confirmedAt !== null, with a PostgreSQL regression for a schema-valid confirmed order missing its timestamp.","next_action_hint":"Continue with a distinct lifecycle or Messaging invariant, avoiding repetitive confirmation state checks."}}
{"run":184,"commit":"1dbd57d","metric":129,"metrics":{"remaining_gates":0},"status":"keep","description":"Validate Process job routing priority on replay.","timestamp":1786889993152,"segment":5,"confidence":4.607142857142857,"asi":{"hypothesis":"A replayed Process result must reference a job retaining the lifecycle routing priority; a cross-linked or corrupted priority can misroute post-commit work even when job identity fields match.","result":"processJobMatches now requires ProcessLifecycleJobPriority, with a PostgreSQL regression that corrupts and restores the persisted job priority.","next_action_hint":"Continue with a distinct durable job state or event identity invariant."}}
{"run":185,"commit":"1dbd57d","metric":129,"metrics":{"remaining_gates":1},"status":"checks_failed","description":"Make lifecycle retries idempotent under concurrent commands.","timestamp":1786890153834,"segment":5,"confidence":4.607142857142857,"asi":{"hypothesis":"Concurrent cancellation and fulfillment retries that race the workflow unique key should reload the committed lifecycle result instead of returning a transient idempotency conflict.","result":"Added one bounded retry on WorkflowIdempotencyConflict and concurrent lifecycle test coverage, but repository checks failed with Effect.all inference producing unknown result types in the lifecycle test.","rollback_reason":"Backpressure checks failed during deno check with 148 type errors caused by heterogeneous/array inference in the new concurrent Effect.all test, so the candidate was reverted.","next_action_hint":"Reapply the retry implementation and add `as const` to both concurrent Effect.all arrays, then rerun focused type checks before the full experiment."}}
{"run":186,"commit":"af19b43","metric":130,"metrics":{"remaining_gates":0},"status":"keep","description":"Make lifecycle retries idempotent under concurrent commands.","timestamp":1786890369125,"segment":5,"confidence":4.642857142857143,"asi":{"hypothesis":"Concurrent cancellation and fulfillment retries that race the workflow unique key should reload the committed lifecycle result instead of returning a transient idempotency conflict.","result":"Added one bounded retry on WorkflowIdempotencyConflict for cancellation and fulfillment, typed the recursive effects, and covered both concurrent races; full benchmark and repository backpressure checks passed.","next_action_hint":"Continue with a distinct bounded invariant or finalize once no safe untested lifecycle gap remains."}}
{"run":187,"commit":"c29ad3c","metric":131,"metrics":{"remaining_gates":0},"status":"keep","description":"Reject mixed cancellation and fulfillment races with one durable winner.","timestamp":1786890667239,"segment":5,"confidence":4.5964912280701755,"asi":{"hypothesis":"Cancellation and fulfillment racing on one confirmed order should commit at most one lifecycle workflow; the loser must roll back its workflow, inventory, journal, event, and job effects.","result":"Added a PostgreSQL lifecycle race test with distinct inputs, one successful outcome, one failure, exactly one lifecycle artifact set, and final order/reservation consistency; full benchmark and backpressure checks passed.","next_action_hint":"Continue with a distinct untested durable invariant, preferably around lifecycle failure typing, workflow state, or event/job identity."}}
{"run":188,"commit":"25852ea","metric":132,"metrics":{"remaining_gates":0},"status":"keep","description":"Reject confirmation replay with a changed event actor.","timestamp":1786890866207,"segment":5,"confidence":4.714285714285714,"asi":{"hypothesis":"A persisted lifecycle event whose actor principal changes must not be accepted on workflow replay; producer actor identity is part of the durable command linkage.","result":"Added a PostgreSQL regression that mutates actor_principal_id, expects WorkflowResultCorrupt, restores the valid actor, and passes the full validation portfolio.","next_action_hint":"Continue with another distinct replay identity or lifecycle rollback invariant; avoid repeating already-covered event metadata fields."}}
{"run":189,"commit":"fd22b30","metric":133,"metrics":{"remaining_gates":0},"status":"keep","description":"Reject confirmation replay with mismatched Process job payload.","timestamp":1786914429433,"segment":5,"confidence":4.666666666666667,"asi":{"hypothesis":"A persisted Process job payload must retain the workflow command identity; changing its commandId should make confirmation replay corrupt rather than returning the prior result.","result":"Added a PostgreSQL regression that mutates and restores the confirmation job payload commandId, with processJobMatches enforcing the mismatch; full benchmark and backpressure checks passed.","next_action_hint":"Continue with another distinct lifecycle job/event identity or rollback invariant, avoiding already-covered envelope fields."}}
{"run":190,"commit":"39a3ba7","metric":133,"metrics":{"remaining_gates":1},"status":"checks_failed","description":"Prove inventory reservation idempotency is tenant-scoped.","timestamp":1786916571991,"segment":5,"confidence":4.586206896551724,"asi":{"hypothesis":"The same reservation idempotency key used by two tenants should create independent reservations and balances rather than replaying across tenant boundaries.","result":"Added a second-tenant reservation regression, but the assertion expected on_hand to decrease; reserveStock changes reserved quantity only, leaving on_hand unchanged.","rollback_reason":"The full backpressure suite failed in inventory.postgres.test.ts because the new cross-tenant balance assertion expected on_hand 9 but the correct reservation balance is on_hand 10, reserved 1. Candidate reverted.","next_action_hint":"Reapply the candidate with on_hand corrected to 10, then rerun the full portfolio."}}
{"run":191,"commit":"f9fb87f","metric":134,"metrics":{"remaining_gates":0},"status":"keep","description":"Scope Inventory reservation idempotency by tenant.","timestamp":1786916768956,"segment":5,"confidence":4.620689655172414,"asi":{"hypothesis":"The same reservation idempotency key used by two tenants should create independent reservations and balances rather than replaying across tenant boundaries.","result":"Added a PostgreSQL regression with a second tenant using the same reservation idempotency key, asserting a distinct reservation, tenant identity, and independent on-hand/reserved balance; full benchmark and backpressure checks passed.","next_action_hint":"Continue with another distinct tenant-scoped invariant or bounded rollback/idempotency gap, avoiding already-covered replay metadata and concurrency cases."}}
{"run":192,"commit":"f9fb87f","metric":134,"metrics":{"remaining_gates":1},"status":"checks_failed","description":"Prove Sales confirmation idempotency is tenant-scoped.","timestamp":1786916958012,"segment":5,"confidence":4.620689655172414,"asi":{"hypothesis":"The same Sales order confirmation idempotency key used by two tenants should confirm two independent orders and emit one event per tenant.","result":"Added a second-tenant confirmation regression, but an existing assertion still hard-coded the former single-tenant key sales-confirm-1 after the input was changed to same-key-different-tenant.","rollback_reason":"The full backpressure suite failed in sales.postgres.test.ts because the expected persisted key was stale; candidate reverted.","next_action_hint":"Reapply the candidate and replace the hard-coded confirmation_idempotency_key assertion with input.idempotencyKey, then rerun."}}
{"run":193,"commit":"7813d6c","metric":135,"metrics":{"remaining_gates":0},"status":"keep","description":"Scope Sales confirmation idempotency by tenant.","timestamp":1786917155196,"segment":5,"confidence":4.576271186440678,"asi":{"hypothesis":"The same Sales order confirmation idempotency key used by two tenants should confirm independent orders and emit one confirmation event per tenant.","result":"Added a PostgreSQL regression with two authorized tenants sharing one confirmation key, asserting distinct confirmed orders and one event per tenant; full benchmark and backpressure checks passed.","next_action_hint":"Continue with another distinct tenant-scoped invariant or bounded rollback/idempotency gap, avoiding replay metadata and already-covered concurrency cases."}}
{"run":194,"commit":"6b82659","metric":136,"metrics":{"remaining_gates":0},"status":"keep","description":"Scope Accounting revenue posting idempotency by tenant.","timestamp":1786917470634,"segment":5,"confidence":4.533333333333333,"asi":{"hypothesis":"The same order identity used by Accounting revenue posting in two tenants should create independent journals and tenant-scoped events instead of replaying the first tenant's journal.","result":"Added a second-tenant Accounting legal entity, profile, open period, and posting assertion using the same order ID; both journals and events remain distinct. Full benchmark and backpressure checks passed.","next_action_hint":"Continue with another distinct tenant-scoped invariant or bounded rollback/idempotency gap, avoiding replay metadata and already-covered concurrency cases."}}
{"run":195,"commit":"46f77ec","metric":137,"metrics":{"remaining_gates":0},"status":"keep","description":"Scope Accounting revenue reversal by tenant.","timestamp":1786917635148,"segment":5,"confidence":4.6440677966101696,"asi":{"hypothesis":"A revenue reversal using the same order identity in another tenant should reverse that tenant's journal independently rather than cross-linking the first tenant's source.","result":"Added second-tenant reverse authorization and reversal assertions alongside the cross-tenant posting fixture; full benchmark and backpressure checks passed.","next_action_hint":"Continue with another distinct tenant-scoped invariant or bounded rollback/idempotency gap, avoiding replay metadata and already-covered concurrency cases."}}
{"run":196,"commit":"9423358","metric":138,"metrics":{"remaining_gates":0},"status":"keep","description":"Scope Process confirmation workflow idempotency by tenant.","timestamp":1786917842702,"segment":5,"confidence":4.6,"asi":{"hypothesis":"The same Process order-confirmation idempotency key in two tenants should commit independent workflows and all downstream artifacts rather than replaying one tenant's result.","result":"Added a reusable two-tenant lifecycle fixture, shared-key confirmation calls, distinct workflow/event/job/journal assertions, and per-tenant artifact counts. Full benchmark and backpressure checks passed.","next_action_hint":"Continue with another distinct tenant-scoped invariant or bounded rollback/idempotency gap, avoiding replay metadata and already-covered concurrency cases."}}
{"run":197,"commit":"d622add","metric":139,"metrics":{"remaining_gates":0},"status":"keep","description":"Scope Process cancellation workflow idempotency by tenant.","timestamp":1786918023266,"segment":5,"confidence":4.633333333333334,"asi":{"hypothesis":"The same Process cancellation idempotency key in two tenants should create independent cancellation workflows, reversals, events, and jobs rather than cross-tenant replay.","result":"Extended the two-tenant lifecycle fixture with same-key cancellation commands and distinct artifact/count assertions; full benchmark and backpressure checks passed.","next_action_hint":"Continue with another distinct tenant-scoped invariant or bounded rollback/idempotency gap, avoiding replay metadata and already-covered concurrency cases."}}
{"run":198,"commit":"437f5e5","metric":140,"metrics":{"remaining_gates":0},"status":"keep","description":"Scope Process fulfillment workflow idempotency by tenant.","timestamp":1786918235172,"segment":5,"confidence":4.666666666666667,"asi":{"hypothesis":"The same Process fulfillment idempotency key in two tenants should create independent fulfillment workflows, events, jobs, and stock effects rather than cross-tenant replay.","result":"Added a second pair of tenant fixtures, same-key fulfillment commands, distinct workflow/event/job assertions, reservation status checks, and per-tenant counts. Full benchmark and backpressure checks passed.","next_action_hint":"Continue with another distinct tenant-scoped invariant or bounded rollback/idempotency gap, avoiding replay metadata and already-covered concurrency cases."}}
{"run":199,"commit":"7e5d145","metric":141,"metrics":{"remaining_gates":0},"status":"keep","description":"Scope Sales customer email uniqueness by tenant.","timestamp":1786918426160,"segment":5,"confidence":4.622950819672131,"asi":{"hypothesis":"The same normalized customer email should be rejected as a duplicate within one tenant but allowed as an independent customer in another tenant.","result":"Extended the Sales contract test with a second authorized tenant and same-email assertion; full benchmark and backpressure checks passed.","next_action_hint":"Continue with another distinct tenant-scoped invariant or bounded rollback/idempotency gap, avoiding replay metadata and already-covered concurrency cases."}}
{"run":200,"commit":"a4ecb46","metric":142,"metrics":{"remaining_gates":0},"status":"keep","description":"Prove Accounting account codes are tenant-scoped.","timestamp":1786918649779,"segment":5,"confidence":4.580645161290323,"asi":{"hypothesis":"Two tenants should be able to use the same normalized Accounting account codes while receiving independent account identities for revenue posting.","result":"Reused the same account codes in the second-tenant Accounting fixture and asserted distinct account IDs; full benchmark and backpressure checks passed.","next_action_hint":"Continue with another distinct tenant-scoped invariant or bounded rollback/idempotency gap, avoiding replay metadata and already-covered concurrency cases."}}
{"run":201,"commit":"05cacfd","metric":143,"metrics":{"remaining_gates":0},"status":"keep","description":"Prove Inventory warehouse names are tenant-scoped.","timestamp":1786918845111,"segment":5,"confidence":4.612903225806452,"asi":{"hypothesis":"Two tenants should be able to use the same normalized Inventory warehouse name while receiving independent warehouse identities.","result":"Reused the same warehouse name in the second-tenant Inventory fixture and asserted distinct warehouse IDs; full benchmark and backpressure checks passed.","next_action_hint":"Continue with another distinct tenant-scoped invariant or bounded rollback/idempotency gap, avoiding replay metadata and already-covered concurrency cases."}}
{"run":202,"commit":"136f2b2","metric":144,"metrics":{"remaining_gates":0},"status":"keep","description":"Prove Inventory item SKUs are tenant-scoped.","timestamp":1786919022231,"segment":5,"confidence":4.645161290322581,"asi":{"hypothesis":"Two tenants should be able to use the same normalized Inventory SKU while receiving independent item identities and stock balances.","result":"Added an explicit distinct-item assertion to the existing same-SKU cross-tenant Inventory fixture; full benchmark and backpressure checks passed.","next_action_hint":"Continue with another distinct tenant-scoped invariant or bounded rollback/idempotency gap, avoiding replay metadata and already-covered concurrency cases."}}
{"run":203,"commit":"4aa3d27","metric":145,"metrics":{"remaining_gates":0},"status":"keep","description":"Scope Inventory stock correction idempotency by tenant.","timestamp":1786919221856,"segment":5,"confidence":4.603174603174603,"asi":{"hypothesis":"The same stock-correction idempotency key in two tenants should create independent movements and balances rather than replaying one tenant's correction.","result":"Added a second-tenant adjustment with the existing shared key and asserted distinct movement identity plus the independent corrected balance; full benchmark and backpressure checks passed.","next_action_hint":"Continue with another distinct tenant-scoped invariant or bounded rollback/idempotency gap, avoiding replay metadata and already-covered concurrency cases."}}
{"run":204,"commit":"5e4b155","metric":146,"metrics":{"remaining_gates":0},"status":"keep","description":"Scope Messaging consumer receipts by tenant.","timestamp":1786919428734,"segment":5,"confidence":4.5625,"asi":{"hypothesis":"The same event ID and consumer ID reused across two tenant-scoped event rows should produce one independent receipt and local mutation per tenant, with retries suppressed independently.","result":"Added a PostgreSQL receipt isolation test using shared event and consumer identities, per-tenant mutations, duplicate retries, and attempts/receipt assertions; full benchmark and backpressure checks passed.","next_action_hint":"Continue with another distinct tenant-scoped invariant or bounded rollback/idempotency gap, avoiding replay metadata and already-covered concurrency cases."}}
{"run":205,"commit":"e2c945e","metric":147,"metrics":{"remaining_gates":0},"status":"keep","description":"Verify tenant-scoped Messaging event reads.","timestamp":1786919617486,"segment":5,"confidence":4.59375,"asi":{"hypothesis":"When the same event ID exists in two tenant-scoped outbox rows, the public Messaging getEvent boundary must return the tenant's own row rather than an arbitrary row.","result":"Extended the tenant receipt test with public getEvent assertions for both tenants; full benchmark and backpressure checks passed.","next_action_hint":"Continue with another distinct tenant-scoped invariant or bounded rollback/idempotency gap, avoiding replay metadata and already-covered concurrency cases."}}
