{"run":265,"commit":"c32dc57","metric":198,"metrics":{"remaining_gates":0},"status":"keep","description":"Add PostgreSQL proof for legal-entity-aligned reservations.","timestamp":1786934914182,"segment":5,"confidence":4.351648351648351,"asi":{"hypothesis":"The new Inventory reservation boundary needs a real PostgreSQL regression proving a same-tenant warehouse from another legal entity is rejected before stock mutation, not only an in-memory test.","what_learned":"The integration regression, full validation portfolio, and all 198 readiness gates pass."}}
{"run":266,"commit":"390733f","metric":199,"metrics":{"remaining_gates":0},"status":"keep","description":"Prove Process rolls back legal-entity-mismatched confirmation.","timestamp":1786935137762,"segment":5,"confidence":4.326086956521739,"asi":{"hypothesis":"Process must propagate the Inventory warehouse/legal-entity precondition and roll back the Sales confirmation and all workflow artifacts when that downstream boundary rejects the selected legal entity.","what_learned":"The PostgreSQL workflow regression passes; the order remains draft and no workflow, event, or job rows survive the mismatch."}}
{"run":267,"commit":"a4ec8d1","metric":198,"metrics":{"remaining_gates":1},"status":"discard","description":"Re-baseline P3 readiness after the latest RITSEI rename and TigerBeetle commits.","timestamp":1787020326944,"segment":5,"confidence":4.326086956521739,"asi":{"hypothesis":"The current committed tree should retain the bounded P3 readiness portfolio after the latest committed rename and financial-ledger changes.","rollback_reason":"The full checks pass, but the readiness measure dropped from the prior 199 because one canonical P3 gate no longer matches the latest tree.","next_action_hint":"Identify the single stale P3 readiness assertion and reconcile it with the latest accepted ADRs without altering prior commits."}}
{"run":268,"commit":"70b92d0","metric":199,"metrics":{"remaining_gates":0},"status":"keep","description":"Reconcile the P3 benchmark and roadmap with the latest RITSEI catalog and ADR-0040 boundary.","timestamp":1787020808610,"segment":5,"confidence":4.326086956521739,"asi":{"hypothesis":"The latest committed tree adds AccountingFinancialOperationPostAction and releases the server-derived Accounting revenue action, so the P3 evidence and roadmap must recognize the expanded catalog without weakening any readiness proof.","result":"Updated the autoresearch prompt, changed the stale single-entry catalog assertion to require both current Accounting action entries, and reconciled the roadmap summary with ADR-0040; all 199 gates and the full validation portfolio pass.","next_action_hint":"Audit only distinct P3 evidence or canonical consistency gaps; do not activate TigerBeetle, PgQue, external connectors, or Process Studio runtime."}}
{"run":269,"commit":"a8eeeb8","metric":200,"metrics":{"remaining_gates":0},"status":"keep","description":"Preserve distinct metadata for Accounting financial-operation reconciliation events.","timestamp":1787021181176,"segment":5,"confidence":4.301075268817204,"asi":{"hypothesis":"The latest ADR-0040 financial-operation path appended reconciliation events with identical command, correlation, causation, and idempotency IDs, violating the active ADR-0037/0038 envelope contract; deterministic role-specific IDs should preserve replay compatibility while making the identities distinct.","result":"Added one shared metadata helper used by finalization and projection rebuild, plus a PostgreSQL regression asserting all four envelope identities differ; expanded the readiness portfolio to 200 gates. Full checks passed.","next_action_hint":"Continue only with another current-ADR-backed financial-operation or P3 invariant; do not add speculative consumers or activate gated TigerBeetle/PgQue infrastructure."}}
{"run":270,"commit":"751f66e","metric":201,"metrics":{"remaining_gates":0},"status":"keep","description":"Constrain Accounting reconciled-event mapping versions to the persisted positive invariant.","timestamp":1787021525218,"segment":5,"confidence":4.276595744680851,"asi":{"hypothesis":"Accounting financial operations persist mapping_version > 0, but the PUBLIC reconciled-event payload accepted zero or negative values; reusing a positive schema and adding an invalid-version catalog regression keeps event consumers aligned with the durable owner invariant.","result":"AccountingFinancialOperationReconciledEvent now rejects non-positive mapping versions, with valid and invalid public catalog decoding coverage; all 201 readiness gates and the full validation portfolio pass.","next_action_hint":"Continue only with another concrete ADR-0038/0040 invariant; avoid adding gates without an implementation-level correctness proof."}}
{"run":271,"commit":"1116684","metric":202,"metrics":{"remaining_gates":0},"status":"keep","description":"Bound Accounting reconciled-event mapping versions to PostgreSQL integer range.","timestamp":1787021741195,"segment":5,"confidence":4.297872340425532,"asi":{"hypothesis":"The persisted accounting mapping_version uses PostgreSQL integer, but the PUBLIC reconciled-event schema only enforced positivity and could accept values above 2_147_483_647; the public boundary should match both lower and upper storage limits.","result":"Bound the event schema to 1..0x7fffffff and added a catalog regression for the overflowing value; all 202 readiness gates and the full validation portfolio pass.","next_action_hint":"Continue only with another concrete persistence/public-contract parity gap; avoid speculative benchmark-only gates."}}
{"run":272,"commit":"1116684","metric":202,"metrics":{"remaining_gates":1},"status":"checks_failed","description":"Bound Accounting financial-operation command mapping versions to PostgreSQL integer range.","timestamp":1787021791013,"segment":5,"confidence":4.297872340425532,"asi":{"hypothesis":"The financial-operation command schemas use a positive integer while the persisted mapping_version is PostgreSQL integer; overflow should be rejected before intent persistence.","rollback_reason":"The candidate reached the readiness gate but backpressure formatting checks failed because the new CreateFinancialRevenueIntentInput import was out of order; no source result was accepted.","next_action_hint":"Reapply the same bounded schema and regression test, then run deno fmt before measuring."}}
{"run":273,"commit":"7a55c90","metric":203,"metrics":{"remaining_gates":0},"status":"keep","description":"Bound Accounting financial-operation command mapping versions to PostgreSQL integer range.","timestamp":1787022048091,"segment":5,"confidence":4.273684210526316,"asi":{"hypothesis":"The financial-operation command schemas use a positive integer while the persisted mapping_version is PostgreSQL integer; overflow should be rejected before intent persistence.","result":"Bound the shared financial-operation command mapping schema to 1..0x7fffffff and added a contract regression for overflow; after formatting, all 203 readiness gates and the full validation portfolio pass.","next_action_hint":"Continue with another concrete persistence/public-contract parity gap; avoid speculative benchmark-only gates."}}
{"run":274,"commit":"6ab1907","metric":204,"metrics":{"remaining_gates":0},"status":"keep","description":"Bound Accounting verification evidence versions to PostgreSQL smallint range.","timestamp":1787022303066,"segment":5,"confidence":4.25,"asi":{"hypothesis":"Verification artifacts persist schema_version and mapping_version as PostgreSQL smallint, but the public FinancialVerificationEvidence schema accepted values above 32,767 and would defer failure to artifact persistence.","result":"Added one positive-smallint schema for both evidence versions and regression coverage for overflow on each field; all 204 readiness gates and the full validation portfolio pass.","next_action_hint":"Continue with another concrete persistence/public-contract parity gap; avoid speculative benchmark-only gates."}}
{"run":275,"commit":"362aa26","metric":205,"metrics":{"remaining_gates":0},"status":"keep","description":"Bound Accounting verification evidence counts to PostgreSQL integer range.","timestamp":1787022534887,"segment":5,"confidence":4.270833333333333,"asi":{"hypothesis":"Verification artifact account, operation, transfer, and mismatch counts persist as PostgreSQL integer, but the public evidence schema accepted values above 2_147_483_647 and would defer failure to artifact persistence.","result":"Bound the shared evidence Count schema to 0..0x7fffffff and added a public contract regression for overflow; all 205 readiness gates and the full validation portfolio pass.","next_action_hint":"Continue with another concrete persistence/public-contract parity gap; avoid speculative benchmark-only gates."}}
{"run":276,"commit":"dc7997d","metric":206,"metrics":{"remaining_gates":0},"status":"keep","description":"Bound Accounting cutover unresolved-operation counts to the PostgreSQL integer invariant.","timestamp":1787022798912,"segment":5,"confidence":4.291666666666667,"asi":{"hypothesis":"Financial cutover controls persist unresolvedAcceptedOperations as a non-negative PostgreSQL integer, but the public control schema accepted negative and overflowing values.","result":"Added a non-negative int4 schema and regression coverage for both invalid directions; all 206 readiness gates and the full validation portfolio pass.","next_action_hint":"Continue with another concrete persistence/public-contract parity gap; avoid speculative benchmark-only gates."}}
{"run":277,"commit":"ca66cba","metric":207,"metrics":{"remaining_gates":0},"status":"keep","description":"Bound Accounting financial-operation attempts to PostgreSQL integer range.","timestamp":1787063819147,"segment":5,"confidence":4.268041237113402,"asi":{"hypothesis":"Financial operations persist retry attempts as non-negative PostgreSQL integer values, so the public FinancialOperation contract should reject negative and overflowing attempts before durable reads or writes.","result":"FinancialOperation.attempts now enforces 0..2_147_483_647 through a shared schema, with contract coverage for both invalid directions; all 207 readiness gates and the full validation portfolio pass.","next_action_hint":"Continue with another concrete ADR-0040 persistence/public-contract parity gap; avoid speculative benchmark-only gates or gated infrastructure."}}
{"run":279,"commit":"b05e83b","metric":208,"metrics":{"remaining_gates":0},"status":"keep","description":"Re-baseline the four-commit split of runtime authority and exact financial amount work.","timestamp":1787102133849,"segment":5,"confidence":4.202020202020202,"asi":{"hypothesis":"Splitting deployment-authority implementation/tests and exact-ledger-amount implementation/tests into four reviewable commits preserves the current repository evidence and readiness portfolio.","result":"The current tree measures 208 p3_ready_gates with zero remaining gates and all automated backpressure checks pass; the cumulative tree is content-identical to the pre-split implementation commit.","next_action_hint":"Continue only with a concrete current-ADR invariant or canonical consistency gap; do not optimize the benchmark cosmetically or activate gated infrastructure."}}
{"run":280,"commit":"4c6659c","metric":209,"metrics":{"remaining_gates":0},"status":"keep","description":"Give financial-operation reconciliation events a dedicated stable occurrence identity.","timestamp":1787102727128,"segment":5,"confidence":4.18,"asi":{"hypothesis":"Accounting financial-operation reconciliation events reused the operation aggregate UUID as eventId, violating the event-occurrence/aggregate identity separation and making projection rebuild replay depend on an overloaded identity; persist one dedicated reconciled_event_id per operation and reuse it for finalization and rebuild.","result":"The accounting schema and generated migration persist a UUID occurrence identity; both reconciliation paths append with it while aggregateId remains the financial operation ID. PostgreSQL evidence proves the identities differ and that deleting/rebuilding the projection recreates the same event ID. Full backpressure checks pass.","next_action_hint":"Continue auditing current ADR-0037/0038/0040 financial-operation envelope and projection invariants; avoid speculative infrastructure or benchmark-only gates."}}
{"run":281,"commit":"68b6ac6","metric":210,"metrics":{"remaining_gates":0},"status":"keep","description":"Make the persisted reconciliation event identity immutable.","timestamp":1787103127741,"segment":5,"confidence":4.2,"asi":{"hypothesis":"The newly persisted reconciled_event_id must be protected by the Accounting financial-operation immutable-field trigger; otherwise privileged SQL could fork the event identity and make projection rebuild publish a second occurrence.","result":"A reviewed custom migration replaces the transition trigger to reject reconciled_event_id changes, and the PostgreSQL test proves the stable identity mutation maps to the existing immutable-fields constraint. Full backpressure checks pass.","next_action_hint":"Continue auditing current ADR-0037/0038/0040 financial-operation persistence and replay invariants; avoid speculative infrastructure or benchmark-only gates."}}
{"run":282,"commit":"2f48eed","metric":211,"metrics":{"remaining_gates":0},"status":"keep","description":"Enforce tenant-scoped uniqueness for financial reconciliation event identities.","timestamp":1787103508478,"segment":5,"confidence":4.22,"asi":{"hypothesis":"A stable reconciled_event_id must be unique within its tenant at the Accounting persistence boundary; otherwise two operations can claim one occurrence UUID and only fail later when Messaging appends the event.","result":"The schema and generated migration add a tenant-plus-event unique constraint. PostgreSQL evidence inserts a second valid operation with a reused occurrence identity and observes the stable constraint failure. Full backpressure checks pass.","next_action_hint":"Continue auditing current ADR-0037/0038/0040 financial-operation persistence and replay invariants; avoid speculative infrastructure or benchmark-only gates."}}
{"run":283,"commit":"2f48eed","metric":211,"metrics":{"remaining_gates":1},"status":"checks_failed","description":"Quarantine corrupt reconciliation-event replay.","timestamp":1787103650704,"segment":5,"confidence":4.178217821782178,"asi":{"hypothesis":"A corrupt existing reconciliation event should be fenced as manual recovery when projection rebuild hits EventIdempotencyConflict rather than propagating the conflict while leaving the operation reconciled.","rollback_reason":"The implementation passed the benchmark but the backpressure formatter rejected the new multiline PostgreSQL client type in packages/accounting/tests/financial-operations.postgres.test.ts; the candidate was auto-reverted before semantic validation.","next_action_hint":"Reapply the same replay-quarantine implementation and run deno fmt on the edited test before measuring."}}
{"run":284,"commit":"2f48eed","metric":211,"metrics":{"remaining_gates":1},"status":"checks_failed","description":"Reapply corrupt reconciliation-event replay quarantine.","timestamp":1787103820045,"segment":5,"confidence":4.137254901960785,"asi":{"hypothesis":"A corrupt existing reconciliation event should be fenced as manual recovery when projection rebuild hits EventIdempotencyConflict rather than propagating the conflict while leaving the operation reconciled.","rollback_reason":"Formatting was fixed, but PostgreSQL checks exposed an existing state-machine mismatch: quarantineProjection sets accepted transfer rows to manual_recovery, while the transfer transition trigger only permits unresolved to manual_recovery. The candidate was auto-reverted.","next_action_hint":"Preserve the replay quarantine branch and add a reviewed Accounting transfer-transition migration allowing accepted transfers to enter manual_recovery, then rerun the complete portfolio."}}
{"run":285,"commit":"61b35ff","metric":212,"metrics":{"remaining_gates":0},"status":"keep","description":"Quarantine corrupt reconciliation-event replay without leaving accepted transfers stuck.","timestamp":1787104087698,"segment":5,"confidence":4.1568627450980395,"asi":{"hypothesis":"A corrupt existing reconciliation event must be fenced as manual recovery when rebuild append returns EventIdempotencyConflict; the quarantine transaction also needs the transfer state machine to allow accepted transfers into manual_recovery.","result":"Accounting rebuild now catches only EventIdempotencyConflict, quarantines the operation, and preserves the corrupt event. A reviewed custom migration allows accepted transfer rows to enter manual_recovery, and PostgreSQL evidence proves the operation is quarantined with its corrupt event unchanged. Full backpressure checks pass.","next_action_hint":"Continue auditing current ADR-0037/0038/0040 financial-operation payload, envelope, and recovery invariants; avoid speculative infrastructure or benchmark-only gates."}}
{"run":286,"commit":"61b35ff","metric":212,"metrics":{"remaining_gates":1},"status":"checks_failed","description":"Protect Messaging event occurrence and tenant identity.","timestamp":1787104288020,"segment":5,"confidence":4.1568627450980395,"asi":{"hypothesis":"Messaging event_outbox identity fields must be immutable so financial projection replay cannot reinsert a canonical event after a privileged row re-key.","rollback_reason":"The custom migration and test exposed only test typing mistakes: EventEnvelope uses eventId rather than id, and the postgres RowList assertion needed element-wise checks. No semantic failure was observed; candidate remains for correction.","next_action_hint":"Change the three test assertions to eventId and element-wise row checks, then rerun the same candidate."}}
{"run":287,"commit":"89e29d2","metric":213,"metrics":{"remaining_gates":0},"status":"keep","description":"Protect Messaging event occurrence and tenant identity for replay.","timestamp":1787104563319,"segment":5,"confidence":4.135922330097087,"asi":{"hypothesis":"Messaging event_outbox identity fields must be immutable so financial projection replay cannot reinsert a canonical event after a privileged row re-keys the event ID and idempotency identity.","result":"A Messaging-owned custom migration rejects tenant_id or id changes with a stable immutable-identity constraint. PostgreSQL evidence proves a simultaneous ID/idempotency mutation rolls back, preserves the original row, and lets the original envelope replay to the same event occurrence. Full backpressure checks pass.","next_action_hint":"Continue auditing current ADR-0037/0038/0040 financial-operation and Messaging recovery invariants; avoid freezing intentionally mutable payload/publication fields or activating gated infrastructure."}}
{"run":288,"commit":"b46dd77","metric":214,"metrics":{"remaining_gates":0},"status":"keep","description":"Freeze Messaging event type, version, and idempotency identity.","timestamp":1787105017547,"segment":5,"confidence":4.115384615384615,"asi":{"hypothesis":"The outbox dedupe identity includes tenant, event occurrence, event type/version, and idempotency key; allowing the latter three to mutate after receipts can fork the durable source identity even when the occurrence UUID stays fixed.","result":"An additive Messaging migration extends the immutable-identity trigger to event_type, event_version, and idempotency_key. PostgreSQL tests cover each identity field and confirm source tampering is rejected while an unchanged receipt replays as a duplicate. Full backpressure checks pass.","next_action_hint":"Continue auditing current ADR-0037/0038/0040 envelope and receipt invariants; preserve intentionally mutable payload/publication fields and avoid speculative infrastructure."}}
{"run":289,"commit":"d2dd63f","metric":215,"metrics":{"remaining_gates":0},"status":"keep","description":"Protect completed consumer receipt identity.","timestamp":1787105468748,"segment":5,"confidence":4.134615384615385,"asi":{"hypothesis":"Consumer receipt binding fields must be immutable; otherwise a privileged update can rewrite a completed receipt to match a source identity and incorrectly suppress a consumer effect on replay.","result":"A Messaging-owned custom migration freezes tenant, consumer, event, type/version, and idempotency identity on completed receipts. PostgreSQL tests cover receipt re-key rejection and confirm unchanged duplicate replay executes no effect; existing mutable outbox corruption coverage remains intact. Full backpressure checks pass.","next_action_hint":"Continue auditing current ADR-0037/0038/0040 receipt, outbox, and financial replay invariants; do not freeze mutable delivery or payload fields."}}
{"run":290,"commit":"d2dd63f","metric":215,"metrics":{"remaining_gates":1},"status":"checks_failed","description":"Prove durable consumer receipt completion timestamps.","timestamp":1787105724340,"segment":5,"confidence":4.134615384615385,"asi":{"hypothesis":"A completed receipt should persist one completion timestamp and return that same timestamp on concurrent duplicate replay.","rollback_reason":"The new PostgreSQL assertion assumed the postgres client returned a Date, but timestamp rows are returned as strings in this test path; the semantic test failed at toISOString while all other checks passed.","next_action_hint":"Use the database-shaped string timestamp in the assertion (or compare String(storedReceipt.completed_at)) and rerun."}}
