{"run":291,"commit":"d2dd63f","metric":215,"metrics":{"remaining_gates":1},"status":"checks_failed","description":"Retry durable receipt timestamp evidence with database-shaped timestamps.","timestamp":1787105874053,"segment":5,"confidence":4.095238095238095,"asi":{"hypothesis":"A completed receipt should persist one completion timestamp and return that same timestamp on concurrent duplicate replay.","rollback_reason":"The postgres client returned a timezone-formatted string with local offset and microseconds, while the Effect receipt uses an ISO UTC string; direct string equality failed despite the same instant.","next_action_hint":"Normalize the persisted timestamp with new Date(String(...)).toISOString() before comparing it to the receipt contract."}}
{"run":292,"commit":"c31c3ca","metric":216,"metrics":{"remaining_gates":0},"status":"keep","description":"Prove completed receipt timestamps survive concurrent duplicate replay.","timestamp":1787106133657,"segment":5,"confidence":4.0754716981132075,"asi":{"hypothesis":"A completed receipt should persist one completion timestamp and return that same timestamp on concurrent duplicate replay, rather than generate a new timestamp or only be inferred from a count.","result":"The PostgreSQL duplicate-consumer proof now normalizes the database-shaped timestamp, matches it to the first receipt, and confirms the duplicate receipt returns the same completion instant. Full backpressure checks pass.","next_action_hint":"Continue auditing current ADR-0037/0038/0040 receipt, outbox, and financial replay invariants; avoid freezing mutable delivery or payload fields."}}
{"run":293,"commit":"aefc3a3","metric":217,"metrics":{"remaining_gates":0},"status":"keep","description":"Freeze Messaging event occurrence timestamps.","timestamp":1787106466579,"segment":5,"confidence":4.09433962264151,"asi":{"hypothesis":"Event occurred_at is durable audit history and participates in envelope equality, so allowing an out-of-band timestamp mutation can change ordering and make replay conflict with the original event identity.","result":"An additive Messaging migration extends the immutable event identity trigger to occurred_at. PostgreSQL evidence proves timestamp mutation is rejected while existing ID/idempotency replay protections remain intact. Full backpressure checks pass.","next_action_hint":"Continue auditing current ADR-0037/0038/0040 envelope, receipt, and financial replay invariants; preserve mutable payload, actor, publication, and attempt fields."}}
{"run":294,"commit":"df58808","metric":218,"metrics":{"remaining_gates":0},"status":"keep","description":"Freeze completed consumer receipt completion timestamps.","timestamp":1787106858628,"segment":5,"confidence":4.113207547169812,"asi":{"hypothesis":"A durable completed receipt's completed_at is part of the stable duplicate result; allowing direct mutation would alter the completion history returned on replay.","result":"An additive Messaging migration extends the receipt immutability trigger to completed_at. PostgreSQL evidence rejects timestamp mutation and still confirms duplicate replay is suppressed with the original completion timestamp. Full backpressure checks pass.","next_action_hint":"Continue auditing current ADR-0037/0038/0040 receipt and financial replay invariants; preserve intentionally mutable delivery and payload fields."}}
{"run":295,"commit":"aefc3a3","metric":218,"metrics":{"remaining_gates":1},"status":"checks_failed","description":"Reject financial rebuilds with provider mapping-version drift.","timestamp":1787107188217,"segment":5,"confidence":4.074766355140187,"asi":{"hypothesis":"Financial projection rebuild must compare the accepted ledger outcome mappingVersion with the persisted operation mappingVersion before rebuilding or emitting the persisted-version event.","rollback_reason":"The implementation reached the mapping-version branch, but the regression was placed after a capability-isolated revenue service created an operation in a separate in-memory ledger layer; the original service rebuild then saw that operation as not_found and failed before the targeted mismatch case.","next_action_hint":"Move the mapping-version operation and rebuild before the separate revenue-only test layer, using the original service and ledger state; rerun."}}
{"run":296,"commit":"aefc3a3","metric":217,"metrics":{"remaining_gates":2},"status":"checks_failed","description":"Retry financial rebuild mapping-version quarantine in the original ledger context.","timestamp":1787107369768,"segment":5,"confidence":4.037037037037037,"asi":{"hypothesis":"Financial projection rebuild must compare accepted outcome.mappingVersion with persisted operation.mappingVersion and quarantine a drifted provider outcome.","rollback_reason":"The candidate was auto-reverted after the integration test observed zero quarantined operations; inspection after rollback cannot distinguish the mapping fault path because the service/source candidate is removed. The fault seam likely did not affect the rebuild outcome and needs isolated diagnosis.","next_action_hint":"Reapply the mapping check and fault seam, then instrument or isolate the test-layer reconcile outcome before rerunning; do not accept a gate until the operation actually reaches manual_recovery."}}
{"run":297,"commit":"6fa6b3e","metric":219,"metrics":{"remaining_gates":0},"status":"keep","description":"Quarantine financial projection rebuilds with mapping-version drift.","timestamp":1787107779902,"segment":5,"confidence":4.018348623853211,"asi":{"hypothesis":"A provider reconciliation outcome with a mappingVersion different from the persisted operation must be treated as a projection mismatch before transfers, status, or the public reconciled event are rebuilt.","result":"Rebuild now requires outcome.mappingVersion to equal the persisted operation mappingVersion. The PostgreSQL regression wraps the same ledger state with a targeted mapping-drift adapter, proves the operation enters manual_recovery, and confirms no second reconciled event is emitted. Full backpressure checks pass.","next_action_hint":"Continue auditing current ADR-0037/0038/0040 financial operation and Messaging recovery invariants; avoid speculative infrastructure or benchmark-only gates."}}
{"run":298,"commit":"7f98bcb","metric":220,"metrics":{"remaining_gates":0},"status":"keep","description":"Fence provider outcomes with mismatched financial operation identities.","timestamp":1787108245485,"segment":5,"confidence":4,"asi":{"hypothesis":"Accounting must verify FinancialExecutionOutcome.operationId at both receipt and projection-rebuild boundaries; otherwise a valid provider result for another operation can mutate the selected operation and emit misleading reconciliation facts.","result":"Receipt writes now quarantine mismatched provider operation IDs without copying foreign acceptance metadata or emitting an event; rebuild identity checks share the existing quarantine path. PostgreSQL evidence covers submission transfer fencing, no submission event, rebuild fencing, and no duplicate rebuild event. Full backpressure checks pass.","next_action_hint":"Continue auditing current ADR-0037/0038/0040 financial operation and Messaging recovery invariants; avoid speculative infrastructure or benchmark-only gates."}}
{"run":299,"commit":"e105130","metric":221,"metrics":{"remaining_gates":0},"status":"keep","description":"Make missing-transfer projection rebuilds atomic with operation and event writes.","timestamp":1787108750022,"segment":5,"confidence":4.0181818181818185,"asi":{"hypothesis":"Rebuilds that insert missing financial transfer rows must share one PostgreSQL transaction with operation status, journal/transfer projection, and reconciled-event append; otherwise an append failure leaves durable partial projection state.","result":"Rebuild now stages missing transfer inserts and runs them inside the same ambient transaction as rebuildAcceptedProjection; EventIdempotencyConflict and other failures roll back before quarantine or retry. PostgreSQL evidence deletes the projection, injects append failure, proves operation provenance and zero transfer/event rows remain, then retries the stable event successfully. Full backpressure checks pass.","next_action_hint":"Continue auditing current ADR-0037/0038/0040 financial operation and Messaging transaction/recovery invariants; avoid speculative infrastructure or benchmark-only gates."}}
{"run":300,"commit":"8f3f924","metric":222,"metrics":{"remaining_gates":0},"status":"keep","description":"Reject reconciliation-checkpoint idempotency conflicts with changed provenance.","timestamp":1787109265862,"segment":5,"confidence":4.036363636363636,"asi":{"hypothesis":"A reconciliation checkpoint key is only idempotent for the same source/target watermarks, snapshot references, and evidence artifact; silently returning an existing checkpoint for changed provenance hides a new reconciliation request.","result":"Accounting now compares all checkpoint provenance fields and returns a public typed FinancialReconciliationCheckpointConflict for mismatched retries. The insert path recovers the unique-key winner and applies the same comparison, while identical retries remain stable. PostgreSQL contract evidence passes with the full validation portfolio.","next_action_hint":"Continue auditing current ADR-0037/0038/0040 checkpoint, financial operation, and Messaging transaction invariants; avoid speculative infrastructure or benchmark-only gates."}}
{"run":301,"commit":"35559a7","metric":223,"metrics":{"remaining_gates":0},"status":"keep","description":"Preserve provider operation and mapping provenance in checkpoint evidence.","timestamp":1787109709328,"segment":5,"confidence":4.018018018018018,"asi":{"hypothesis":"Checkpoint target snapshots must use the provider outcome operationId and mappingVersion, not persisted source values; otherwise a foreign or drifted accepted outcome can produce a falsely verified checkpoint.","result":"Accounting checkpoint target operations and transfers now carry outcome provenance. A PostgreSQL regression wraps the ledger to drift accepted mapping versions and proves the checkpoint is blocked with mismatches instead of silently verified. Full backpressure checks pass.","next_action_hint":"Continue auditing current ADR-0037/0038/0040 checkpoint, financial operation, and Messaging transaction invariants; avoid speculative infrastructure or benchmark-only gates."}}
{"run":302,"commit":"1f2496b","metric":224,"metrics":{"remaining_gates":0},"status":"keep","description":"Require verification artifacts to match checkpoint provenance.","timestamp":1787110164104,"segment":5,"confidence":4.072727272727272,"asi":{"hypothesis":"A verified financial evidence artifact is only valid for a checkpoint when its source/target watermarks and snapshot references exactly match the checkpoint request; tenant/legal-entity/status checks alone allow stale or unrelated evidence to certify a new boundary.","result":"The public evidence invalidation reason now includes provenance_mismatch, artifact loading compares all four opaque provenance fields, and the cutover PostgreSQL proof uses matching values for success plus a mismatched retry that is rejected before checkpoint creation. Full backpressure checks pass.","next_action_hint":"Continue auditing current ADR-0037/0038/0040 checkpoint, financial operation, and Messaging transaction invariants; avoid speculative infrastructure or benchmark-only gates."}}
{"run":303,"commit":"1ca5601","metric":225,"metrics":{"remaining_gates":0},"status":"keep","description":"Bind financial verification artifacts to legal-entity base currency.","timestamp":1787110671612,"segment":5,"confidence":4.054054054054054,"asi":{"hypothesis":"A signed financial verification artifact with a different currency can otherwise certify a USD legal entity; recording evidence must compare its currency with the immutable legal-entity accounting configuration.","result":"Production and in-memory Accounting artifact recording now reject evidence whose currency differs from the configured base currency or whose legal-entity configuration is absent. The PostgreSQL cutover proof covers a EUR artifact against a USD legal entity. Full backpressure checks pass.","next_action_hint":"Continue auditing current ADR-0037/0038/0040 checkpoint, financial operation, and Messaging transaction invariants; avoid speculative infrastructure or gate-only changes."}}
{"run":304,"commit":"75585bd","metric":226,"metrics":{"remaining_gates":0},"status":"keep","description":"Revalidate consumed financial evidence against legal-entity base currency.","timestamp":1787111174113,"segment":5,"confidence":4.035714285714286,"asi":{"hypothesis":"Public artifact recording alone is insufficient: a persisted signed artifact can outlive a legal-entity currency change and still be consumed by cutover approval or checkpoint reconciliation unless both consumers re-check the current base currency.","result":"Cutover approval now loads and compares baseCurrency, checkpoint reconciliation validates the configured currency, supplied artifact currency, every persisted operation currency, and uses the configured currency for empty evidence. PostgreSQL coverage proves approval and checkpoint rejection after configuration drift; full checks pass.","next_action_hint":"Continue auditing current ADR-0037/0038/0040 checkpoint, financial operation, and Messaging transaction invariants; avoid speculative infrastructure or gate-only changes."}}
{"run":305,"commit":"d5ae0fc","metric":227,"metrics":{"remaining_gates":0},"status":"keep","description":"Detect missing financial transfer projections during checkpoint reconciliation.","timestamp":1787111623315,"segment":5,"confidence":4.053571428571429,"asi":{"hypothesis":"Checkpoint source and target snapshots were both built from PostgreSQL transfer projections, so deleting a projection row could make both sides empty and falsely verify a checkpoint. Provider target transfers and projections must be derived independently from journal lines and the accepted ledger outcome.","result":"Checkpoint reconciliation now keeps separate source and target projections, derives target transfer pairs from journal lines plus outcome transfer IDs, and retains PostgreSQL rows only as the source snapshot. A PostgreSQL regression deletes a transfer projection and proves direct checkpoint reconciliation is blocked before projection rebuild. Full backpressure checks pass.","next_action_hint":"Continue auditing current ADR-0037/0038/0040 checkpoint, financial operation, and Messaging transaction invariants; avoid speculative infrastructure or gate-only changes."}}
{"run":306,"commit":"7c8549a","metric":228,"metrics":{"remaining_gates":0},"status":"keep","description":"Compare selected account balances during checkpoint reconciliation.","timestamp":1787112141274,"segment":5,"confidence":4.071428571428571,"asi":{"hypothesis":"Checkpoint reconciliation previously hard-coded empty balance snapshots, so provider account-balance drift could still verify when operation, transfer, and projection facts matched. Source balances should aggregate selected journal lines and target balances should come from the ledger port.","result":"Checkpoint reconciliation now aggregates exact BigInt debit/credit totals per account/currency/mapping version, queries provider getBalance for each source fact, and compares populated source/target balance snapshots. A shared-state ledger wrapper corrupts one provider balance and proves the checkpoint is blocked. Full backpressure checks pass.","next_action_hint":"Continue auditing current ADR-0037/0038/0040 checkpoint, financial operation, and Messaging transaction invariants; avoid speculative infrastructure or gate-only changes."}}
{"run":306,"commit":"cdc58b9","metric":229,"metrics":{"remaining_gates":0},"status":"keep","description":"Block reconciliation when an accepted financial operation still has a draft journal projection.","timestamp":1787207570024,"segment":5,"confidence":4.089285714285714,"asi":{"hypothesis":"Checkpoint source projections must read the persisted journal status instead of assuming posted or reversed from operation type; an accepted provider outcome with a draft PostgreSQL journal is projection lag and must block verification.","what_learned":"A natural receipt-failure regression produced accepted + draft journal + unresolved transfer state. The corrected source snapshot now mismatches the provider target and blocks the checkpoint; recovery then reconciles normally. Full backpressure checks passed.","next_action_hint":"Continue with the next distinct ADR-0040 checkpoint invariant, likely retained unresolved transfer projections or mixed mapping-version evidence; avoid speculative global provider scans and gated infrastructure."}}
{"run":307,"commit":"cdc58b9","metric":229,"metrics":{"remaining_gates":1},"status":"checks_failed","description":"Track unresolved financial transfer projection status in checkpoint evidence.","timestamp":1787207900311,"segment":5,"confidence":4.017543859649122,"asi":{"hypothesis":"Checkpoint transfer facts must include persisted financial_operation_transfers.status so an accepted provider transfer cannot verify while its PostgreSQL projection remains unresolved, rejected, or quarantined.","rollback_reason":"The candidate's test tried to turn a posted journal back into a draft-like projection through a direct SQL update, but the existing posted-journal immutability trigger correctly rejected that setup mutation before the transfer-only assertion ran.","next_action_hint":"Use a natural accepted-with-unresolved-transfer failure path, or create the transfer-only fixture before the journal is posted; do not weaken the posted-entry immutability trigger."}}
{"run":308,"commit":"cdc58b9","metric":229,"metrics":{"remaining_gates":1},"status":"checks_failed","description":"Replay unresolved financial transfer projection status in checkpoint evidence.","timestamp":1787208149851,"segment":5,"confidence":4.017543859649122,"asi":{"hypothesis":"Checkpoint transfer facts must include persisted financial_operation_transfers.status so accepted provider facts cannot verify when a PostgreSQL transfer projection is unresolved.","rollback_reason":"The test attempted an accepted-to-unresolved SQL transition, but the repository's reviewed transfer state machine intentionally forbids that transition; checks failed before the assertion.","next_action_hint":"Use a legal unresolved fixture before acceptance or an allowed accepted-to-manual_recovery transition; keep the transfer transition trigger unchanged."}}
{"run":309,"commit":"cdc58b9","metric":229,"metrics":{"remaining_gates":1},"status":"checks_failed","description":"Capture retained unresolved transfer projections in checkpoint evidence.","timestamp":1787208189598,"segment":5,"confidence":3.982608695652174,"asi":{"hypothesis":"Checkpoint transfer facts must include persisted financial_operation_transfers.status so a provider-accepted operation cannot verify while PostgreSQL retains an unresolved transfer projection.","rollback_reason":"The test setup attempted an accepted-to-unresolved transfer transition, but the reviewed state machine only permits accepted-to-manual_recovery; the database correctly rejected the mutation.","next_action_hint":"Use the allowed accepted-to-manual_recovery quarantine state for the transfer-only regression, and leave the existing transfer transition guard unchanged."}}
{"run":310,"commit":"6050248","metric":230,"metrics":{"remaining_gates":0},"status":"keep","description":"Block reconciliation when a projected transfer is quarantined or unresolved.","timestamp":1787208568282,"segment":5,"confidence":4.035087719298246,"asi":{"hypothesis":"Financial checkpoint snapshots must include each PostgreSQL transfer projection status and compare it with the provider's accepted transfer fact; transfer identity alone is insufficient after a projection quarantine.","what_learned":"FinancialTransferFact now carries transfer status, source snapshots read the persisted status, target facts are accepted, and PostgreSQL evidence proves an accepted operation with a manual_recovery transfer blocks checkpoint verification. Full backpressure checks passed.","next_action_hint":"Continue with the distinct mixed mapping-version evidence invariant or another concrete ADR-0040 checkpoint mismatch; avoid speculative provider-wide scans and gated infrastructure."}}
{"run":311,"commit":"e2790ab","metric":231,"metrics":{"remaining_gates":0},"status":"keep","description":"Reject mixed mapping-version financial checkpoints before evidence generation.","timestamp":1787209418608,"segment":5,"confidence":4.017391304347826,"asi":{"hypothesis":"The reconciliation anchor and verification evidence carry one mappingVersion, so a checkpoint spanning eligible operations from multiple mapping versions must fail closed instead of claiming the first operation's version.","what_learned":"The checkpoint now detects distinct eligible mapping versions and returns the public mapping_version_mismatch evidence error; PostgreSQL evidence creates a version-2 operation beside version 1 and proves the typed failure. Full backpressure checks passed.","next_action_hint":"Continue with the manual_recovery visibility/fencing invariant or another concrete ADR-0040 checkpoint gap; do not add a global provider scan without a provider capability decision."}}
