{"run":27,"commit":"6dfea21","metric":0,"metrics":{"remaining_gates":8},"status":"crash","description":"Add Sales order confirmation as the second Level 3 action provider with atomic owner event publication.","timestamp":1786578891186,"segment":5,"confidence":null,"asi":{"hypothesis":"Sales order confirmation already has owner-derived totals, authorization, idempotency, and invalid-state semantics, so adding atomic owner event publication and catalog metadata is the smallest genuine second Level 3 slice.","rollback_reason":"The experiment command timed out at 60 seconds while the full validation portfolio was still running; focused type, boundary, and all 117 tests had passed before the timed run.","next_action_hint":"Reapply the patch and rerun with a timeout above the observed full validation duration; do not change implementation solely to satisfy timing."}}
{"run":28,"commit":"81bf55b","metric":8,"metrics":{"remaining_gates":0},"status":"keep","description":"Publish Sales order confirmation as the second genuine Level 3 action/event slice.","timestamp":1786579393684,"segment":5,"confidence":null,"asi":{"hypothesis":"Sales order confirmation already owns server-derived totals, authorization, idempotency, and invalid-state semantics, so atomic owner event publication and catalog metadata provide the smallest safe second Level 3 provider.","result":"Sales confirm now carries distinct execution metadata, atomically emits sales.order.confirmed, rolls back when append fails, and is registered as a PUBLIC v1 action/event pair; Process forwards its metadata and catalog roadmaps now show two Level 3 domains.","validation":"All eight readiness gates passed; formatting, lint, type, skills, boundary, contract, and all 117 tests passed. The first timed attempt was retried unchanged with a sufficient timeout."}}
{"run":29,"commit":"81bf55b","metric":8,"metrics":{"remaining_gates":1},"status":"checks_failed","description":"Strengthen Sales confirmation rollback proof through successful same-key recovery.","timestamp":1786585038510,"segment":5,"confidence":null,"asi":{"hypothesis":"A failed atomic Sales confirmation must leave status, confirmed timestamp, idempotency key, and outbox untouched, then permit a successful retry with the same key.","rollback_reason":"The PostgreSQL client's RowList metadata made a whole-array deepStrictEqual type-invalid even though the intended assertions were sound.","next_action_hint":"Reapply the proof using field-by-field assertions on rollbackRows[0], then confirm a same-key retry commits exactly one event."}}
{"run":30,"commit":"81bf55b","metric":8,"metrics":{"remaining_gates":1},"status":"discard","description":"Prove failed Sales confirmation is cleanly retriable with the same idempotency key.","timestamp":1786585198999,"segment":5,"confidence":null,"asi":{"hypothesis":"Field-level rollback assertions plus a successful same-key retry prove the atomic confirmation boundary is recoverable, not merely rolled back.","rollback_reason":"Behavior and all validation passed, but the new readiness gate searched for object-literal null assertions while the type-correct test used assert.isNull, so the primary metric did not improve.","next_action_hint":"Retain the behavioral test and make the gate recognize the actual field-level assertions rather than requiring a specific assertion representation."}}
{"run":31,"commit":"a134e8f","metric":9,"metrics":{"remaining_gates":0},"status":"keep","description":"Prove Sales confirmation rollback clears all confirmation state and permits same-key recovery.","timestamp":1786585338686,"segment":5,"confidence":null,"asi":{"hypothesis":"A failed atomic Sales confirmation must leave status, confirmed timestamp, idempotency key, and outbox untouched, then permit a successful retry with the same key.","result":"The PostgreSQL test now verifies all persisted confirmation fields remain clean after append failure and that retrying the same idempotency key confirms the order with exactly one owner event.","validation":"All nine readiness gates passed; full formatting, lint, type, skills, boundary, contract, and 117-test portfolio passed."}}
{"run":32,"commit":"110a020","metric":10,"metrics":{"remaining_gates":0},"status":"keep","description":"Decouple Sales confirmation event identity from the Sales order aggregate identity.","timestamp":1786585569938,"segment":5,"confidence":null,"asi":{"hypothesis":"A domain event occurrence needs its own UUID rather than reusing the order aggregate ID, otherwise later Sales events for the same order would collide with the tenant-scoped outbox primary key.","result":"Both production and test Sales services now generate a distinct event ID; PostgreSQL proofs correlate through aggregate_type and aggregate_id while explicitly verifying the event ID differs from the order ID.","validation":"All ten readiness gates passed; full formatting, lint, type, skills, boundary, contract, and 117-test portfolio passed."}}
{"run":33,"commit":"4e67d02","metric":11,"metrics":{"remaining_gates":0},"status":"keep","description":"Give Inventory and Accounting owner events distinct occurrence identities.","timestamp":1786585785217,"segment":5,"confidence":22,"asi":{"hypothesis":"Inventory and Accounting event occurrences should not reuse correction or journal aggregate IDs, matching the envelope's distinct event identity and avoiding future same-aggregate event collisions.","result":"Both production and test services now generate independent event UUIDs while retaining correction/journal IDs as aggregate IDs and payload correlation; unit and PostgreSQL tests explicitly prove the identities differ.","validation":"All eleven readiness gates passed; full formatting, lint, type, skills, boundary, contract, and 117-test portfolio passed."}}
{"run":34,"commit":"77fa2d5","metric":12,"metrics":{"remaining_gates":0},"status":"keep","description":"Enforce UUID identity at all PUBLIC domain-event payload boundaries.","timestamp":1786587372703,"segment":5,"confidence":12,"asi":{"hypothesis":"PUBLIC event payload identifiers should validate as UUIDs, matching persisted domain identities and preventing malformed candidate events from entering catalog consumers.","result":"Inventory correction, Accounting revenue, and Sales confirmation payload schemas now validate their domain identifiers as UUIDs; compatibility fixtures use valid UUIDs.","validation":"All twelve readiness gates passed; full formatting, lint, type, skills, boundary, contract, and 117-test portfolio passed."}}
{"run":35,"commit":"22e950f","metric":13,"metrics":{"remaining_gates":0},"status":"keep","description":"Enforce owner namespaces for every typed domain-event declaration.","timestamp":1786587547560,"segment":5,"confidence":8.666666666666666,"asi":{"hypothesis":"A domain-owned event declaration must use its owning domain as the event-type namespace, preventing catalog metadata from assigning business meaning to the wrong owner.","result":"Catalog compatibility now rejects event IDs that do not begin with the declared owning domain namespace across Inventory, Accounting, and Sales contributors.","validation":"All thirteen readiness gates passed; full formatting, lint, type, skills, boundary, contract, and 117-test portfolio passed."}}
{"run":36,"commit":"f7bebce","metric":14,"metrics":{"remaining_gates":0},"status":"keep","description":"Bind every typed domain action identity to its authorization capability identity.","timestamp":1786587698030,"segment":5,"confidence":7,"asi":{"hypothesis":"A catalog action must authorize the capability with the same stable identifier; allowing action and capability IDs to diverge could protect a published business action with the wrong permission.","result":"Catalog compatibility now requires action.id to equal requiredCapability for both Inventory stock adjustment and Sales order confirmation providers.","validation":"All fourteen readiness gates passed; full formatting, lint, type, skills, boundary, contract, and 117-test portfolio passed."}}
{"run":37,"commit":"f7bebce","metric":14,"metrics":{"remaining_gates":1},"status":"checks_failed","description":"Validate typed event correlation and filter metadata as a coherent consumer contract.","timestamp":1786587745759,"segment":5,"confidence":5.6,"asi":{"hypothesis":"Event correlation fields must be nonempty, unique, and included in a duplicate-free filterable-field set so catalog consumers can reliably correlate and query candidates.","rollback_reason":"The implementation was semantically valid but failed the repository formatter because the one-line for loop requires braces.","next_action_hint":"Reapply the assertions in formatter-compliant block form and rerun unchanged."}}
{"run":38,"commit":"60f0ed0","metric":15,"metrics":{"remaining_gates":0},"status":"keep","description":"Validate typed event correlation and filter metadata as a coherent consumer contract.","timestamp":1786587872526,"segment":5,"confidence":5,"asi":{"hypothesis":"Event correlation fields must be nonempty, unique, and included in a duplicate-free filterable-field set so catalog consumers can reliably correlate and query candidates.","result":"Catalog compatibility now rejects empty or duplicate correlation metadata, duplicate filter metadata, and correlation fields that consumers cannot filter on.","validation":"All fifteen readiness gates passed; full formatting, lint, type, skills, boundary, contract, and 117-test portfolio passed."}}
{"run":39,"commit":"60f0ed0","metric":15,"metrics":{"remaining_gates":1},"status":"discard","description":"Validate every filterable event field against its declared payload schema.","timestamp":1786588064662,"segment":5,"confidence":6,"asi":{"hypothesis":"Catalog filter metadata must name real payload fields; otherwise consumers receive a published filter contract that cannot be evaluated against the event payload.","rollback_reason":"Behavior and all repository validation passed, but the readiness gate miscounted three helper calls as four by incorrectly assuming the helper declaration matched the call pattern.","next_action_hint":"Reapply unchanged and correct the gate to require the three domain-event calls."}}
{"run":40,"commit":"6cdab38","metric":16,"metrics":{"remaining_gates":0},"status":"keep","description":"Validate every filterable event field against its declared payload schema.","timestamp":1786588241543,"segment":5,"confidence":5.333333333333333,"asi":{"hypothesis":"Catalog filter metadata must name real payload fields; otherwise consumers receive a published filter contract that cannot be evaluated against the event payload.","result":"Catalog compatibility now checks all Inventory, Accounting, and Sales filterable fields against their actual Struct schema fields; correlation fields are already required to be filterable.","validation":"All sixteen readiness gates passed; full formatting, lint, type, skills, boundary, contract, and 117-test portfolio passed."}}
{"run":41,"commit":"ed7cf99","metric":17,"metrics":{"remaining_gates":0},"status":"keep","description":"Prove duplicate-safe consumer completion under concurrent PostgreSQL delivery.","timestamp":1786588403212,"segment":5,"confidence":6.8,"asi":{"hypothesis":"Sequential duplicate tests do not prove the receipt race; two concurrent deliveries must commit exactly one local effect and receipt while classifying the other as duplicate.","result":"The PostgreSQL consumeOnce proof now races two deliveries of the same event and verifies one winner, one duplicate, one derived event, and one durable receipt.","validation":"All seventeen readiness gates passed; full formatting, lint, type, skills, boundary, contract, and 117-test portfolio passed."}}
{"run":42,"commit":"ed7cf99","metric":17,"metrics":{"remaining_gates":1},"status":"checks_failed","description":"Prove the losing concurrent consumer rolls back a non-idempotent PostgreSQL-local mutation.","timestamp":1786588513965,"segment":5,"confidence":5.666666666666667,"asi":{"hypothesis":"The duplicate race must roll back a genuinely non-idempotent local mutation, because an idempotent derived-event append can mask a double execution defect.","rollback_reason":"The test imported the private messaging table, violating the repository rule that tests consume public contracts rather than persistence definitions.","next_action_hint":"Reapply the same transactional race using the public Database service with test-only SQL, without importing the private table schema."}}
{"run":43,"commit":"86266a3","metric":18,"metrics":{"remaining_gates":0},"status":"keep","description":"Prove the losing concurrent consumer rolls back a non-idempotent PostgreSQL-local mutation.","timestamp":1786588656262,"segment":5,"confidence":6,"asi":{"hypothesis":"The duplicate race must roll back a genuinely non-idempotent local mutation, because an idempotent derived-event append can mask a double execution defect.","result":"Two concurrent consumeOnce calls now race an increment inside the ambient transaction; the proof verifies one winner, one duplicate, one committed increment, and one receipt without importing private messaging tables.","validation":"All eighteen readiness gates passed; full formatting, lint, type, skills, boundary, contract, and 118-test portfolio passed."}}
{"run":44,"commit":"53b28be","metric":19,"metrics":{"remaining_gates":0},"status":"keep","description":"Prove a failed consumer can recover with the same receipt identity.","timestamp":1786588827936,"segment":5,"confidence":6.333333333333333,"asi":{"hypothesis":"Receipt rollback is incomplete evidence unless the same consumer and event can subsequently retry, commit its local effect, and record one completed receipt.","result":"The failed-consumer PostgreSQL proof now retries the same receipt identity after rollback and verifies one recovered derived event and one completed receipt.","validation":"All nineteen readiness gates passed; full formatting, lint, type, skills, boundary, contract, and 118-test portfolio passed."}}
{"run":45,"commit":"10a9220","metric":20,"metrics":{"remaining_gates":0},"status":"keep","description":"Prove transaction-aware event append is idempotent under concurrent retries.","timestamp":1786588971628,"segment":5,"confidence":6.666666666666667,"asi":{"hypothesis":"Sequential append replay does not prove the outbox uniqueness race; concurrent identical envelopes must converge on one stored event and the same returned envelope.","result":"The PostgreSQL messaging proof now races two identical append calls, verifies both return the same envelope, retains mismatch conflict behavior, and confirms one durable row.","validation":"All twenty readiness gates passed; full formatting, lint, type, skills, boundary, contract, and 118-test portfolio passed."}}
{"run":46,"commit":"b6c36c5","metric":21,"metrics":{"remaining_gates":0},"status":"keep","description":"Prove concurrent mismatched event envelopes fail with one typed conflict.","timestamp":1786589145693,"segment":5,"confidence":7,"asi":{"hypothesis":"Concurrent callers using the same event identity key with different envelopes must not both succeed; exactly one durable event and one typed idempotency conflict should result.","result":"The PostgreSQL messaging proof now races mismatched envelopes sharing one event type, version, and idempotency key, verifying one success, one EventIdempotencyConflict, and one outbox row.","validation":"All twenty-one readiness gates passed; full formatting, lint, type, skills, boundary, contract, and 119-test portfolio passed."}}
{"run":47,"commit":"4950951","metric":22,"metrics":{"remaining_gates":0},"status":"keep","description":"Prove messaging event and idempotency identities remain tenant-scoped.","timestamp":1786591923176,"segment":5,"confidence":6.285714285714286,"asi":{"hypothesis":"Tenant-scoped primary and deduplication keys must allow identical event IDs and idempotency keys in different tenants without cross-tenant conflict or envelope leakage.","result":"The PostgreSQL messaging proof concurrently appends identical event, aggregate, and idempotency identities for two tenants, verifies distinct tenant envelopes, and confirms two durable rows.","validation":"All twenty-two readiness gates passed; full formatting, lint, type, skills, boundary, contract, and 120-test portfolio passed.","observation":"Benchmark duration spiked to 527 seconds while correctness checks completed normally; no implementation change was made to optimize timing."}}
{"run":48,"commit":"0fd744c","metric":23,"metrics":{"remaining_gates":0},"status":"keep","description":"Prove cross-tenant consumer receipts fail without committing local effects.","timestamp":1786593440444,"segment":5,"confidence":5.75,"asi":{"hypothesis":"A consumer must not create a receipt for another tenant's event, and the foreign-key rejection must roll back any PostgreSQL-local effect attempted in the same transaction.","result":"The PostgreSQL messaging proof uses a tenant-mismatched receipt around a non-idempotent increment, verifies a stable DatabaseFailure, and confirms zero increments and zero receipts.","validation":"All twenty-three readiness gates passed; full formatting, lint, type, skills, boundary, contract, and 121-test portfolio passed."}}
{"run":49,"commit":"7f92bfc","metric":24,"metrics":{"remaining_gates":0},"status":"keep","description":"Prove distinct consumers independently complete the same event.","timestamp":1786593795323,"segment":5,"confidence":6,"asi":{"hypothesis":"Receipt deduplication must be scoped by consumer as well as event and tenant; separate consumers should each commit their own local effect and durable receipt.","result":"Two distinct consumers concurrently process one event, both complete as non-duplicates, and the PostgreSQL proof verifies two committed increments and two receipts.","validation":"All twenty-four readiness gates passed; full formatting, lint, type, skills, boundary, contract, and 122-test portfolio passed."}}
{"run":50,"commit":"fb578e4","metric":25,"metrics":{"remaining_gates":0},"status":"keep","description":"Prove concurrent event-ID collisions fail with one typed conflict.","timestamp":1786594062085,"segment":5,"confidence":6.25,"asi":{"hypothesis":"Within one tenant, an event ID must identify exactly one immutable envelope even when competing event types race; one append should win and the other return a stable idempotency conflict.","result":"The PostgreSQL messaging proof races two different event envelopes sharing one tenant-scoped event ID, verifies one success, one EventIdempotencyConflict, and one durable row.","validation":"All twenty-five readiness gates passed; full formatting, lint, type, skills, boundary, contract, and 123-test portfolio passed."}}
{"run":51,"commit":"460fcf8","metric":26,"metrics":{"remaining_gates":0},"status":"keep","description":"Prove event idempotency is scoped by event type and version.","timestamp":1786594318323,"segment":5,"confidence":5.777777777777778,"asi":{"hypothesis":"Because event identity is the type/version pair, the same tenant and idempotency key must permit distinct versions without false deduplication.","result":"The PostgreSQL messaging proof concurrently appends versions 1 and 2 of the same event type with one idempotency key and verifies both independent durable envelopes.","validation":"All twenty-six readiness gates passed; full formatting, lint, type, skills, boundary, contract, and 124-test portfolio passed."}}
{"run":52,"commit":"dc8b123","metric":27,"metrics":{"remaining_gates":0},"status":"keep","description":"Prove event idempotency is independently scoped by event type.","timestamp":1786594695656,"segment":5,"confidence":5.4,"asi":{"hypothesis":"Because event identity includes event type, the same tenant, version, and idempotency key must permit different event types without false deduplication.","result":"The PostgreSQL messaging proof concurrently appends Sales and Inventory event types at version 1 with one idempotency key and verifies both independent durable envelopes.","validation":"All twenty-seven readiness gates passed; full formatting, lint, type, skills, boundary, contract, and 125-test portfolio passed."}}
{"run":53,"commit":"b7f59b9","metric":28,"metrics":{"remaining_gates":0},"status":"keep","description":"Prove messaging append joins and rolls back with an ambient transaction.","timestamp":1786594983947,"segment":5,"confidence":5.6,"asi":{"hypothesis":"A transaction-aware append must join its caller's active PostgreSQL transaction; a later caller failure must roll back an append that had already returned success.","result":"The PostgreSQL messaging proof appends inside Database.withTransaction, fails afterward, preserves the typed outer failure, and verifies no outbox row commits.","validation":"All twenty-eight readiness gates passed; full formatting, lint, type, skills, boundary, contract, and 126-test portfolio passed."}}
{"run":54,"commit":"b6aa812","metric":29,"metrics":{"remaining_gates":0},"status":"keep","description":"Prove invalid event envelopes fail at the messaging schema boundary.","timestamp":1786595267007,"segment":5,"confidence":5.8,"asi":{"hypothesis":"Malformed envelopes must fail with a typed SchemaError before any durable outbox write, preserving the messaging trust boundary independently of database constraints.","result":"The PostgreSQL messaging proof submits event version zero, verifies a SchemaError, and confirms the outbox remains empty.","validation":"All twenty-nine readiness gates passed; full formatting, lint, type, skills, boundary, contract, and 127-test portfolio passed."}}
