{"run":336,"commit":"4c13caa","metric":252,"metrics":{"remaining_gates":0},"status":"keep","description":"Bound financial fact mapping versions to PostgreSQL integer range.","timestamp":1787224127002,"segment":5,"confidence":4.064516129032258,"asi":{"hypothesis":"Financial operation and transfer facts carry persisted positive PostgreSQL integer mapping versions, but the readiness schemas accepted int4 overflow; share the existing PositiveInt boundary and cover both public fact fields.","what_learned":"Both fact mapping-version fields now reject 2_147_483_648, the missing FinancialOperationFact import was corrected, the portfolio reaches 252 gates with zero remaining, and all checks pass.","next_action_hint":"Continue with one concrete current-ADR Accounting invariant; inspect remaining transfer/projection constraints without speculative infrastructure."}}
{"run":337,"commit":"5e41273","metric":253,"metrics":{"remaining_gates":0},"status":"keep","description":"Align public cutover control status metadata with database approval gates.","timestamp":1787224554759,"segment":5,"confidence":4.048,"asi":{"hypothesis":"PostgreSQL requires approval prerequisites for approved/activating/tigerbeetle controls and activation metadata for tigerbeetle, but FinancialCutoverControl accepted contradictory status metadata; mirror both existing checks.","what_learned":"FinancialCutoverControl now rejects missing approval prerequisites and missing tigerbeetle activation metadata, the portfolio reaches 253 gates with zero remaining, and all checks pass.","next_action_hint":"Continue with one concrete current-ADR Accounting state/constraint parity gap; preserve exact database semantics and avoid speculative activation changes."}}
{"run":338,"commit":"59e9218","metric":254,"metrics":{"remaining_gates":0},"status":"keep","description":"Validate public journal posted timestamps as persisted instants.","timestamp":1787225001973,"segment":5,"confidence":4.031746031746032,"asi":{"hypothesis":"Accounting journal postedAt is persisted as PostgreSQL timestamptz and public outputs already use Date.toISOString(), but JournalEntry accepted date-only and malformed timestamps; reuse Messaging's canonical instant schema.","what_learned":"JournalEntry.postedAt now rejects date-only and malformed strings, the portfolio reaches 254 gates with zero remaining, and all checks pass.","next_action_hint":"Continue with one concrete current-ADR Accounting timestamp or state invariant; avoid speculative timestamp ordering and gated infrastructure."}}
{"run":339,"commit":"5dd73df","metric":255,"metrics":{"remaining_gates":0},"status":"keep","description":"Validate cutover approval and activation timestamps as persisted instants.","timestamp":1787225309350,"segment":5,"confidence":4.0476190476190474,"asi":{"hypothesis":"FinancialCutoverControl approvedAt and activatedAt are nullable PostgreSQL timestamptz fields, but the public control schema accepted date-only and malformed strings; reuse the canonical instant schema while preserving nullability.","what_learned":"Both lifecycle timestamp fields now reject invalid timestamp shapes, the portfolio reaches 255 gates with zero remaining, and all checks pass.","next_action_hint":"Continue with one concrete current-ADR Accounting timestamp or state invariant; avoid speculative ordering changes."}}
{"run":340,"commit":"334a8a1","metric":256,"metrics":{"remaining_gates":0},"status":"keep","description":"Align verified checkpoint counts with the public schema.","timestamp":1787277368860,"segment":5,"confidence":4.063492063492063,"asi":{"hypothesis":"A public verified financial reconciliation checkpoint must reject nonzero mismatch or orphan counts, matching the existing PostgreSQL constraint.","what_learned":"The checkpoint DTO now mirrors the persisted verified-count invariant; a contract regression rejects verified mismatch evidence and the full backpressure portfolio passes.","next_action_hint":"Validate the persisted verification artifact createdAt instant next; avoid unrelated schema broadening."}}
{"run":341,"commit":"76f8e74","metric":257,"metrics":{"remaining_gates":0},"status":"keep","description":"Validate verification artifact creation timestamps.","timestamp":1787277662739,"segment":5,"confidence":4.047244094488189,"asi":{"hypothesis":"FinancialVerificationArtifact.createdAt must use the canonical timezone-qualified instant schema because it is persisted as timestamptz.","what_learned":"The public artifact DTO now rejects date-only and malformed creation timestamps; focused evidence and all backpressure checks pass.","next_action_hint":"Bound FinancialBalanceFact.mappingVersion to PostgreSQL int4 next."}}
{"run":342,"commit":"76f8e74","metric":257,"metrics":{"remaining_gates":1},"status":"checks_failed","description":"Bound financial balance fact mapping versions to PostgreSQL int4.","timestamp":1787277703500,"segment":5,"confidence":4.015625,"asi":{"hypothesis":"FinancialBalanceFact.mappingVersion must reuse the bounded PositiveInt schema used by operation and transfer facts.","rollback_reason":"The implementation was semantically correct but repository formatting rejected the import order, so the candidate was automatically reverted.","next_action_hint":"Reapply the same minimal source/test/gate change with FinancialBalanceFact sorted before the lowercase imports, then rerun."}}
{"run":343,"commit":"be59a40","metric":258,"metrics":{"remaining_gates":0},"status":"keep","description":"Bound financial balance fact mapping versions to PostgreSQL int4.","timestamp":1787277961351,"segment":5,"confidence":4.03125,"asi":{"hypothesis":"FinancialBalanceFact.mappingVersion must reuse the bounded PositiveInt schema used by operation and transfer facts.","what_learned":"The balance fact now rejects int4 overflow; contract evidence covers the public field and the complete validation portfolio passes.","next_action_hint":"Validate AccountingConfiguration UUID identities next."}}
{"run":344,"commit":"3922083","metric":259,"metrics":{"remaining_gates":0},"status":"keep","description":"Validate accounting configuration UUID identities.","timestamp":1787278214839,"segment":5,"confidence":4.046875,"asi":{"hypothesis":"AccountingConfiguration tenant and legal-entity identities must reject non-UUID values before exposing persisted configuration.","what_learned":"Both configuration identity fields now reuse the existing UUID schema; one contract test covers both and all checks pass.","next_action_hint":"Validate public Account UUID identities next."}}
{"run":345,"commit":"d3c78d9","metric":260,"metrics":{"remaining_gates":0},"status":"keep","description":"Validate public Account UUID identities.","timestamp":1787278475806,"segment":5,"confidence":4.0310077519379846,"asi":{"hypothesis":"Public Account id and tenantId must reject non-UUID values because both map to persisted UUID columns.","what_learned":"Account identity fields now reuse Uuid and a compact field-loop regression covers both; all backpressure checks pass.","next_action_hint":"Validate JournalLine.accountId next."}}
{"run":346,"commit":"d3c78d9","metric":260,"metrics":{"remaining_gates":1},"status":"checks_failed","description":"Validate JournalLine account UUID identities.","timestamp":1787278721641,"segment":5,"confidence":4.0625,"asi":{"hypothesis":"JournalLine.accountId must reject non-UUID values because the persisted journal-line account foreign key is UUID-backed.","rollback_reason":"The new contract correctly rejected a legacy API test fixture using accountId \"account\"; full checks failed before acceptance and the candidate was reverted.","next_action_hint":"Reapply the schema/test change and update apps/api/mod.test.ts to use a valid UUID while preserving its exact-large-amount assertion."}}
{"run":347,"commit":"179a64a","metric":261,"metrics":{"remaining_gates":0},"status":"keep","description":"Validate JournalLine account UUID identities.","timestamp":1787278959910,"segment":5,"confidence":4.046511627906977,"asi":{"hypothesis":"JournalLine.accountId must reject non-UUID values because the persisted journal-line account foreign key is UUID-backed.","what_learned":"The public line schema now validates UUID account identities; the API amount-boundary fixture was corrected to a valid UUID and all checks pass.","next_action_hint":"Validate JournalEntry id and reversal identities for the seventh and final requested gate."}}
{"run":348,"commit":"06cf660","metric":262,"metrics":{"remaining_gates":0},"status":"keep","description":"Validate public JournalEntry UUID identities.","timestamp":1787279204674,"segment":5,"confidence":4.030769230769231,"asi":{"hypothesis":"JournalEntry id, tenantId, and optional reversal identity must reject non-UUID values because all three are UUID-backed persistence fields.","what_learned":"The journal-entry DTO now validates all persisted UUID identities; reversal-state fixtures use valid identities so they still test the intended cross-field invariant, and all checks pass.","next_action_hint":"Stop after the seventh requested readiness gate and finalize the branch for merge/push."}}
{"run":349,"commit":"dd5c281","metric":263,"metrics":{"remaining_gates":0},"status":"keep","description":"Validate public AccountingPeriod UUID identities.","timestamp":1787279675667,"segment":5,"confidence":4.015267175572519,"asi":{"hypothesis":"AccountingPeriod id, tenantId, and legalEntityId must reject non-UUID values because all three public facts map directly to persisted UUID columns.","what_learned":"The public period DTO now reuses the existing Uuid schema for all persisted identities; the date-ordering regression was updated with valid identities so it still isolates the intended invariant, and the full backpressure portfolio passes.","next_action_hint":"Audit RevenuePostingProfile persisted UUID identities next, keeping input compatibility separate from output DTO hardening."}}
{"run":350,"commit":"7c177c9","metric":264,"metrics":{"remaining_gates":0},"status":"keep","description":"Validate public RevenuePostingProfile UUID identities.","timestamp":1787279944446,"segment":5,"confidence":4.061538461538461,"asi":{"hypothesis":"RevenuePostingProfile tenant, legal-entity, receivable-account, and revenue-account identities must reject non-UUID values because every public field maps directly to a persisted UUID column or foreign key.","what_learned":"The public profile DTO now reuses Uuid for all four persisted identities; the distinct-account regression uses valid UUIDs so it still isolates the database relationship, and all backpressure checks pass.","next_action_hint":"Audit remaining public Accounting DTO identity fields or nonempty text constraints, without widening command-input compatibility speculatively."}}
{"run":351,"commit":"dc7629a","metric":265,"metrics":{"remaining_gates":0},"status":"keep","description":"Reuse journal-line invariants for financial intents.","timestamp":1787280275351,"segment":5,"confidence":4.0458015267175576,"asi":{"hypothesis":"CreateFinancialJournalIntentInput must reject zero-sided and double-sided lines before persistence, matching the journal_lines_amount_check constraint.","what_learned":"FinancialOperationJournalLine now reuses the canonical JournalLine schema instead of duplicating a weaker shape; command decoding rejects both invalid amount combinations and the full backpressure portfolio passes.","next_action_hint":"Finalize the requested autoresearch work; no further iteration is needed unless explicitly requested."}}
{"run":352,"commit":"ec7d5e4","metric":266,"metrics":{"remaining_gates":0},"status":"keep","description":"Validate financial fact account UUID identities.","timestamp":1787280631140,"segment":5,"confidence":4.03030303030303,"asi":{"hypothesis":"Financial transfer and balance fact account identities must reject non-UUID values because they are derived from and reconciled against UUID-backed accounting accounts.","what_learned":"FinancialTransferFact debit/credit accounts and FinancialBalanceFact accountId now share the canonical Uuid schema; the self-transfer regression uses a valid UUID so it still isolates account distinctness, and all backpressure checks pass.","next_action_hint":"Continue only with another concrete persisted/public fact mismatch; do not duplicate service-level business validation solely to add a benchmark gate."}}
{"run":353,"commit":"7a350d3","metric":266,"metrics":{"remaining_gates":0},"status":"discard","description":"Reconfirm the 266-gate baseline before continuing the P3 hardening loop.","timestamp":1787312363980,"segment":5,"confidence":4.061068702290076,"asi":{"hypothesis":"The current committed tree remains the 266-gate zero-remaining baseline after the requested continuation; a fresh full measurement should establish a clean starting point.","rollback_reason":"No candidate change was made and the metric was unchanged.","next_action_hint":"Inspect remaining Accounting public contracts for one concrete persisted-boundary mismatch; do not add speculative infrastructure."}}
{"run":354,"commit":"d72cbc7","metric":267,"metrics":{"remaining_gates":-1},"status":"keep","description":"Enforce nonblank persisted financial operation identities.","timestamp":1787312849263,"segment":5,"confidence":4.045454545454546,"asi":{"hypothesis":"FinancialOperation.operationId is a public nonempty idempotency identity, but PostgreSQL only enforced NOT NULL and uniqueness; a whitespace value could bypass the public boundary through direct persistence or corrupted input.","what_learned":"Added the owning Accounting check and generated migration, a public schema regression, and a PostgreSQL insert regression proving blank IDs are rejected. The benchmark total still needs to be incremented from 266 to 267 because the new gate reports remaining_gates=-1.","next_action_hint":"Correct .auto/measure.sh total to 267, rerun the full portfolio, then continue with another concrete persisted/public invariant only if the corrected baseline remains green."}}
{"run":355,"commit":"e69a47c","metric":267,"metrics":{"remaining_gates":0},"status":"keep","description":"Correct the readiness benchmark total after adding the persisted operation-ID gate.","timestamp":1787313068638,"segment":5,"confidence":4.045454545454546,"asi":{"hypothesis":"The new gate was valid but .auto/measure.sh still declared the old 266-gate total, producing a false -1 remaining-gates result.","what_learned":"The total now matches the 267 passing gates; the complete validation portfolio remains green with zero remaining gates.","next_action_hint":"Inspect only for another concrete current-ADR persisted/public invariant; stop speculative gate creation if no defensible mismatch remains."}}
{"run":356,"commit":"9f274ae","metric":267,"metrics":{"remaining_gates":0},"status":"discard","description":"Align Drizzle journal-line nullability with the persisted invariant.","timestamp":1787356052726,"segment":5,"confidence":4.045454545454546,"asi":{"hypothesis":"Making journal_lines.debit and credit explicitly notNull in db/schema/accounting.ts should reconcile the source schema with the existing migration snapshot and strengthen source-of-truth parity.","result":"The full 267-gate portfolio and backpressure checks passed, but the primary metric remained 267 because the database snapshot and public JournalLine contract already enforce this invariant.","rollback_reason":"No primary metric improvement; the candidate was redundant with the existing persisted/public invariant.","next_action_hint":"Inspect only for another concrete current-ADR source/public/persistence mismatch; do not add a gate for an invariant already covered."}}
{"run":357,"commit":"3f4f790","metric":268,"metrics":{"remaining_gates":0},"status":"keep","description":"Preserve rejected financial operation status in reconciliation facts.","timestamp":1787356540262,"segment":5,"confidence":4.030075187969925,"asi":{"hypothesis":"FinancialOperationFact must accept the persisted Accounting status \"rejected\"; omitting it makes a valid rejected operation fail at the public verification snapshot boundary.","result":"Added the rejected status to FinancialOperationFact, added an @effect/vitest regression, and added the corresponding readiness gate. The full 268-gate portfolio and backpressure checks passed.","next_action_hint":"Continue with another concrete public-fact versus persisted-constraint mismatch only; stop if the remaining audit finds no defensible gap."}}
{"run":358,"commit":"5df1620","metric":269,"metrics":{"remaining_gates":0},"status":"keep","description":"Reject blank persisted financial-operation metadata.","timestamp":1787357482137,"segment":5,"confidence":4.014925373134329,"asi":{"hypothesis":"FinancialOperation exposes engineAcceptedAt, rejectionReason, recoveryReason, and lastError as nullable nonempty strings, but PostgreSQL accepted blank non-null values; four owner-level checks close that persistence/public-contract gap.","result":"Added four Accounting check constraints, generated migration and snapshot, public schema regression coverage, and PostgreSQL constraint-name regressions. The full 269-gate portfolio and backpressure checks passed.","preflight":"Existing-row preflight was skipped because psql/DATABASE_URL was unavailable; apply the migration only after reviewing existing data in an environment with DATABASE_URL.","next_action_hint":"Audit one more concrete persisted/public mismatch, but avoid speculative constraints and do not claim the new migration is applied."}}
{"type":"config","name":"Validate the RITSEI analytic-plane architecture","metricName":"analytic_architecture_gates","metricUnit":"","bestDirection":"higher"}
{"run":359,"commit":"3d3bd44","metric":0,"metrics":{"remaining_gates":12},"status":"keep","description":"Baseline the analytic-plane documentation gates before adding the architecture decision and references.","timestamp":1787358303506,"segment":6,"confidence":null,"asi":{"hypothesis":"The current repository has no canonical analytic-plane owner, ADR, or comparative reference, so all twelve documentation gates should be open.","result":"All twelve analytic-plane documentation gates are open while the existing repository validation portfolio passes."}}
{"run":360,"commit":"67237cf","metric":12,"metrics":{"remaining_gates":0},"status":"keep","description":"Adopt and document the provider-independent RITSEI Analytic Plane with verified external references and executable gates.","timestamp":1787358910574,"segment":6,"confidence":null,"asi":{"hypothesis":"A bounded ADR, canonical subsystem owner, and primary-source comparison can accept the semantic projection idea without introducing a fourth workload class or activating speculative providers.","result":"All twelve architecture gates pass: domain-owned fact contracts, versioned metric semantics, snapshot-plus-replay rebuilds, explicit freshness, no-primary-fallback, provider gates, navigation, deployment mapping, and validation proofs are documented; the full repository checks pass.","sources_reviewed":"Odoo, SAP, Airbnb Minerva, Uber uMetric and Pinot, LinkedIn UMP and Pinot, BigQuery, Meta ingestion and Scuba, ClickHouse, Apache Iceberg, DuckDB","non_decisions":"No analytics package, schema, API, DSL, broker, ClickHouse, Pinot, Iceberg, DuckDB, or warehouse was activated."}}
{"run":361,"commit":"0c9789e","metric":13,"metrics":{"remaining_gates":0},"status":"keep","description":"Keep the analytic-plane documentation change surgical by removing repository-wide Markdown reformatting.","timestamp":1787359271882,"segment":6,"confidence":null,"asi":{"hypothesis":"Restoring existing documents to their prior formatting while retaining only targeted analytic-plane edits will reduce review noise without losing any architecture gate.","result":"The net change against the pre-analytic baseline is limited to the three new documents and 171 targeted changed lines across existing architecture/navigation files; all thirteen gates and the full repository checks pass.","next_action_hint":"Review only semantic content; no formatter-driven churn remains in existing documents."}}
{"run":362,"commit":"4d9ae0a","metric":14,"metrics":{"remaining_gates":0},"status":"keep","description":"Align workload-isolation references with the current ADR-0040 financial-authority boundary.","timestamp":1787359465036,"segment":6,"confidence":14,"asi":{"hypothesis":"The analytics work exposed two stale PostgreSQL-only authority statements in directly related isolation documents; qualifying them with the accepted financial exception removes a source-of-truth contradiction.","result":"Workload isolation now names approved business authority, PostgreSQL for control-plane and non-ledger facts, and ADR-0040 for activated financial authority; all fourteen gates and repository checks pass.","next_action_hint":"No further provider or implementation work is justified until a measured dashboard requires the first Business Fact Contract."}}
{"run":363,"commit":"0877575","metric":15,"metrics":{"remaining_gates":0},"status":"keep","description":"Reconcile runtime reference documents with the accepted ADR-0040 financial-authority exception.","timestamp":1787359670171,"segment":6,"confidence":15,"asi":{"hypothesis":"Three runtime comparison references still repeated the superseded PostgreSQL-only business-authority model and should distinguish control-plane/non-ledger facts from activated financial authority.","result":"Accidental-duplication, engineering-lineage, and ERP-runtime comparison references now preserve PostgreSQL authority for control-plane/non-ledger facts and defer activated financial authority to ADR-0040; all fifteen gates and repository checks pass.","next_action_hint":"Stop architectural expansion here; implement only after a measured analytic use case supplies concrete fact, metric, and freshness requirements."}}
