{"type":"config","name":"Complete EclipseERP P0-P3 primitive roadmap","metricName":"accepted_gates","metricUnit":"","bestDirection":"higher"}
{"run":1,"commit":"78ede91","metric":3,"metrics":{"remaining_gates":7},"status":"checks_failed","description":"Baseline P0-P3 acceptance scan; existing migration snapshot ancestry check fails before implementation changes.","timestamp":1786547148120,"segment":0,"confidence":null,"asi":{"hypothesis":"Establish objective baseline before implementing roadmap gates.","rollback_reason":"Repository baseline contract suite has a migration snapshot ancestry mismatch unrelated to the new autoresearch harness.","next_action_hint":"Diagnose and repair the existing migration snapshot chain first so later improvements can be kept.","failing_check":"packages/kernel/tests/migrations.test.ts snapshot prevIds mismatch"}}
{"run":2,"commit":"78ede91","metric":4,"metrics":{"remaining_gates":6},"status":"checks_failed","description":"Reconciled order confirmation with ADR-0033 and repaired migration ancestry; process PostgreSQL tests exposed an accounting period date bug.","timestamp":1786547696050,"segment":0,"confidence":null,"asi":{"hypothesis":"Server-derived order lines and accounting profiles will close the ADR-0033 reconciliation gate.","rollback_reason":"Accounting period lookup still reports closed despite an open 2000-2099 period; changes reverted by experiment harness.","next_action_hint":"Fix utcDate: tests run with the Effect test clock at epoch, so posting date resolves to 1970-01-01. Use a provided current date/test clock or open period covering epoch in process tests, then reapply the captured ADR-0033 diff.","learned":"The production service uses Clock.Clock, and @effect/vitest supplies a test clock unless explicitly live; date-sensitive PostgreSQL tests must control/provide clock intentionally."}}
{"run":3,"commit":"6accf93","metric":4,"metrics":{"remaining_gates":6},"status":"keep","description":"Align order confirmation with ADR-0033 and repair the migration snapshot ancestry chain.","timestamp":1786547912213,"segment":0,"confidence":null,"asi":{"hypothesis":"Server-derived order lines and accounting posting close the superseded workflow gap without broadening architecture.","result":"Process now reserves Sales-owned lines, derives revenue from order total, and no longer accepts client journal facts; tests and repository checks pass.","test_clock_note":"Date-sensitive @effect/vitest integration fixtures cover the epoch-based test clock explicitly."}}
{"run":4,"commit":"6accf93","metric":4,"metrics":{"remaining_gates":6},"status":"discard","description":"Reconciled P0 and roadmap wording, but the current coarse metric already counted the conditional P0 readiness sentence.","timestamp":1786547994387,"segment":0,"confidence":null,"asi":{"hypothesis":"Explicit P0 closure and roadmap reconciliation would close an uncounted acceptance gate.","rollback_reason":"No primary metric improvement because the harness's P0 grep already treated 'P0 is READY only when...' as closure.","next_action_hint":"Bundle these documentation corrections with the next substantive P1 improvement, and later tighten the harness wording check without claiming a standalone gain.","useful_changes":"P0 explicit READY status; fiscal periods PARTIAL; process distinguished from Process Studio."}}
{"run":5,"commit":"d5865da","metric":5,"metrics":{"remaining_gates":5},"status":"keep","description":"Accept the P1 inventory primitive baseline and reconcile P0/roadmap status.","timestamp":1786548163595,"segment":0,"confidence":null,"asi":{"hypothesis":"A narrow discrete-stock baseline resolves P1 without speculative conversion, traceability, valuation, or location hierarchy.","result":"ADR-0035 defines Item UOM, whole quantities, warehouse location, non-negative stock, append-only correction, and explicit non-goals; P0 is explicitly closed and roadmap drift is corrected.","deferred":"Implementation of UOM DTOs and idempotent correction command remains the next gate."}}
{"run":6,"commit":"d5865da","metric":6,"metrics":{"remaining_gates":4},"status":"checks_failed","description":"Implemented P1 UOM and correction semantics; one PostgreSQL assertion still queried the removed enum value.","timestamp":1786550431789,"segment":0,"confidence":4,"asi":{"hypothesis":"An idempotent signed adjustment command plus immutable item UOM closes the P1 implementation gate.","rollback_reason":"The integration test counted corrections with kind='adjustment' after implementation intentionally encoded correction direction as existing receipt/issue kinds to avoid unsafe same-transaction enum evolution.","next_action_hint":"Reapply/retain the P1 patch and change the movement-count assertion to filter by correction idempotency key or non-null correction metadata, then rerun.","migration_learning":"Using existing receipt/issue direction plus correction metadata avoids PostgreSQL's unsafe-use-of-new-enum-value migration failure."}}
{"run":7,"commit":"c58f66a","metric":6,"metrics":{"remaining_gates":4},"status":"keep","description":"Implement immutable Item UOM and idempotent append-oriented stock corrections for the P1 baseline.","timestamp":1786550814226,"segment":0,"confidence":3,"asi":{"hypothesis":"A single-unit discrete-stock contract and signed idempotent correction command provide the minimum executable P1 proof.","result":"Inventory now defaults/normalizes UOM, validates correction units, serializes negative corrections against reserved stock, and preserves correction history with tenant-scoped idempotency.","validation":"Inventory unit/PostgreSQL tests, migration catalog, db check, boundary lint, type check, and contract checks passed.","migration_design":"Corrections reuse receipt/issue movement direction plus correction metadata, avoiding a PostgreSQL enum migration transaction hazard."}}
{"run":8,"commit":"a0a17af","metric":7,"metrics":{"remaining_gates":3},"status":"keep","description":"Define and enforce the P2 document, fixed-scale money, revenue period, and reversal baseline.","timestamp":1786551275407,"segment":0,"confidence":4,"asi":{"hypothesis":"Owner-local documents plus a fixed two-decimal Legal Entity posting baseline resolve P2 without inventing invoice, payment, tax, or settlement policy.","result":"ADR-0036 establishes document/correction ownership; accounting now enforces precision 2 at Schema and PostgreSQL boundaries with open/closed-period and idempotent reversal proofs.","validation":"Focused accounting contract/PostgreSQL tests, migration checks, boundary checks, type checks, and repository contract checks passed.","explicit_non_goals":"Tax, AP/AR, invoices, payments, settlement, reopen, adjusting periods, FX, and multi-currency remain unpublished until separately decided."}}
{"run":9,"commit":"e7c7d00","metric":9,"metrics":{"remaining_gates":1},"status":"keep","description":"Define the P3 boundary and add neutral typed catalog contracts with Inventory and Accounting contributors.","timestamp":1786552045060,"segment":0,"confidence":6,"asi":{"hypothesis":"A contract-only catalog leaf plus domain-owned declarations resolves catalog ownership without coupling domains to Process Studio.","result":"ADR-0037 distinguishes business audit authority, declarations, aggregation, delivery intent, receipts, PgQue gates, and external adapters; Inventory and Accounting action/event schemas now have compatibility tests.","current_limit":"Domain events remain EXPERIMENTAL until owner-controlled transaction-aware publication exists; Process event was renamed to process.order_confirmation.completed to stop coordinator impersonation.","validation":"Catalog compatibility, boundary, type, and contract checks passed."}}
{"run":10,"commit":"eabac71","metric":10,"metrics":{"remaining_gates":0},"status":"keep","description":"Complete the initial P0-P3 acceptance portfolio with explicit period-close concurrency evidence.","timestamp":1786552117105,"segment":0,"confidence":4.666666666666667,"asi":{"hypothesis":"The existing close/post race test is the concrete P2 transactional-period proof; naming it explicitly makes the acceptance harness reflect the real evidence.","result":"All ten initial acceptance gates now pass with repository correctness checks.","important_remaining_work":"Do not stop: P3 events are still EXPERIMENTAL, owner-controlled transaction-aware publication and durable completed consumer receipts remain to implement before claiming P3 READY."}}
{"type":"config","name":"Close EclipseERP P3 and ADR-0033 runtime gaps","metricName":"p3_ready_gates","metricUnit":"","bestDirection":"higher"}
{"run":11,"commit":"0e3e86a","metric":0,"metrics":{"remaining_gates":7},"status":"keep","description":"Baseline remaining P3 and ADR-0033 runtime readiness gaps.","timestamp":1786552254153,"segment":1,"confidence":null,"asi":{"hypothesis":"Re-baseline after completing the initial P0-P3 decision portfolio.","result":"None of the seven stricter runtime-readiness gates pass yet.","harness_issue":"The P3 READY grep used backticks inside double quotes and emitted a harmless shell substitution error; fix before next run."}}
{"run":12,"commit":"a7d18bf","metric":1,"metrics":{"remaining_gates":6},"status":"keep","description":"Add the transaction-aware internal messaging outbox and completed consumer receipt foundation.","timestamp":1786553113600,"segment":1,"confidence":null,"asi":{"hypothesis":"A dedicated messaging infrastructure package can own event envelopes and duplicate-safe local consumption without owning business event meaning.","result":"Messaging now appends idempotent typed envelopes and commits PostgreSQL-local consumer effects with completed receipts in one transaction; duplicate and rollback tests pass.","scope_boundary":"consumeOnce explicitly excludes external exactly-once claims; provider effects still require provider idempotency and outcome reconciliation.","validation":"Focused unit/PostgreSQL tests, migrations, DB check, boundary lint, type check, and contract checks passed."}}
{"run":13,"commit":"3268d9a","metric":2,"metrics":{"remaining_gates":5},"status":"keep","description":"Route Process-owned lifecycle events through Messaging with distinct command, correlation, causation, and idempotency metadata.","timestamp":1786553461628,"segment":1,"confidence":null,"asi":{"hypothesis":"Replacing direct outbox writes with the public MessagingService preserves the shared transaction while separating execution identities.","result":"Order confirmation appends a Process-owned event through Messaging; API composition and PostgreSQL tests verify distinct metadata and the messaging outbox.","validation":"Full type, contract, boundary, and test checks passed."}}
{"run":14,"commit":"f119778","metric":3,"metrics":{"remaining_gates":4},"status":"keep","description":"Publish Inventory stock correction events atomically from the owning command path.","timestamp":1786554358600,"segment":1,"confidence":3,"asi":{"hypothesis":"Injecting MessagingService into Inventory lets stock correction and its owner event commit or roll back together without domain access to messaging tables.","result":"adjustStock now carries distinct execution identities, emits one PUBLIC inventory.stock.corrected event on creation, skips publication on idempotent replay, and rolls back balance/movement when append fails.","validation":"Atomic publication, idempotency, rollback, catalog compatibility, type, contract, and boundary checks passed."}}
{"run":15,"commit":"eabc012","metric":4,"metrics":{"remaining_gates":3},"status":"keep","description":"Publish Accounting revenue-posted events atomically from the owning command path.","timestamp":1786555244128,"segment":1,"confidence":4,"asi":{"hypothesis":"Mirroring Inventory's transaction-aware publication lets Accounting own a process-safe revenue event without coordinator impersonation.","result":"postRevenueForOrder carries distinct execution identities, emits one PUBLIC accounting.revenue.posted event only on creation, and rolls back journal lines when append fails.","validation":"Accounting unit/PostgreSQL atomic publication tests, process/bootstrap integration, catalog compatibility, type, contract, and boundary checks passed."}}
{"run":16,"commit":"f90808b","metric":5,"metrics":{"remaining_gates":2},"status":"keep","description":"Make the durable duplicate-event and consumer-receipt rollback proofs explicit.","timestamp":1786555299542,"segment":1,"confidence":5,"asi":{"hypothesis":"The messaging implementation already satisfies the receipt gate; explicit test names should make the proof discoverable without changing semantics.","result":"Unit and PostgreSQL tests now clearly identify duplicate event suppression and consumer receipt rollback behavior.","validation":"Repository correctness checks passed."}}
{"run":17,"commit":"f5589fe","metric":6,"metrics":{"remaining_gates":1},"status":"keep","description":"Complete ADR-0033 atomic order cancellation and fulfillment workflows.","timestamp":1786556771543,"segment":1,"confidence":4,"asi":{"hypothesis":"The stored successful confirmation result is sufficient to coordinate cancellation/fulfillment without adding new tables or expanding Sales status.","result":"Process now persists idempotent cancellation/fulfillment runs, invokes only public owner commands, appends Process lifecycle events/jobs, and preserves atomic rollback when fulfilled reservations block cancellation.","validation":"116 tests plus type, contract, boundary, and API checks passed.","deliberate_scope":"Sales order remains confirmed after fulfillment; Inventory owns the fulfilled reservation fact, while a later Sales fulfillment status requires a separate owner decision."}}
{"run":18,"commit":"f5589fe","metric":7,"metrics":{"remaining_gates":0},"status":"checks_failed","description":"Reconciled P3 readiness and retired the legacy Process outbox, but snapshot merge produced invalid JSON.","timestamp":1786557390160,"segment":1,"confidence":3,"asi":{"hypothesis":"Final documentation, catalog semantics, and fail-closed legacy outbox retirement close the last readiness gate.","rollback_reason":"The custom migration snapshot was corrupted by a compacted jq output containing an ellipsis marker, so migration integrity tests failed.","next_action_hint":"Reapply the final changes, generate a clean temporary current-schema snapshot, and merge JSON using a small Deno script or direct file processing that cannot compact output; validate JSON before running checks.","important_changes_to_reapply":"ADR-0038; current-vs-target messaging architecture; P3 bounded READY and two Level 3 slices; catalog preconditions/effects/delivery/sensitivity; fail-closed legacy Process outbox migration."}}
{"run":19,"commit":"7ec4fad","metric":7,"metrics":{"remaining_gates":0},"status":"keep","description":"Finalize bounded P3 readiness, Level 3 catalog slices, and safe retirement of the legacy Process outbox.","timestamp":1786558072732,"segment":1,"confidence":3.5,"asi":{"hypothesis":"Explicit catalog semantics, truthful current-vs-target messaging docs, and a fail-closed ownership migration complete P3 without overclaiming PgQue or Process Studio.","result":"P3 is READY for the bounded PostgreSQL-internal baseline; inventory.stock.adjust v1 and accounting.revenue.post v1 are documented Level 3 slices; Process outbox retirement refuses non-empty legacy data.","validation":"All seven readiness gates and repository correctness checks passed.","remaining_gates":"PgQue activation, external connectors, Process aggregation/release persistence, Process IR/runtime/event waits, and deployment retention policy remain deliberately outside this readiness claim."}}
{"type":"config","name":"Harden P3 full-repository validation and canonical consistency","metricName":"p3_ready_gates","metricUnit":"","bestDirection":"higher"}
{"run":20,"commit":"7ec4fad","metric":6,"metrics":{"remaining_gates":1},"status":"checks_failed","description":"Tighten the P3 readiness benchmark to require the repository's full validation portfolio.","timestamp":1786559179623,"segment":2,"confidence":null,"asi":{"hypothesis":"Gate 7 should require formatting, linting, skills, boundary, contract, and type checks rather than type checking alone.","rollback_reason":"The tightened benchmark exposed two unformatted Party files and twelve immutable generated migration snapshots without trailing newlines.","next_action_hint":"Exclude immutable Drizzle snapshot artifacts from Deno formatting, format the two Party source/test files, then reconcile the canonical documentation contradictions found by final audit."}}
{"run":21,"commit":"270afdf","metric":7,"metrics":{"remaining_gates":0},"status":"keep","description":"Make the final P3 gate require full validation and remove unsafe Accounting action-catalog overclaims.","timestamp":1786559425875,"segment":2,"confidence":null,"asi":{"hypothesis":"Full repository validation plus truthful catalog release state will close the hardened P3 gate without weakening domain behavior.","result":"Formatting, lint, type, skill, boundary, and contract checks pass; immutable Drizzle snapshots are excluded from formatting; Accounting retains its PUBLIC owner event but its caller-supplied-amount action is no longer catalog-released.","validation":"All seven hardened readiness gates passed, including the complete AGENTS validation portfolio.","architecture_reconciliation":"Corrected Sales lifecycle, Messaging outbox ownership, repository/package inventory, PostgreSQL schema registry, and Level 3 roadmap claims."}}
{"type":"config","name":"Resolve final P3 ADR and roadmap contradictions","metricName":"p3_ready_gates","metricUnit":"","bestDirection":"higher"}
{"run":22,"commit":"7befeb4","metric":6,"metrics":{"remaining_gates":1},"status":"keep","description":"Baseline the final ADR supersession and roadmap consistency checks with the full 117-test suite.","timestamp":1786559727997,"segment":3,"confidence":null,"asi":{"hypothesis":"A final canonical audit should require ADR-0033 to point to ADR-0038 and the Sales roadmap to distinguish owner state from coordinated fulfillment.","result":"All mechanical checks and 117 tests pass; one documentation consistency gate remains.","next_action_hint":"Annotate ADR-0033's partial supersession and update the Sales maturity row without rewriting the historical decision."}}
{"run":23,"commit":"e74b0cc","metric":7,"metrics":{"remaining_gates":0},"status":"keep","description":"Reconcile ADR-0033's partial supersession and the Sales fulfillment roadmap boundary.","timestamp":1786559852250,"segment":3,"confidence":null,"asi":{"hypothesis":"Explicit supersession metadata and owner/coordinator wording remove the last canonical contradiction without changing accepted lifecycle semantics.","result":"ADR-0033 now points to ADR-0038 for outbox ownership while preserving its historical text, and Sales maturity distinguishes order state ownership from Process-coordinated Inventory fulfillment.","validation":"All seven gates, full formatting/lint/type/boundary/contract checks, and all 117 tests passed."}}
{"type":"config","name":"Resolve remaining Process Studio delivery wording","metricName":"p3_ready_gates","metricUnit":"","bestDirection":"higher"}
{"run":24,"commit":"74a93e6","metric":6,"metrics":{"remaining_gates":1},"status":"keep","description":"Baseline the remaining Process Studio event-delivery wording against the current Messaging implementation.","timestamp":1786560215904,"segment":4,"confidence":null,"asi":{"hypothesis":"ADR-0018 should distinguish the current Messaging outbox from the gated future PgQue adapter.","result":"All code and validation checks pass; one historical Process Studio wording gate remains.","next_action_hint":"Update ADR-0018's current-state context and delivery sentence while preserving PgQue as the selected future fan-out adapter."}}
{"run":25,"commit":"6dfea21","metric":7,"metrics":{"remaining_gates":0},"status":"keep","description":"Clarify current Messaging delivery and gated future PgQue fan-out in ADR-0018.","timestamp":1786560338840,"segment":4,"confidence":null,"asi":{"hypothesis":"Updating the Process Studio ADR's delivery wording removes the last current-vs-target contradiction without changing the accepted catalog decision.","result":"ADR-0018 now identifies Messaging outbox/receipts as current delivery and PgQue as the selected future adapter after activation gates.","validation":"All seven gates, full validation checks, and all 117 tests passed."}}
{"run":26,"commit":"6dfea21","metric":7,"metrics":{"remaining_gates":0},"status":"discard","description":"Re-run the fully hardened P3 portfolio after targeted messaging, lifecycle, migration, catalog, and canonical-document audits.","timestamp":1786560480375,"segment":4,"confidence":null,"asi":{"hypothesis":"A final independent audit and repeat run may expose another in-scope readiness defect.","rollback_reason":"No primary improvement was possible: all seven hardened gates and all 117 tests remained green, and no additional material in-scope defect was found.","next_action_hint":"Stop this bounded P3 objective; remaining ideas require PgQue activation, a second Level 3 action provider, Accounting amount provenance, external connectors, or Process Studio runtime work, all outside the current scope."}}
{"type":"config","name":"Add Sales order confirmation as the second Level 3 provider","metricName":"p3_ready_gates","metricUnit":"","bestDirection":"higher"}
