{"run":206,"commit":"6240757","metric":148,"metrics":{"remaining_gates":0},"status":"keep","description":"Reject cross-tenant Inventory transfer references.","timestamp":1786919860692,"segment":5,"confidence":4.625,"asi":{"hypothesis":"An Inventory transfer command under one tenant must not resolve warehouses owned by another tenant, even when the caller has capabilities in both tenants.","result":"Added a PostgreSQL transfer test using tenant B with tenant A warehouse references and asserted StockTransferWarehouseNotFound; full benchmark and backpressure checks passed.","next_action_hint":"Continue with another distinct tenant-scoped invariant or bounded rollback/idempotency gap, avoiding replay metadata and already-covered concurrency cases."}}
{"run":207,"commit":"945c145","metric":149,"metrics":{"remaining_gates":0},"status":"keep","description":"Reject cross-tenant Inventory reservation operations.","timestamp":1786920032930,"segment":5,"confidence":4.584615384615384,"asi":{"hypothesis":"Inventory release and fulfillment must not resolve or mutate a reservation owned by another tenant, even when the caller is authorized in both tenants.","result":"Added release and fulfillment attempts against a tenant-A reservation under tenant B and asserted StockReservationNotFound for both; full benchmark and backpressure checks passed.","next_action_hint":"Continue with another distinct tenant-scoped invariant or bounded rollback/idempotency gap, avoiding replay metadata and already-covered concurrency cases."}}
{"run":208,"commit":"e838a81","metric":150,"metrics":{"remaining_gates":0},"status":"keep","description":"Reject cross-tenant Process lifecycle references.","timestamp":1786920238458,"segment":5,"confidence":4.545454545454546,"asi":{"hypothesis":"A lifecycle command under tenant B must not find or mutate a confirmed order owned by tenant A, even with valid tenant-B authorization and an otherwise valid command.","result":"Added a cross-tenant cancellation attempt against the tenant-A order and asserted OrderConfirmationNotFound before normal tenant-local lifecycle operations; full benchmark and backpressure checks passed.","next_action_hint":"Continue with another distinct tenant-scoped invariant or bounded rollback/idempotency gap, avoiding replay metadata and already-covered concurrency cases."}}
{"run":209,"commit":"64e72d3","metric":151,"metrics":{"remaining_gates":0},"status":"keep","description":"Reject cross-tenant Process fulfillment references.","timestamp":1786920434048,"segment":5,"confidence":4.575757575757576,"asi":{"hypothesis":"A fulfillment command under tenant B must not find or mutate a confirmed order owned by tenant A, matching cancellation's tenant boundary.","result":"Added a cross-tenant fulfillment attempt and asserted the same typed not-found failure before tenant-local lifecycle work; full benchmark and backpressure checks passed.","next_action_hint":"Continue with another distinct tenant-scoped invariant or bounded rollback/idempotency gap, avoiding replay metadata and already-covered concurrency cases."}}
{"run":210,"commit":"04d066f","metric":152,"metrics":{"remaining_gates":0},"status":"keep","description":"Reject cross-tenant Sales confirmation references.","timestamp":1786920612582,"segment":5,"confidence":4.606060606060606,"asi":{"hypothesis":"Sales confirmation under tenant B must not resolve or mutate an order owned by tenant A, even when the same caller is authorized in both tenants.","result":"Added a tenant-B confirmation attempt against the tenant-A order and asserted SalesOrderNotFound before normal tenant-local confirmations; full benchmark and backpressure checks passed.","next_action_hint":"Continue with another distinct tenant-scoped invariant or bounded rollback/idempotency gap, avoiding replay metadata and already-covered concurrency cases."}}
{"run":211,"commit":"d6ffc70","metric":153,"metrics":{"remaining_gates":0},"status":"keep","description":"Reject cross-tenant Sales cancellation references.","timestamp":1786920793960,"segment":5,"confidence":4.567164179104478,"asi":{"hypothesis":"Sales cancellation under tenant B must not resolve or mutate an order owned by tenant A, matching confirmation's tenant boundary.","result":"Added order-cancel authorization to the fixture and a tenant-B cancellation attempt against tenant-A's confirmed order, asserting SalesOrderNotFound; full benchmark and backpressure checks passed.","next_action_hint":"Continue with another distinct tenant-scoped invariant or bounded rollback/idempotency gap, avoiding replay metadata and already-covered concurrency cases."}}
{"run":212,"commit":"5cf5dd5","metric":154,"metrics":{"remaining_gates":0},"status":"keep","description":"Reject cross-tenant Accounting posting account references.","timestamp":1786920983440,"segment":5,"confidence":4.529411764705882,"asi":{"hypothesis":"Accounting revenue configuration under tenant B must reject receivable and revenue account IDs owned by tenant A instead of creating a cross-tenant posting profile.","result":"Added tenant-B revenue configuration authorization and a cross-tenant account reference assertion yielding AccountNotFound; full benchmark and backpressure checks passed.","next_action_hint":"Continue with another distinct tenant-scoped invariant or bounded rollback/idempotency gap, avoiding replay metadata and already-covered concurrency cases."}}
{"run":213,"commit":"27d8211","metric":155,"metrics":{"remaining_gates":0},"status":"keep","description":"Scope Accounting journal idempotency by tenant.","timestamp":1786921170238,"segment":5,"confidence":4.5588235294117645,"asi":{"hypothesis":"The same manual journal reference in two tenants should create independent posted journals rather than replaying the first tenant's journal.","result":"Extended the Accounting contract fixture with a second tenant using the same account codes and SALE-1 reference, asserting distinct journal identities and tenant ownership; full benchmark and backpressure checks passed.","next_action_hint":"Continue with another distinct tenant-scoped invariant or bounded rollback/idempotency gap, avoiding replay metadata and already-covered concurrency cases."}}
{"run":214,"commit":"1bc28d7","metric":156,"metrics":{"remaining_gates":0},"status":"keep","description":"Reject cross-tenant Accounting journal account references.","timestamp":1786921345894,"segment":5,"confidence":4.588235294117647,"asi":{"hypothesis":"A manual journal posted under tenant B must reject account IDs owned by tenant A rather than leaking or mutating cross-tenant accounting data.","result":"Added a contract-layer cross-tenant postJournal attempt and asserted AccountNotFound after independently posting the same reference in tenant B; full benchmark and backpressure checks passed.","next_action_hint":"Continue with another distinct tenant-scoped invariant or bounded rollback/idempotency gap, avoiding replay metadata and already-covered concurrency cases."}}
{"run":215,"commit":"f43da99","metric":157,"metrics":{"remaining_gates":0},"status":"keep","description":"Reject cross-tenant Inventory transfer item references.","timestamp":1786921571981,"segment":5,"confidence":4.550724637681159,"asi":{"hypothesis":"With tenant-B warehouses selected, an Inventory transfer must reject a tenant-A item reference rather than constructing a cross-tenant transfer line.","result":"Added tenant-B transfer warehouses and an A-owned item reference assertion yielding StockTransferItemNotFound; full benchmark and backpressure checks passed.","next_action_hint":"Continue with another distinct tenant-scoped invariant or bounded rollback/idempotency gap, avoiding replay metadata and already-covered concurrency cases."}}
{"run":216,"commit":"c7c96bd","metric":158,"metrics":{"remaining_gates":0},"status":"keep","description":"Reject cross-tenant Inventory transfer confirmation.","timestamp":1786921754477,"segment":5,"confidence":4.514285714285714,"asi":{"hypothesis":"Inventory transfer confirmation under tenant B must not resolve or mutate a draft transfer owned by tenant A.","result":"Added a tenant-B confirmation attempt against the tenant-A transfer and asserted StockTransferNotFound before the tenant-A confirmation flow; full benchmark and backpressure checks passed.","next_action_hint":"Continue with another distinct tenant-scoped invariant or bounded rollback/idempotency gap, avoiding replay metadata and already-covered concurrency cases."}}
{"run":217,"commit":"a48eea3","metric":159,"metrics":{"remaining_gates":0},"status":"keep","description":"Prove Party external identifiers are tenant-scoped.","timestamp":1786921931532,"segment":5,"confidence":4.542857142857143,"asi":{"hypothesis":"The same global external identifier should be attachable to independent parties in two tenants while remaining unique within each tenant.","result":"Added a second tenant and party to the PostgreSQL identifier test, reused the same identifier, and asserted independent identifier identities; full benchmark and backpressure checks passed.","next_action_hint":"Continue with another distinct tenant-scoped invariant or bounded rollback/idempotency gap, avoiding replay metadata and already-covered concurrency cases."}}
{"run":218,"commit":"3e29622","metric":160,"metrics":{"remaining_gates":0},"status":"keep","description":"Prove Party branch names are tenant-scoped.","timestamp":1786922127598,"segment":5,"confidence":4.444444444444445,"asi":{"hypothesis":"Two tenants should be able to use the same branch name under independent legal entities while receiving distinct branch identities.","result":"Extended the Party PostgreSQL scope fixture with a second tenant, organization, legal entity, and same-name branch assertion; full benchmark and backpressure checks passed.","next_action_hint":"Continue with another distinct tenant-scoped invariant or bounded rollback/idempotency gap, avoiding replay metadata and already-covered concurrency cases."}}
{"run":219,"commit":"a48eea3","metric":160,"metrics":{"remaining_gates":1},"status":"checks_failed","description":"Reject cross-tenant Party relationship references.","timestamp":1786922281155,"segment":5,"confidence":4.444444444444445,"asi":{"hypothesis":"A Party relationship under tenant B must reject a party owned by tenant A instead of accepting a cross-tenant relationship.","result":"The candidate added a cross-tenant relationship assertion, but PostgreSQL surfaced PartyRelationshipRoleNotAssigned before the party foreign-key mapping because tenant B had no role for the A party.","rollback_reason":"The full benchmark failed in party.postgres.test.ts because the expected PartyNotFound was too specific for PostgreSQL constraint ordering; candidate reverted.","next_action_hint":"Reapply the candidate using assignRole under tenant B against the A party, which deterministically maps to PartyNotFound before relationship role checks, then rerun."}}
{"run":220,"commit":"736bd6e","metric":161,"metrics":{"remaining_gates":0},"status":"keep","description":"Reject cross-tenant Party role references.","timestamp":1786922489774,"segment":5,"confidence":4.472222222222222,"asi":{"hypothesis":"Assigning a role under tenant B to a party owned by tenant A must fail with PartyNotFound before any relationship can cross tenant boundaries.","result":"Reapplied the Party two-tenant scope fixture and replaced the constraint-order-sensitive relationship assertion with a deterministic cross-tenant assignRole check; full benchmark and backpressure checks passed.","next_action_hint":"Continue with another distinct tenant-scoped invariant or bounded rollback/idempotency gap, avoiding replay metadata and already-covered concurrency cases."}}
{"run":221,"commit":"61700e3","metric":162,"metrics":{"remaining_gates":0},"status":"keep","description":"Prove Party representations are tenant-scoped.","timestamp":1786922696626,"segment":5,"confidence":4.5,"asi":{"hypothesis":"The same principal can represent independent parties in two tenants without the tenant-A representation being replayed or treated as a duplicate in tenant B.","result":"Extended the representation PostgreSQL fixture with a second tenant and party, reused the same user and kind, and asserted distinct tenant-owned representations; full benchmark and backpressure checks passed.","next_action_hint":"Continue with another distinct tenant-scoped invariant or bounded rollback/idempotency gap, avoiding replay metadata and already-covered concurrency cases."}}
{"run":222,"commit":"d0eea00","metric":163,"metrics":{"remaining_gates":0},"status":"keep","description":"Reject cross-tenant Party representation updates.","timestamp":1786922875646,"segment":5,"confidence":4.527777777777778,"asi":{"hypothesis":"Tenant B must not deactivate or otherwise update a representation owned by tenant A, despite shared principal and valid tenant-B authorization.","result":"Added a tenant-B set-active attempt against the tenant-A representation and asserted PartyRepresentationNotFound; full benchmark and backpressure checks passed.","next_action_hint":"Continue with another distinct tenant-scoped invariant or bounded rollback/idempotency gap, avoiding replay metadata and already-covered concurrency cases."}}
{"run":223,"commit":"eed3c78","metric":164,"metrics":{"remaining_gates":0},"status":"keep","description":"Prove Sales denies capabilities in ungranted tenants.","timestamp":1786923060586,"segment":5,"confidence":4.493150684931507,"asi":{"hypothesis":"A caller with Sales capabilities in known tenants must be denied when attempting a Sales command for an ungranted tenant, even if the payload is otherwise valid.","result":"Added an in-memory Sales authorization regression for an ungranted tenant; full benchmark and backpressure checks passed.","next_action_hint":"Continue with another distinct authorization/tenant invariant or bounded rollback/idempotency gap, avoiding replay metadata and already-covered concurrency cases."}}
{"run":224,"commit":"e048a23","metric":165,"metrics":{"remaining_gates":0},"status":"keep","description":"Remove out-of-scope Party experiments and add in-scope isolation checks.","timestamp":1786923432829,"segment":5,"confidence":4.45945945945946,"asi":{"hypothesis":"Restoring the autoresearch scope by removing Party-only experiments while adding equivalent in-scope authorization, cross-tenant transfer, and missing-event checks should preserve readiness evidence and improve the gate count.","result":"Restored packages/party tests to the pre-experiment baseline, removed five Party gates, and added six in-scope regressions covering Inventory transfer completion, Sales cancellation/confirmation authorization, Accounting authorization, Inventory authorization, and Messaging missing-event reads. Full benchmark and backpressure checks passed.","next_action_hint":"Continue only within the prompt's declared scope; prioritize distinct rollback, authorization, tenant, and durable-consumer invariants rather than Party or redundant replay metadata."}}
{"run":225,"commit":"f5557d4","metric":165,"metrics":{"remaining_gates":0},"status":"keep","description":"Restore scope and replace Party gates with authorization and boundary checks.","timestamp":1786923611762,"segment":5,"confidence":4.45945945945946,"asi":{"hypothesis":"The off-scope Party regressions can be removed while six in-scope authorization, tenant-boundary, and public-read checks preserve or improve readiness evidence.","result":"Removed all Party test changes and replaced their gates with Inventory transfer completion isolation, Sales cancellation/confirmation authorization, Accounting and Inventory authorization, and Messaging missing-event read checks; full benchmark and backpressure checks passed.","next_action_hint":"Continue only within the prompt's declared scope; prioritize distinct rollback, authorization, tenant, and durable-consumer invariants rather than Party or redundant replay metadata."}}
{"run":226,"commit":"8a40a56","metric":166,"metrics":{"remaining_gates":0},"status":"keep","description":"Allow independent cross-tenant Messaging event payloads.","timestamp":1786923802837,"segment":5,"confidence":4.486486486486487,"asi":{"hypothesis":"The same event ID and idempotency key can be reused across tenants with different payloads without collision or cross-tenant replay.","result":"Changed the second tenant's shared event payload and asserted the tenant-specific public read; full benchmark and backpressure checks passed.","next_action_hint":"Continue within the declared scope with distinct rollback, authorization, tenant, and durable-consumer invariants."}}
{"run":227,"commit":"8520793","metric":167,"metrics":{"remaining_gates":0},"status":"keep","description":"Reject same-tenant Sales confirmation key reuse across orders.","timestamp":1786924023379,"segment":5,"confidence":4.513513513513513,"asi":{"hypothesis":"A confirmation idempotency key already committed for one Sales order must be rejected for a different order in the same tenant, without confirming the second order.","result":"Added a same-tenant shared-key attempt against the rollback order and asserted SalesOrderConfirmationIdempotencyConflict; full benchmark and backpressure checks passed.","next_action_hint":"Continue within scope with distinct idempotency collision, rollback, authorization, or durable-consumer invariants."}}
{"run":228,"commit":"9c14e8a","metric":168,"metrics":{"remaining_gates":0},"status":"keep","description":"Enforce authorization on successful Process confirmation replay.","timestamp":1786924420833,"segment":5,"confidence":4.54054054054054,"asi":{"hypothesis":"A completed Process confirmation must re-check the owner-controlled Sales authorization before replaying a durable idempotency result; otherwise a suspended principal can receive/replay the result without current permission.","result":"Process confirmation replay now authorizes Sales order confirmation, and the PostgreSQL test suspends and reactivates the principal around a replay attempt. Full benchmark and backpressure checks passed.","next_action_hint":"Apply the same replay-authorization scrutiny to cancellation and fulfillment only if their owner-capability semantics are clear; otherwise continue with distinct in-scope invariants."}}
{"run":229,"commit":"2b54bb8","metric":170,"metrics":{"remaining_gates":0},"status":"keep","description":"Re-check Process cancellation and fulfillment authorization on replay.","timestamp":1786924642433,"segment":5,"confidence":4.533333333333333,"asi":{"hypothesis":"Completed Process cancellation and fulfillment workflows must enforce current owner authorization before returning durable idempotency results; otherwise a suspended principal can replay protected lifecycle outcomes without current permission.","result":"Process cancellation now checks Sales orderCancel and fulfillment checks Inventory stockFulfill before execution/replay. PostgreSQL tests suspend and reactivate authorization around both replay attempts. Full benchmark and backpressure checks passed.","next_action_hint":"Continue with distinct rollback, authorization, tenant, or durable-consumer invariants; avoid redundant replay metadata."}}
{"run":230,"commit":"8c19acf","metric":171,"metrics":{"remaining_gates":0},"status":"keep","description":"Authorize before validating Process confirmation replay artifacts.","timestamp":1786924944043,"segment":5,"confidence":4.5,"asi":{"hypothesis":"Authorization must precede persisted replay payload/result/job/event validation; a suspended principal should receive AuthorizationDenied even when the durable result is corrupt, rather than learning artifact state.","result":"Moved Process Sales order confirmation authorization to the start of resolveExisting and added a PostgreSQL regression with a corrupted workflow result under suspended membership. Full benchmark and backpressure checks passed.","next_action_hint":"Continue with distinct rollback, authorization, tenant, or durable-consumer invariants; avoid redundant replay metadata."}}
{"run":231,"commit":"8c19acf","metric":171,"metrics":{"remaining_gates":2},"status":"discard","description":"Require all owner capabilities on confirmation replay.","timestamp":1786925244264,"segment":5,"confidence":4.5,"asi":{"hypothesis":"A Process confirmation replay should re-check Sales, Inventory, and Accounting owner capabilities, not only the primary Sales capability, because ADR-0033 requires all workflow capability grants.","rollback_reason":"The implementation and checks passed, but the two new readiness gates were undercounted because one grep expected a test-side `capability:` prefix that the assertion did not contain; candidate reverted for a precise gate retry.","next_action_hint":"Reapply the two capability checks and fix the gate to match the actual Accounting assertion text before rerunning."}}
{"run":232,"commit":"8c19ac","metric":171,"metrics":{"remaining_gates":2},"status":"discard","description":"Reapply all owner capability checks with an incorrect gate pattern.","timestamp":1786925510982,"segment":5,"confidence":4.5,"asi":{"hypothesis":"Confirmation replay should re-check Inventory and Accounting capabilities after Sales authorization.","rollback_reason":"The readiness gate still expected the Accounting assertion to contain a `capability:` label; the actual test asserts the capability field separately, so the candidate was rolled back again despite source and checks passing.","next_action_hint":"Reapply the preserved source/test candidate and change only the gate to grep the actual AccountingCapabilities.revenuePost assertion."}}
