{"run":55,"commit":"b6aa812","metric":29,"metrics":{"remaining_gates":1},"status":"checks_failed","description":"Validate public event-envelope and consumer-receipt timestamps.","timestamp":1786597631103,"segment":5,"confidence":5.2727272727272725,"asi":{"hypothesis":"Public messaging output schemas should reject malformed publication and completion timestamps rather than accepting arbitrary strings.","rollback_reason":"The schema change and tests were valid but the new test formatting did not match deno fmt.","next_action_hint":"Reapply the same InstantString schemas and timestamp regression test, run deno fmt on the test, then rerun unchanged."}}
{"run":56,"commit":"0660138","metric":30,"metrics":{"remaining_gates":0},"status":"keep","description":"Validate public event-envelope and consumer-receipt timestamps.","timestamp":1786597821039,"segment":5,"confidence":5,"asi":{"hypothesis":"Public messaging output schemas should reject malformed publication and completion timestamps rather than accepting arbitrary strings.","result":"EventEnvelope publishedAt and ConsumerReceipt completedAt now share the ISO-compatible InstantString validator, with regression tests rejecting malformed values.","validation":"All thirty readiness gates passed; full formatting, lint, type, skills, boundary, contract, and 128-test portfolio passed."}}
{"run":57,"commit":"d1ad6e0","metric":31,"metrics":{"remaining_gates":0},"status":"keep","description":"Align public event attempt counts with the nonnegative persistence invariant.","timestamp":1786598041955,"segment":5,"confidence":5.166666666666667,"asi":{"hypothesis":"EventEnvelope should reject negative delivery-attempt counts just as the messaging table does; otherwise the public contract permits states persistence forbids.","result":"EventEnvelope attempts now uses a nonnegative integer schema and the regression test rejects attempts=-1 alongside malformed timestamps.","validation":"All thirty-one readiness gates passed; full formatting, lint, type, skills, boundary, contract, and 128-test portfolio passed."}}
{"run":58,"commit":"ce4d43e","metric":32,"metrics":{"remaining_gates":0},"status":"keep","description":"Align the public event-idempotency conflict with validated envelope identities.","timestamp":1786598324868,"segment":5,"confidence":5.333333333333333,"asi":{"hypothesis":"The public EventIdempotencyConflict schema should preserve the same UUID, nonempty-string, and positive-version invariants as the validated envelope that produces it.","result":"EventIdempotencyConflict now validates tenant/event UUIDs, nonempty event and idempotency identifiers, and positive versions; a regression test rejects malformed conflict identities.","validation":"All thirty-two readiness gates passed; full formatting, lint, type, skills, boundary, contract, and 129-test portfolio passed."}}
{"run":59,"commit":"cff55ac","metric":33,"metrics":{"remaining_gates":0},"status":"keep","description":"Require timezone-qualified ISO timestamps at the messaging boundary.","timestamp":1786598571240,"segment":5,"confidence":5.076923076923077,"asi":{"hypothesis":"The messaging timestamp validator should not accept arbitrary JavaScript Date.parse inputs such as date-only strings; event occurrence and durable completion times require explicit, unambiguous timezone-qualified instants.","result":"InstantString now requires an ISO 8601 date-time with Z or an explicit offset in addition to parse validity, and the regression test rejects a date-only occurredAt value.","validation":"All thirty-three readiness gates passed; full formatting, lint, type, skills, boundary, contract, and 129-test portfolio passed."}}
{"run":60,"commit":"cff55ac","metric":33,"metrics":{"remaining_gates":1},"status":"checks_failed","description":"Align Process job attempt counts with the nonnegative database invariant.","timestamp":1786598700426,"segment":5,"confidence":4.714285714285714,"asi":{"hypothesis":"The public ProcessJob contract should reject negative lease-attempt counts just as the Process jobs table does.","rollback_reason":"The contract and regression assertion were valid but the new Effect.flip expression was not deno-fmt compliant.","next_action_hint":"Reapply the same ProcessJob schema change with formatter-compliant test syntax and rerun unchanged."}}
{"run":61,"commit":"c02f45a","metric":34,"metrics":{"remaining_gates":0},"status":"keep","description":"Align Process job attempt counts with the nonnegative database invariant.","timestamp":1786598865027,"segment":5,"confidence":4.857142857142857,"asi":{"hypothesis":"The public ProcessJob contract should reject negative lease-attempt counts just as the Process jobs table does.","result":"ProcessJob attempts now uses a nonnegative integer schema and its contract test rejects attempts=-1.","validation":"All thirty-four readiness gates passed; full formatting, lint, type, skills, boundary, contract, and 129-test portfolio passed."}}
{"run":62,"commit":"da41dfe","metric":35,"metrics":{"remaining_gates":0},"status":"keep","description":"Apply the messaging instant contract to Process job and workflow timestamps.","timestamp":1786599080709,"segment":5,"confidence":5,"asi":{"hypothesis":"Process job scheduling, lease, and workflow completion timestamps should use the same timezone-qualified instant contract as messaging events rather than arbitrary strings.","result":"ProcessJob scheduledAt/leaseUntil and WorkflowRun completedAt now reuse EventEnvelope's occurredAt schema; the contract test rejects a date-only schedule.","validation":"All thirty-five readiness gates passed; full formatting, lint, type, skills, boundary, contract, and 129-test portfolio passed."}}
{"run":63,"commit":"4572c0a","metric":36,"metrics":{"remaining_gates":0},"status":"keep","description":"Validate Process job identities and nonempty routing metadata.","timestamp":1786676206191,"segment":5,"confidence":4.8,"asi":{"hypothesis":"Process job public contracts should enforce the same UUID and nonempty identity invariants as the messaging envelopes and persisted process rows they reference.","result":"ProcessJob now validates job and tenant UUIDs plus nonempty job type, idempotency key, and correlation ID; the contract test rejects a malformed tenant identity.","validation":"All thirty-six readiness gates passed; full formatting, lint, type, skills, boundary, contract, and 129-test portfolio passed."}}
{"run":64,"commit":"2c9ded7","metric":37,"metrics":{"remaining_gates":0},"status":"keep","description":"Validate Process workflow-run identities and recovery metadata.","timestamp":1786676439981,"segment":5,"confidence":4.625,"asi":{"hypothesis":"WorkflowRun should enforce the UUID and nonempty metadata invariants already guaranteed by its PostgreSQL rows instead of exposing looser strings.","result":"WorkflowRun now validates run, tenant, and aggregate UUIDs plus nonempty idempotency and recovery metadata; its public contract test rejects a malformed aggregate identity.","validation":"All thirty-seven readiness gates passed; full formatting, lint, type, skills, boundary, contract, and 130-test portfolio passed."}}
{"run":65,"commit":"b0db6d4","metric":38,"metrics":{"remaining_gates":0},"status":"keep","description":"Validate Process lifecycle result identities.","timestamp":1786676625476,"segment":5,"confidence":5.066666666666666,"asi":{"hypothesis":"Lifecycle results should expose UUID-validated workflow, event, and job identities because all three are durable PostgreSQL identities consumed by API and coordinator callers.","result":"Confirmation, cancellation, and fulfillment result schemas now validate workflow-run, event, and job UUIDs; the public contract test rejects malformed fulfillment identities.","validation":"All thirty-eight readiness gates passed; full formatting, lint, type, skills, boundary, contract, and 131-test portfolio passed."}}
{"run":66,"commit":"b0db6d4","metric":38,"metrics":{"remaining_gates":1},"status":"discard","description":"Validate Process workflow error identities and recovery metadata.","timestamp":1786676852269,"segment":5,"confidence":4.75,"asi":{"hypothesis":"Process-owned workflow errors should preserve UUID tenant/order identities and nonempty idempotency/recovery metadata at the public boundary.","rollback_reason":"Behavior and the full 132-test validation portfolio passed, but the new readiness gate overestimated the number of tenantId and idempotencyKey schema occurrences, so the primary metric did not improve.","next_action_hint":"Reapply the unchanged schema and tests, then make the gate assert the exact error-class fields or test name rather than unrelated aggregate counts."}}
{"run":67,"commit":"6573a3c","metric":39,"metrics":{"remaining_gates":0},"status":"keep","description":"Validate Process workflow error identities and recovery metadata.","timestamp":1786677040131,"segment":5,"confidence":4.588235294117647,"asi":{"hypothesis":"Process-owned workflow errors should preserve UUID tenant/order identities and nonempty idempotency/recovery metadata at the public boundary.","result":"All Process workflow errors now validate tenant and order UUIDs, nonempty idempotency keys, and nonempty manual-recovery reasons; contract tests reject malformed error identities and empty reasons.","validation":"All thirty-nine readiness gates passed; full formatting, lint, type, skills, boundary, contract, and 132-test portfolio passed.","retry_note":"The unchanged implementation was rerun after correcting an over-broad metric occurrence count."}}
{"run":68,"commit":"6573a3c","metric":39,"metrics":{"remaining_gates":1},"status":"discard","description":"Validate tenant identity on every scoped Process command.","timestamp":1786677229950,"segment":5,"confidence":4.333333333333333,"asi":{"hypothesis":"All Process commands should reject malformed tenant identities at their shared public trust boundary before authorization or persistence.","rollback_reason":"Behavior and all 133 tests passed, but the preceding error-schema readiness gate asserted an exact tenantId occurrence count that the new shared ScopedInput validation correctly increased.","next_action_hint":"Reapply the one-line ScopedInput UUID validator and its focused contract test, then update the earlier gate to use a minimum or scoped error-block assertion."}}
{"run":69,"commit":"165c98e","metric":40,"metrics":{"remaining_gates":0},"status":"keep","description":"Validate tenant identity on every scoped Process command.","timestamp":1786677398642,"segment":5,"confidence":4.444444444444445,"asi":{"hypothesis":"All Process commands should reject malformed tenant identities at their shared public trust boundary before authorization or persistence.","result":"The shared ScopedInput now validates tenant UUIDs for confirmation, recovery, cancellation, fulfillment, and manual-recovery commands; a focused contract test rejects malformed tenant input.","validation":"All forty readiness gates passed; full formatting, lint, type, skills, boundary, contract, and 133-test portfolio passed.","retry_note":"The unchanged implementation was rerun after relaxing an unrelated exact occurrence count."}}
{"run":70,"commit":"7e60ecc","metric":41,"metrics":{"remaining_gates":0},"status":"keep","description":"Validate Process lifecycle aggregate and resource identities.","timestamp":1786677580831,"segment":5,"confidence":4.555555555555555,"asi":{"hypothesis":"Process confirmation and lifecycle payloads should reject malformed order, warehouse, and legal-entity identities at the public trust boundary.","result":"Order confirmation now validates order, warehouse, and legal-entity UUIDs, while cancellation and fulfillment validate order UUIDs; contract fixtures use durable identities and reject a malformed warehouse ID.","validation":"All forty-one readiness gates passed; full formatting, lint, type, skills, boundary, contract, and 133-test portfolio passed."}}
{"run":71,"commit":"67d991e","metric":42,"metrics":{"remaining_gates":0},"status":"keep","description":"Restrict Process job payloads to durable JSON values.","timestamp":1786677784869,"segment":5,"confidence":4.421052631578948,"asi":{"hypothesis":"The public ProcessJob payload must match its PostgreSQL jsonb persistence contract instead of accepting arbitrary runtime values through Schema.Unknown.","result":"ProcessJob payloads now use Schema.Json, and the contract test rejects a function value that cannot be durably stored or replayed.","validation":"All forty-two readiness gates passed; full formatting, lint, type, skills, boundary, contract, and 133-test portfolio passed."}}
{"run":72,"commit":"09cd6ff","metric":43,"metrics":{"remaining_gates":0},"status":"keep","description":"Enforce Process workflow status metadata invariants.","timestamp":1786677965352,"segment":5,"confidence":4.3,"asi":{"hypothesis":"The public WorkflowRun schema should reject status/timestamp/recovery combinations that its PostgreSQL state constraint cannot represent.","result":"WorkflowRun now requires running rows to be incomplete, succeeded rows to have a completion instant, and manual-recovery rows to have a reason; contract tests reject inconsistent succeeded and recovery states.","validation":"All forty-three readiness gates passed; full formatting, lint, type, skills, boundary, contract, and 133-test portfolio passed."}}
{"run":73,"commit":"5bddd0e","metric":44,"metrics":{"remaining_gates":0},"status":"keep","description":"Validate catalog metadata required for reliable discovery and scoping.","timestamp":1786678202493,"segment":5,"confidence":4.4,"asi":{"hypothesis":"Published catalog entries need nonempty descriptive metadata, nonempty duplicate-free scopes, and nonempty event aggregate types so consumers can discover and filter them reliably.","result":"Catalog compatibility now checks every action/event identity, owner, title, description, and scope plus each event aggregate type; all current providers satisfy the stronger contract.","validation":"All forty-four readiness gates passed; full formatting, lint, type, skills, boundary, contract, and 133-test portfolio passed."}}
{"run":74,"commit":"596fa40","metric":45,"metrics":{"remaining_gates":0},"status":"keep","description":"Validate catalog action execution and idempotency policies.","timestamp":1786678375550,"segment":5,"confidence":4.5,"asi":{"hypothesis":"Published actions need positive execution limits, duplicate-free contracts, authorization preconditions, and explicit stable-key preconditions when idempotency is required.","result":"Catalog compatibility now validates timeout/retry limits, unique preconditions/effects/error schemas, authorization, and required-idempotency metadata for Inventory and Sales actions.","validation":"All forty-five readiness gates passed; full formatting, lint, type, skills, boundary, contract, and 133-test portfolio passed."}}
{"run":75,"commit":"596fa40","metric":45,"metrics":{"remaining_gates":1},"status":"discard","description":"Bound messaging delivery attempts to the PostgreSQL integer range.","timestamp":1786678625527,"segment":5,"confidence":4.285714285714286,"asi":{"hypothesis":"EventEnvelope attempts should reject values above PostgreSQL int4 maximum so the public contract cannot admit states its messaging table cannot store.","rollback_reason":"The schema and regression test passed the full 133-test validation portfolio, but an earlier readiness gate matched the old one-line NonNegativeInt declaration and failed after the formatter-compliant upper-bound change.","next_action_hint":"Reapply the same bounded schema and test, then update the earlier gate to check the lower-bound expression independently of declaration formatting."}}
{"run":76,"commit":"09c70f3","metric":46,"metrics":{"remaining_gates":0},"status":"keep","description":"Bound messaging delivery attempts to the PostgreSQL integer range.","timestamp":1786678803657,"segment":5,"confidence":4.181818181818182,"asi":{"hypothesis":"EventEnvelope attempts should reject values above PostgreSQL int4 maximum so the public contract cannot admit states its messaging table cannot store.","result":"Messaging attempts now validate the full nonnegative PostgreSQL int4 range, and the contract test rejects 2,147,483,648 before persistence.","validation":"All forty-six readiness gates passed; full formatting, lint, type, skills, boundary, contract, and 133-test portfolio passed.","retry_note":"The unchanged implementation was rerun after updating a stale declaration-format metric check."}}
{"run":77,"commit":"b1da7a2","metric":47,"metrics":{"remaining_gates":0},"status":"keep","description":"Align Process job counters and priority with PostgreSQL integer storage.","timestamp":1786678981971,"segment":5,"confidence":4.476190476190476,"asi":{"hypothesis":"ProcessJob attempts and priority should reject values outside PostgreSQL int4 range so the public contract cannot admit jobs its table cannot persist.","result":"ProcessJob now uses a shared PostgreSQL integer schema for priority and a nonnegative refinement for attempts; contract tests reject overflowing priority and attempt values.","validation":"All forty-seven readiness gates passed; full formatting, lint, type, skills, boundary, contract, and 133-test portfolio passed."}}
{"run":78,"commit":"7bda1db","metric":48,"metrics":{"remaining_gates":0},"status":"keep","description":"Bound messaging event versions to PostgreSQL integer storage.","timestamp":1786679179049,"segment":5,"confidence":4.363636363636363,"asi":{"hypothesis":"Messaging event versions should reject values above PostgreSQL int4 maximum so envelope and conflict contracts cannot admit identities the outbox table cannot persist.","result":"The shared positive event-version schema now enforces the PostgreSQL int4 maximum, and the contract test rejects event version 2,147,483,648 before persistence.","validation":"All forty-eight readiness gates passed; full formatting, lint, type, skills, boundary, contract, and 133-test portfolio passed."}}
{"run":79,"commit":"bffad16","metric":49,"metrics":{"remaining_gates":0},"status":"keep","description":"Validate catalog versions as bounded integer identities.","timestamp":1786679356510,"segment":5,"confidence":4.454545454545454,"asi":{"hypothesis":"Catalog action/event versions and compatibility bounds must be positive integers within PostgreSQL int4 range so static declarations cannot diverge from messaging event-version identity storage.","result":"Catalog compatibility now requires integer entry, minimum, and maximum versions and rejects compatibility ranges above the PostgreSQL int4 maximum.","validation":"All forty-nine readiness gates passed; full formatting, lint, type, skills, boundary, contract, and 133-test portfolio passed."}}
{"run":80,"commit":"0064103","metric":50,"metrics":{"remaining_gates":0},"status":"keep","description":"Bind persisted owner-event versions to their catalog declarations.","timestamp":1786679551227,"segment":5,"confidence":4.545454545454546,"asi":{"hypothesis":"Inventory, Accounting, and Sales PostgreSQL publication proofs should compare persisted event versions to the owning catalog declaration rather than duplicate version literals that can drift independently.","result":"All three owner-event PostgreSQL tests now assert event_outbox.event_version against their exported typed event declaration; Sales additionally selects and verifies the persisted version.","validation":"All fifty readiness gates passed; full formatting, lint, type, skills, boundary, contract, and 133-test portfolio passed."}}
{"run":81,"commit":"0a4622e","metric":51,"metrics":{"remaining_gates":0},"status":"keep","description":"Bind persisted owner-event identity and aggregate metadata to catalog declarations.","timestamp":1786679740007,"segment":5,"confidence":4.434782608695652,"asi":{"hypothesis":"Owner-event PostgreSQL proofs should derive event type and aggregate type from exported catalog declarations so persisted routing identity cannot drift from the public catalog.","result":"Inventory, Accounting, and Sales publication tests now compare persisted event and aggregate types to their typed declarations; Accounting and Sales queries also filter using the declaration IDs.","validation":"All fifty-one readiness gates passed; full formatting, lint, type, skills, boundary, contract, and 133-test portfolio passed."}}
{"run":82,"commit":"0a4622e","metric":51,"metrics":{"remaining_gates":1},"status":"checks_failed","description":"Validate persisted owner-event payloads against catalog schemas.","timestamp":1786679877530,"segment":5,"confidence":4.25,"asi":{"hypothesis":"Every persisted Inventory, Accounting, and Sales owner-event payload should decode through its exported catalog payload schema.","rollback_reason":"The new proof exposed an Accounting PostgreSQL fixture publishing orderId='order-revenue-atomic', while the PUBLIC accounting.revenue.posted payload contract requires a UUID; correctness checks failed and changes were reverted.","next_action_hint":"Make the Accounting revenue-posting PostgreSQL fixture use a UUID order identity, then reapply all three persisted-payload schema decodes and rerun.","learned":"The catalog schema and actual Process-originated production IDs are UUID-based, but the Accounting owner-publication test was not contract-valid."}}
