{"run":154,"commit":"8b037dc","metric":101,"metrics":{"remaining_gates":0},"status":"keep","description":"Reject corrupted revenue posting account identities.","timestamp":1786883172853,"segment":5,"confidence":4.208333333333333,"asi":{"hypothesis":"A deterministic posted revenue journal should replay only when its lines use the configured receivable and revenue accounts as well as the requested amount; amount-only validation can return a balanced journal with swapped or unrelated accounts.","result":"postRevenueForOrder now loads the tenant legal-entity revenue profile and compares canonicalized account/amount lines before replay. PostgreSQL coverage creates a balanced posted revenue journal with reversed account roles and expects JournalIdempotencyConflict.","validation":"All one-hundred-one readiness gates passed; full formatting, lint, type, skills, boundary, contract, and repository tests passed.","compatibility":"Money comparisons use minor-unit canonicalization so equivalent database numeric scales do not create false replay conflicts."}}
{"run":155,"commit":"f74e2bd","metric":102,"metrics":{"remaining_gates":0},"status":"keep","description":"Canonicalize journal money idempotency.","timestamp":1786883376940,"segment":5,"confidence":4.340425531914893,"asi":{"hypothesis":"Journal replay should treat equivalent Money representations such as 125.0 and 125.00 as the same durable command, while retaining account and amount identity checks.","result":"normalizeLines now compares monetary values in minor units across production and test-layer postJournal replay; a scaled amount regression confirms the same journal is returned.","validation":"All one-hundred-two readiness gates passed; full formatting, lint, type, skills, boundary, contract, and repository tests passed.","safety":"Only canonical equality changed; validation still rejects malformed, unbalanced, and account-mismatched lines."}}
{"run":156,"commit":"b0c9e77","metric":103,"metrics":{"remaining_gates":0},"status":"keep","description":"Validate lifecycle replay reservation and journal ownership.","timestamp":1786883693418,"segment":5,"confidence":4.291666666666667,"asi":{"hypothesis":"Cancellation and fulfillment replay must verify that returned reservations are exactly the confirmation reservations with the expected terminal status, and cancellation must reverse the confirmation journal, not merely return same-tenant durable objects.","result":"Added shared lifecycle reservation-ID/status matching, restored tenant checks, and required reversalJournal.reversesEntryId to equal the confirmation journal. PostgreSQL regressions cover same-tenant reservation ID substitution, wrong reversal source identity, and fulfillment reservation substitution.","validation":"All one-hundred-three readiness gates passed; full formatting, lint, type, skills, boundary, contract, and repository tests passed.","boundary":"Checks remain limited to public Process result data and already-owned confirmation facts; no cross-domain table imports were added."}}
{"run":157,"commit":"b0c9e77","metric":103,"metrics":{"remaining_gates":1},"status":"discard","description":"Harden confirmation replay against inactive reservations and reversed journals.","timestamp":1786884234768,"segment":5,"confidence":4.382978723404255,"asi":{"hypothesis":"A schema-valid confirmation result should replay only when its reservations still match order lines in the requested warehouse and remain active, and its revenue journal remains a posted non-reversal with the deterministic reference.","result":"Added confirmationResultMatches with reservation shape/status and journal identity checks plus PostgreSQL regressions for inactive reservations and a reversed journal.","rollback_reason":"All correctness checks passed, but an existing textual readiness gate still searched for the removed inline reservation tenant predicate, so the candidate remained at 103/104.","next_action_hint":"Reapply the confirmation replay checks after updating the stale gate to the shared confirmationResultMatches helper; include the new gate in the total."}}
{"run":158,"commit":"79ea4f7","metric":104,"metrics":{"remaining_gates":1},"status":"keep","description":"Harden confirmation replay against inactive reservations and reversed journals.","timestamp":1786884609774,"segment":5,"confidence":4.521739130434782,"asi":{"hypothesis":"A schema-valid confirmation result should replay only when its reservations still match order lines in the requested warehouse and remain active, and its revenue journal remains a posted non-reversal with the deterministic reference.","result":"Added confirmationResultMatches with reservation shape/status and journal identity checks plus PostgreSQL regressions for inactive reservations and a reversed journal. Updated stale readiness assertions to the formatted shared-helper and generic layouts.","next_action_hint":"Re-run the full portfolio after the harness alignment; the remaining count should fall to zero if no other textual gate is stale."}}
{"run":159,"commit":"e3d95f8","metric":105,"metrics":{"remaining_gates":0},"status":"keep","description":"Close the final P3 readiness gate for lifecycle replay integrity.","timestamp":1786884748610,"segment":5,"confidence":4.468085106382978,"asi":{"hypothesis":"With confirmation replay checks and the formatted lifecycle gate assertions aligned, the complete P3 and bounded ADR-0033 readiness portfolio should have no remaining gates.","result":"Full measure and all backpressure checks passed at 105/105 readiness gates.","next_action_hint":"Inspect the completed scope for a safe regression-hardening experiment; do not weaken gates or activate off-limits infrastructure."}}
{"run":160,"commit":"de684ed","metric":106,"metrics":{"remaining_gates":0},"status":"keep","description":"Validate confirmation integrity before cancellation or fulfillment.","timestamp":1786884964321,"segment":5,"confidence":4.608695652173913,"asi":{"hypothesis":"Lifecycle commands must reject a corrupted confirmation result before invoking Inventory or Accounting; otherwise inactive, wrong-warehouse, or semantically mismatched confirmation reservations could trigger misleading downstream failures or wrong durable effects.","result":"Shared confirmationResultMatches now validates reservation status, warehouse, line shape, and posted journal identity in loadConfirmation, with a cancellation regression proving an inactive persisted reservation is rejected as OrderConfirmationCorrupt before release.","next_action_hint":"Continue with a bounded integrity hardening candidate, preferably one that verifies durable lifecycle linkage without expanding off-limits runtime scope."}}
{"run":161,"commit":"de684ed","metric":106,"metrics":{"remaining_gates":0},"status":"discard","description":"Validate confirmation integrity before cancellation or fulfillment.","timestamp":1786885177225,"segment":5,"confidence":4.51063829787234,"asi":{"hypothesis":"Lifecycle commands must reject a corrupted confirmation result before invoking Inventory or Accounting; otherwise inactive, wrong-warehouse, or semantically mismatched confirmation reservations could trigger misleading downstream failures or wrong durable effects.","result":"Added shared confirmationResultMatches validation to loadConfirmation and a cancellation regression for an inactive confirmation reservation; all correctness checks passed.","rollback_reason":"The candidate preserved all 106 existing readiness gates but added no new gate beyond the already-complete portfolio, so the primary metric was unchanged.","next_action_hint":"Use the next iteration for a distinct untested durable invariant and add a corresponding readiness gate rather than another redundant test."}}
{"run":162,"commit":"167ddd0","metric":107,"metrics":{"remaining_gates":0},"status":"keep","description":"Reject non-confirmed orders in confirmation replay.","timestamp":1786885336347,"segment":5,"confidence":4.458333333333333,"asi":{"hypothesis":"A schema-valid persisted confirmation result must retain the confirmed Sales order state; otherwise replay or downstream lifecycle coordination could accept a cancelled or draft order with active reservations and a posted journal.","result":"confirmationResultMatches now requires order.status === confirmed, with a PostgreSQL replay regression for a schema-valid cancelled order result.","next_action_hint":"Continue with another distinct integrity invariant, prioritizing durable identity linkage that prevents cross-linked reservations or journals from being replayed."}}
{"run":163,"commit":"57ec5ba","metric":108,"metrics":{"remaining_gates":0},"status":"keep","description":"Bind confirmation reservations to their line idempotency identities.","timestamp":1786885524757,"segment":5,"confidence":4.595744680851064,"asi":{"hypothesis":"A schema-valid confirmation replay should reject a reservation copied from another confirmation; the deterministic per-line reservation idempotency key is the Process-owned linkage available without importing Inventory tables.","result":"confirmationResultMatches now requires each reservation's idempotencyKey to match the confirmation key and line index, with a PostgreSQL regression for a mismatched reservation idempotency identity.","next_action_hint":"Continue with a distinct durable identity check, such as validating confirmation journal lines or lifecycle event/job linkage, while preserving domain boundaries."}}
{"run":164,"commit":"8ab6fa1","metric":109,"metrics":{"remaining_gates":0},"status":"keep","description":"Validate confirmation journal amount integrity.","timestamp":1786885710007,"segment":5,"confidence":4.541666666666667,"asi":{"hypothesis":"A schema-valid persisted revenue journal can still be semantically corrupted; confirmation replay should require the two-line journal to be balanced and equal to the confirmed order total before returning it.","result":"Added exact two-line, balanced minor-unit amount checks to confirmationResultMatches and a PostgreSQL regression that changes one debit amount and expects WorkflowResultCorrupt.","next_action_hint":"Continue with bounded cross-link validation for lifecycle event/job metadata or durable result ownership."}}
{"run":165,"commit":"c08e058","metric":110,"metrics":{"remaining_gates":0},"status":"keep","description":"Constrain lifecycle replay order states.","timestamp":1786885908917,"segment":5,"confidence":4.583333333333333,"asi":{"hypothesis":"A durable cancellation replay must retain a cancelled order, while fulfillment replay must retain the confirmed order state; otherwise a schema-valid lifecycle result can contradict Sales state while returning successful downstream artifacts.","result":"Cancellation replay now requires order.status === cancelled and fulfillment replay requires order.status === confirmed, with PostgreSQL regressions for both contradictory persisted states.","next_action_hint":"Continue with a distinct durable linkage check for event/job identifiers or reservation/journal ownership without crossing package boundaries."}}
{"run":166,"commit":"29a0b82","metric":111,"metrics":{"remaining_gates":0},"status":"keep","description":"Validate full lifecycle reservation identity on replay.","timestamp":1786886089212,"segment":5,"confidence":4.625,"asi":{"hypothesis":"Lifecycle replay must not accept a result whose reservation IDs match but whose tenant, warehouse, item, quantity, or idempotency metadata was altered; returned reservation objects should remain the exact confirmation reservations with only the terminal status changed.","result":"lifecycleReservationsMatch now compares all reservation identity fields by ID, with cancellation and fulfillment regressions for same-ID quantity corruption.","next_action_hint":"Continue with a distinct durable linkage check for lifecycle event/job metadata or journal ownership."}}
{"run":167,"commit":"2174d2c","metric":112,"metrics":{"remaining_gates":0},"status":"keep","description":"Constrain cancellation replay reversal state and identity.","timestamp":1786886257129,"segment":5,"confidence":4.571428571428571,"asi":{"hypothesis":"A schema-valid cancellation replay must contain the deterministic revenue-reversal journal in the reversed state and reference the confirmation's legal entity and order; a posted or wrong-reference journal must not be returned as completed cancellation.","result":"Cancellation replay now validates reversal status and deterministic reference in addition to tenant and source-journal linkage, with a PostgreSQL regression for a posted reversal result.","next_action_hint":"Continue with a distinct journal-line or event/job identity invariant, keeping cross-domain access behind public contracts."}}
{"run":168,"commit":"c24ae40","metric":113,"metrics":{"remaining_gates":0},"status":"keep","description":"Validate cancellation reversal lines against the confirmation journal.","timestamp":1786886450995,"segment":5,"confidence":4.708333333333333,"asi":{"hypothesis":"A schema-valid reversed journal can still contain wrong account or amount lines; cancellation replay should require its lines to be the exact inverse of the confirmed revenue journal before returning completed cancellation.","result":"Added journalLinesAreInverse using canonical minor-unit amounts and account identities, with a PostgreSQL regression that cross-links one reversal line account.","next_action_hint":"Continue with a distinct durable linkage invariant, preferably validating Process-owned job metadata for replayed results."}}
{"run":169,"commit":"da934b2","metric":114,"metrics":{"remaining_gates":0},"status":"keep","description":"Validate confirmation Process job linkage on replay.","timestamp":1786886641938,"segment":5,"confidence":4.653061224489796,"asi":{"hypothesis":"A persisted confirmation result must reference the Process-owned post-commit job created for the same workflow, command, correlation, causation, idempotency, and event metadata; otherwise replay can return a cross-linked job identity.","result":"Confirmation replay now loads and validates the referenced Process job and decoded ProcessPostCommitJobPayload, with a PostgreSQL regression for a missing cross-linked job ID.","next_action_hint":"Apply the same bounded job-linkage validation to cancellation and fulfillment lifecycle replay, reusing the Process-owned table boundary."}}
{"run":170,"commit":"3a90cec","metric":115,"metrics":{"remaining_gates":0},"status":"keep","description":"Validate Process job linkage for lifecycle replays.","timestamp":1786886862700,"segment":5,"confidence":4.6,"asi":{"hypothesis":"Cancellation and fulfillment replays must validate their referenced Process-owned jobs just as confirmation does, including job type, tenant, idempotency, correlation, and decoded event/workflow command metadata.","result":"Extracted processJobMatches for Process-owned job lookup and applied it to confirmation, cancellation, and fulfillment replay; added missing-job regressions for both lifecycle results.","next_action_hint":"Continue with a separate event or journal identity invariant only through public contracts and owned tables."}}
{"run":171,"commit":"f9fb612","metric":117,"metrics":{"remaining_gates":0},"status":"keep","description":"Validate Messaging event linkage for lifecycle replays.","timestamp":1786887208192,"segment":5,"confidence":4.68,"asi":{"hypothesis":"Persisted Process results must reference an existing tenant-scoped Messaging event with the expected event type/version, aggregate, command, correlation, causation, idempotency, and actor metadata; a UUID alone is insufficient durable linkage.","result":"Added the typed public Messaging getEvent query and Process event-envelope replay validation for confirmation, cancellation, and fulfillment, with cross-linked event regressions and tenant-scoped query coverage.","next_action_hint":"Continue with a distinct payload or lifecycle identity invariant, avoiding direct Messaging table access from Process."}}
{"run":172,"commit":"f9fb612","metric":117,"metrics":{"remaining_gates":1},"status":"discard","description":"Validate Messaging event payload linkage for lifecycle replays.","timestamp":1786887598761,"segment":5,"confidence":4.68,"asi":{"hypothesis":"Persisted Process results must reference an existing event whose payload matches the workflow result, not merely an event envelope with matching IDs and metadata.","result":"Added public Messaging getEvent and payload comparison for confirmation, cancellation, and fulfillment replay with corrupt-payload regressions; all correctness checks passed.","rollback_reason":"The candidate replaced the prior event-envelope gate instead of adding a separate payload gate, leaving 117/118 readiness gates despite the implementation passing.","next_action_hint":"Reapply the candidate, restore the event-envelope gate, add a distinct payload gate, set total to 118, and rerun."}}
{"run":173,"commit":"bd19989","metric":118,"metrics":{"remaining_gates":0},"status":"keep","description":"Validate Messaging event payload linkage for lifecycle replays.","timestamp":1786887825248,"segment":5,"confidence":4.627450980392157,"asi":{"hypothesis":"Persisted Process results must reference an existing event whose payload matches the workflow result, not merely an event envelope with matching IDs and metadata.","result":"Payload comparison now covers confirmation, cancellation, and fulfillment event replays, with schema-valid corrupt-payload regressions; the prior envelope gate was restored as a separate readiness gate.","next_action_hint":"Continue with a distinct bounded invariant, preferably validating public event payload schemas at replay or strengthening durable confirmation identity."}}
{"run":174,"commit":"01cae3e","metric":119,"metrics":{"remaining_gates":0},"status":"keep","description":"Decode persisted Messaging events at the public read boundary.","timestamp":1786888050016,"segment":5,"confidence":4.576923076923077,"asi":{"hypothesis":"Messaging getEvent should not cast database rows directly to the public EventEnvelope; corrupted persisted identities or timestamps must fail through the public schema boundary before Process replay consumes them.","result":"getEvent now decodes the reconstructed EventEnvelope and has a malformed-input contract regression.","next_action_hint":"Continue with a distinct durable invariant rather than adding redundant envelope checks."}}
{"run":175,"commit":"e995175","metric":120,"metrics":{"remaining_gates":0},"status":"keep","description":"Validate confirmation artifacts before lifecycle execution.","timestamp":1786888288581,"segment":5,"confidence":4.528301886792453,"asi":{"hypothesis":"Cancellation and fulfillment must reject a confirmation whose Process job or Messaging event is cross-linked or has a mismatched payload before invoking downstream Inventory, Sales, or Accounting operations.","result":"loadConfirmation now validates the confirmation-owned job and event through public services, with lifecycle regressions for corrupt confirmation event payload and job identity.","next_action_hint":"Continue with a distinct lifecycle integrity check, avoiding redundant confirmation artifact coverage."}}
{"run":176,"commit":"4902468","metric":121,"metrics":{"remaining_gates":0},"status":"keep","description":"Reject cross-tenant confirmation journals before lifecycle execution.","timestamp":1786888478379,"segment":5,"confidence":4.653846153846154,"asi":{"hypothesis":"A confirmation result with a schema-valid journal from another tenant must be rejected by loadConfirmation before cancellation or fulfillment can invoke Accounting; tenant checks should live in the shared confirmation integrity predicate.","result":"confirmationResultMatches now requires journal.tenantId to match the requested tenant, with a PostgreSQL lifecycle regression for a detached confirmation journal.","next_action_hint":"Continue with a distinct lifecycle integrity invariant, avoiding redundant confirmation artifact checks."}}
{"run":177,"commit":"75cdee5","metric":122,"metrics":{"remaining_gates":0},"status":"keep","description":"Reject duplicate confirmation reservation identities.","timestamp":1786888662521,"segment":5,"confidence":4.60377358490566,"asi":{"hypothesis":"A schema-valid confirmation result must contain one unique durable reservation ID per order line; duplicate reservation IDs can otherwise masquerade as distinct line reservations while replaying the same inventory object twice.","result":"confirmationResultMatches now requires unique reservation IDs, with a PostgreSQL regression for a duplicate reservation identity.","next_action_hint":"Continue with a distinct lifecycle invariant, preferably around journal or event identity rather than another reservation-shape check."}}
{"run":178,"commit":"bb6c377","metric":123,"metrics":{"remaining_gates":0},"status":"keep","description":"Reject invalid journal lines in confirmation replay.","timestamp":1786888838985,"segment":5,"confidence":4.730769230769231,"asi":{"hypothesis":"Balanced journal totals alone do not guarantee valid double-entry lines; a schema-valid confirmation journal with a line carrying both debit and credit or neither must be rejected before replay.","result":"confirmationResultMatches now requires every journal line to have exactly one positive side, with a regression for a balanced but invalid two-line journal.","next_action_hint":"Continue with a distinct lifecycle invariant, preferably event/job or journal identity not already covered by confirmation validation."}}
