{"run":364,"commit":"2bce42b","metric":16,"metrics":{"remaining_gates":0},"status":"keep","description":"Define conservative freshness for multi-source analytic metrics.","timestamp":1787360024487,"segment":6,"confidence":16,"asi":{"hypothesis":"A metric-wide dataAsOf must be derived from completeness evidence for every required source; otherwise projection wall-clock time or one fast source can make an incomplete multi-source result appear fresh.","result":"The canonical architecture and ADR now bind dataAsOf to the oldest required source completeness frontier, keep source positions private, and require asymmetric-lag, late-arrival, and incompleteness validation; all sixteen gates and repository checks pass.","next_action_hint":"Audit one remaining semantic edge only if it is provider-independent and testable; do not add a concrete provider, API, or fact contract without a measured dashboard."}}
{"run":365,"commit":"be9b331","metric":17,"metrics":{"remaining_gates":0},"status":"keep","description":"Make correction visibility and historical rebuild frontiers explicit.","timestamp":1787360269825,"segment":6,"confidence":11.333333333333334,"asi":{"hypothesis":"Deterministic historical analytics require an explicit correction-visibility policy and a fixed source-completeness frontier; semantic versions alone cannot distinguish current restatement from what was knowable at an earlier frontier.","result":"The canonical architecture and ADR now require each metric to choose restated-current or as-known-at-frontier correction semantics, and validation fixes tenant/query scope, semantic versions, and frontier before comparing rebuild hashes; all seventeen gates and repository checks pass.","next_action_hint":"If continuing, audit another provider-independent semantic ambiguity such as null/unknown dimension membership; do not activate a provider or invent a Business Fact Contract."}}
{"run":366,"commit":"4cb975b","metric":18,"metrics":{"remaining_gates":0},"status":"keep","description":"Require total dimension-membership semantics without implicit fact loss.","timestamp":1787360480055,"segment":6,"confidence":9,"asi":{"hypothesis":"If null, missing, orphaned, or late dimension membership has no explicit outcome, providers can silently drop different source-grain facts and still appear compliant on generic null and cardinality tests.","result":"The canonical architecture and ADR now require a reviewed unresolved-membership outcome or explicit exclusion, prohibit implicit source-grain loss or duplication, and require before/after-resolution golden cases; all eighteen gates and repository checks pass.","next_action_hint":"If continuing, audit provider-independent aggregation-set behavior such as empty groups and zero-versus-null results; do not add a concrete provider, schema, API, or fact contract."}}
{"run":367,"commit":"c9d479a","metric":19,"metrics":{"remaining_gates":0},"status":"keep","description":"Define provider-independent empty-input and absent-group result semantics.","timestamp":1787360680731,"segment":6,"confidence":9.5,"asi":{"hypothesis":"Without explicit output-cardinality rules, eligible providers can disagree by omitting an empty group, emitting zero, or emitting null while each claims generic null-handling compliance.","result":"Metric contracts now declare empty-input and absent-group row behavior plus zero/null values, prohibit provider/client synthesis outside the contract, and require exact raw-result conformance fixtures; all nineteen gates and repository checks pass.","next_action_hint":"If continuing, audit one provider-independent arithmetic edge such as divide-by-zero and all-null derived measures; avoid concrete providers, schemas, APIs, or fact contracts."}}
{"run":368,"commit":"91dd34b","metric":20,"metrics":{"remaining_gates":0},"status":"keep","description":"Define total arithmetic semantics for derived analytic expressions.","timestamp":1787360873383,"segment":6,"confidence":10,"asi":{"hypothesis":"Exact arithmetic alone does not prevent cross-provider drift when zero divisors, all-null operands, overflow, rounding points, or non-finite results remain undefined.","result":"Metric contracts now require total precision, scale, rounding, null, zero-divisor, overflow, and non-finite semantics, with golden cases asserting identical typed values, nulls, or stable semantic errors; all twenty gates and repository checks pass.","next_action_hint":"If continuing, audit temporal boundary semantics such as interval closure and timezone/calendar cutoffs; do not add a concrete provider, schema, API, or fact contract."}}
{"run":369,"commit":"2c028f0","metric":21,"metrics":{"remaining_gates":0},"status":"keep","description":"Define deterministic temporal boundaries for time-grained analytics.","timestamp":1787361105030,"segment":6,"confidence":8.4,"asi":{"hypothesis":"Generic timezone and DST requirements do not prevent cross-provider drift unless interval closure, cutoff assignment, precision normalization, timezone rules, and DST gap/fold resolution are versioned and explicit.","result":"Time-grained contracts now use versioned temporal-boundary policies and normalized half-open intervals, with golden cases for cutoff endpoints, timestamp precision, DST gaps/folds, and calendar versions; all twenty-one gates and repository checks pass.","next_action_hint":"If continuing, audit provider-independent ordering and pagination determinism for tied metric rows; do not add a concrete provider, schema, API, or fact contract."}}
{"run":370,"commit":"ee8792a","metric":22,"metrics":{"remaining_gates":0},"status":"keep","description":"Define deterministic ordering and fixed-frontier pagination semantics.","timestamp":1787361311682,"segment":6,"confidence":7.333333333333333,"asi":{"hypothesis":"Bounded ordering and limits are insufficient when ties, nulls, text comparison, or projection changes can make paginated results duplicate or omit rows across providers.","result":"Semantic queries now require a provider-independent total order, unique final tie-breaker, and continuation bound to query scope, semantic version, and one fixed completeness frontier; all twenty-two gates and repository checks pass.","next_action_hint":"If continuing, audit authorization changes during multi-page traversal so a fixed data frontier cannot freeze stale access; avoid concrete providers, schemas, APIs, or fact contracts."}}
{"run":371,"commit":"26de459","metric":23,"metrics":{"remaining_gates":0},"status":"keep","description":"Define analytics as a non-authoritative sensor for future self-observation.","timestamp":1787361694505,"segment":6,"confidence":7.666666666666667,"asi":{"hypothesis":"Celonis, Palantir, and SAP Signavio validate the value of process/ontology observations feeding findings and recommendations, but RITSEI must keep analytics, evaluation, and actuation as separate authority boundaries.","result":"The canonical architecture now treats analytics as a freshness-qualified sensor, keeps findings and recommendations derived, forces every proposed action through the current owning typed command, and defers graph/vector/LLM/evaluator activation to a later ADR; the reference study records the external precedents and all twenty-three gates plus repository checks pass.","sources_reviewed":"Celonis Process Intelligence Graph and orchestration, Palantir Ontology and AIP Analyst, SAP Signavio insights, anomaly detection, root-cause analysis, and AI-assisted recommendations","next_action_hint":"If continuing, audit authorization changes during recommendation review and execution; do not create an evaluator, finding schema, graph/vector provider, or autonomous loop without a measured use case and separate ADR."}}
{"run":372,"commit":"0520464","metric":24,"metrics":{"remaining_gates":0},"status":"keep","description":"Require fresh authorization and actor provenance across self-observation review.","timestamp":1787361949407,"segment":6,"confidence":8,"asi":{"hypothesis":"Revalidating only the final command is insufficient if a reviewer can still see revoked evidence or a ProcessPrincipal obscures the originating actor and delegation between observation, review, and execution.","result":"The canonical architecture now preserves originating, reviewing, and executing principal provenance and independently revalidates evidence visibility and separation of duties at every stage; all twenty-four gates and repository checks pass.","next_action_hint":"If continuing, audit evidence/provenance integrity so findings cannot cite mutable or unverifiable observations; do not create a finding schema or evaluator runtime without a measured use case and separate ADR."}}
{"run":373,"commit":"f8f3ce6","metric":25,"metrics":{"remaining_gates":0},"status":"keep","description":"Bind findings to immutable and verifiable analytic evidence.","timestamp":1787362131099,"segment":6,"confidence":7.142857142857143,"asi":{"hypothesis":"Versions, lineage, and dataAsOf do not make a finding auditable if its citation resolves to a live query that changes after correction, rebuild, or re-evaluation.","result":"The canonical architecture now binds every future finding citation to exact typed evidence, scope, semantic versions, fixed completeness frontier, and a stable integrity digest; changed, missing, or unverifiable evidence fails explicitly, and all twenty-five gates plus repository checks pass.","next_action_hint":"If continuing, audit recommendation supersession and withdrawal so newer evidence cannot leave stale findings actionable; do not create a finding schema or evaluator runtime without a measured use case and separate ADR."}}
{"run":374,"commit":"f2a29c2","metric":26,"metrics":{"remaining_gates":0},"status":"keep","description":"Make superseded or withdrawn recommendations non-actionable.","timestamp":1787362340567,"segment":6,"confidence":6.5,"asi":{"hypothesis":"Immutable evidence and current authorization do not prevent a still-valid domain command from executing a recommendation whose rationale has been superseded, corrected, invalidated by policy, or withdrawn.","result":"The canonical architecture now requires current actionability before review or action, preserves immutable historical evidence, rejects stale lifecycle states, and forbids silently substituting a newer recommendation; all twenty-six gates and repository checks pass.","next_action_hint":"If continuing, audit review decisions and recommendation actions for idempotent binding so retries cannot approve or execute a different recommendation version; do not create a concrete finding schema or evaluator runtime."}}
{"run":375,"commit":"bc685f0","metric":27,"metrics":{"remaining_gates":0},"status":"keep","description":"Bind recommendation review and action retries to one immutable intent.","timestamp":1787362609067,"segment":6,"confidence":6.75,"asi":{"hypothesis":"Generic command idempotency does not prevent a retry, duplicate review, or reused key from targeting a different recommendation version, action version, or input after the original decision.","result":"The analytics and Process Studio architecture now bind review/logical-step/idempotency identity to the exact recommendation, typed action version, and canonical validated input; identical lost-response retries recover the original outcome while mismatches fail closed, and all twenty-seven gates plus repository checks pass.","next_action_hint":"If continuing, audit unknown command outcomes so a recommendation is not marked executed, retried, or superseded before owning-domain reconciliation; do not create a concrete evaluator or finding schema."}}
{"run":376,"commit":"a457379","metric":28,"metrics":{"remaining_gates":0},"status":"keep","description":"Require owning-domain reconciliation for unknown recommendation-action outcomes.","timestamp":1787364204081,"segment":6,"confidence":7,"asi":{"hypothesis":"A lost response or worker failure must leave the exact recommendation action attempt unknown until the owning domain confirms its outcome; otherwise local orchestration can mark success, retry with a new identity, compensate, or authorize a successor effect incorrectly.","next_action_hint":"Audit compensation eligibility after owner-confirmed reconciliation so an unknown or rejected action cannot be compensated as though it committed; do not create an evaluator runtime or recommendation schema."}}
{"run":377,"commit":"2ac68ef","metric":29,"metrics":{"remaining_gates":0},"status":"keep","description":"Bind compensation to an owner-confirmed compensable action outcome.","timestamp":1787364382790,"segment":6,"confidence":6.444444444444445,"asi":{"hypothesis":"Recommendation supersession, withdrawal, timeout, or an unknown/rejected action must not imply compensation; only an owner-confirmed accepted effect may authorize a separately governed correcting command.","next_action_hint":"Audit delayed execution so an earlier review or approval cannot act as a durable authorization lease; revalidate recommendation actionability, evidence access, authorization, and separation of duties immediately before dispatch without creating an evaluator runtime."}}
{"run":378,"commit":"5722b7b","metric":30,"metrics":{"remaining_gates":0},"status":"keep","description":"Make review and approval non-durable as execution authority.","timestamp":1787364534740,"segment":6,"confidence":6,"asi":{"hypothesis":"A review decision is not a lease over future authorization or state; delayed recommendation dispatch must revalidate evidence access, policy, delegation, action version, separation of duties, and actionability immediately before invoking the owner.","next_action_hint":"Audit concurrent dispatch so two workers cannot both pass pre-dispatch checks before the exact recommendation-action claim is durably fenced; keep the requirement provider-independent and avoid creating a recommendation runtime."}}
{"run":379,"commit":"f0fb422","metric":31,"metrics":{"remaining_gates":0},"status":"keep","description":"Fence concurrent and recovered recommendation-action dispatch.","timestamp":1787364707469,"segment":6,"confidence":6.2,"asi":{"hypothesis":"Pre-dispatch checks alone do not prevent two workers or a stale recovered worker from invoking or finalizing the same recommendation action; one durable fenced attempt and one owner-visible idempotency identity are required.","next_action_hint":"Audit cancellation semantics so a user or policy cancellation stops undispatched work but cannot claim that an already dispatched or unknown owning command was canceled; avoid inventing a coordinator implementation."}}
{"run":380,"commit":"756e9d9","metric":32,"metrics":{"remaining_gates":0},"status":"keep","description":"Separate recommendation cancellation from owning-command outcome.","timestamp":1787364857415,"segment":6,"confidence":6.4,"asi":{"hypothesis":"A cancellation race must stop only undispatched work; once dispatch may have occurred, local cancellation cannot claim the owning command was canceled and must await reconciliation before any compensation.","next_action_hint":"Audit action-result disclosure so an authorized recommendation reviewer does not automatically gain access to sensitive owning-domain command output; preserve separate result authorization and redaction."}}
{"run":381,"commit":"bf69abd","metric":33,"metrics":{"remaining_gates":0},"status":"keep","description":"Keep owning-domain result disclosure separate from recommendation action authority.","timestamp":1787365048672,"segment":6,"confidence":6,"asi":{"hypothesis":"Authorization to review or execute a recommendation must not implicitly disclose protected owning-domain result fields; the owner should independently authorize and redact access while the coordinator stores only a minimal allowlisted receipt.","next_action_hint":"Audit error and diagnostic disclosure across recommendation action failures so typed owner errors, denial reasons, and reconciliation details cannot leak protected facts through status text, logs, or reviewer-visible history."}}
{"run":382,"commit":"4d230c9","metric":34,"metrics":{"remaining_gates":0},"status":"keep","description":"Protect owning-domain failure diagnostics from recommendation viewers.","timestamp":1787365227276,"segment":6,"confidence":5.666666666666667,"asi":{"hypothesis":"Recommendation visibility or action authority must not expose sensitive owner error fields, causes, reconciliation details, or existence signals; the boundary should retain only stable redacted status and safe correlation references.","next_action_hint":"Audit notification and export delivery so recommendation, result, and failure redaction survives fan-out to email, webhooks, files, and downstream analytic consumers instead of being enforced only in the interactive view."}}
{"run":383,"commit":"be3ec8c","metric":35,"metrics":{"remaining_gates":0},"status":"keep","description":"Preserve disclosure policy across recommendation fan-out channels.","timestamp":1787365422269,"segment":6,"confidence":5.833333333333333,"asi":{"hypothesis":"Interactive redaction is insufficient if notifications, webhooks, exports, shared links, queues, receipts, or downstream analytics serialize sensitive recommendation, command-result, or diagnostic content without current recipient authorization.","next_action_hint":"Audit retention and deletion semantics for immutable recommendation evidence, action receipts, exports, and diagnostics so legal retention, tenant deletion, cryptographic erasure, and auditability do not silently contradict each other."}}
