{"run":312,"commit":"e2790ab","metric":231,"metrics":{"remaining_gates":1},"status":"checks_failed","description":"Fence manual-recovery operations from cutover approval.","timestamp":1787209730399,"segment":5,"confidence":3.9827586206896552,"asi":{"hypothesis":"Cutover approval must treat manual_recovery as unresolved financial work, just like intent, submitted, accepted, and unknown.","rollback_reason":"The regression's copied verification evidence was rejected because its evidence still carried a mismatching operation/balance count after the test had created additional operations; the approval assertion was not reached.","next_action_hint":"Build a fresh zero-count evidence object for the second legal entity, or record the manual-recovery approval regression before creating extra operations in the original scope."}}
{"run":313,"commit":"fa69814","metric":232,"metrics":{"remaining_gates":0},"status":"keep","description":"Fence manual-recovery operations from TigerBeetle cutover approval.","timestamp":1787210027905,"segment":5,"confidence":4.034782608695652,"asi":{"hypothesis":"A verified artifact must not approve a legal entity while any scoped financial operation is manual_recovery; approval's unresolved query must include that terminal recovery fence.","what_learned":"Approval now includes manual_recovery in its unresolved operation predicate, and PostgreSQL evidence uses a second legal entity, a fresh zero-count artifact, and a manually quarantined operation to prove approval returns unresolved_operations. Full checks passed.","next_action_hint":"Continue with the matching manual_recovery checkpoint visibility gap or another concrete ADR-0040 readiness invariant; avoid broad operational evidence and gated infrastructure."}}
{"run":314,"commit":"fa69814","metric":232,"metrics":{"remaining_gates":1},"status":"checks_failed","description":"Reject manual-recovery operations from reconciliation checkpoints.","timestamp":1787210232802,"segment":5,"confidence":4.0701754385964914,"asi":{"hypothesis":"A checkpoint should not ignore scoped manual-recovery operations; it must fail closed before hashing or verification.","rollback_reason":"The guard included manual_recovery for every eligible checkpoint, but existing financial-operations PostgreSQL evidence intentionally includes a quarantined operation in a later checkpoint and now failed before its expected blocked result. The guard needs to preserve the existing mismatch/recovery test semantics or the test fixture must isolate the manual-recovery scope.","next_action_hint":"Inspect the existing quarantined-operation checkpoint test and distinguish a manual-recovery operation that should produce a blocked checkpoint from a typed preflight error, preserving current recovery evidence."}}
{"run":315,"commit":"fa69814","metric":232,"metrics":{"remaining_gates":1},"status":"checks_failed","description":"Represent manual-recovery checkpoint findings as a blocked result.","timestamp":1787210342318,"segment":5,"confidence":4.034782608695652,"asi":{"hypothesis":"Including manual_recovery in the checkpoint source cohort should produce a normal blocked checkpoint with mismatch evidence, preserving existing quarantine tests.","rollback_reason":"The new PostgreSQL assertion treated Effect.flip's union of typed failures as a checkpoint result; the candidate did not narrow or assert the expected failure path, so type checking failed before semantic tests.","next_action_hint":"Use the existing checkpoint result path with a manual-recovery operation and type-safe assertions, or assert a typed failure explicitly if the implementation chooses fail-closed preflight."}}
{"run":316,"commit":"6c46c1a","metric":233,"metrics":{"remaining_gates":0},"status":"keep","description":"Expose manual-recovery operations as blocked checkpoint evidence.","timestamp":1787210624983,"segment":5,"confidence":4.017241379310345,"asi":{"hypothesis":"A reconciliation checkpoint must include scoped manual_recovery operations in its source cohort; otherwise an unresolved operation can disappear from an otherwise verified snapshot.","what_learned":"Financial operation facts now allow manual_recovery, checkpoint selection includes it, and PostgreSQL evidence shows a manual-recovery operation yields a blocked checkpoint while cutover approval independently returns unresolved_operations. Full checks passed.","next_action_hint":"Continue with another concrete ADR-0040 invariant, such as approval/checkpoint artifact mapping-version parity or visibility of non-accepted operation states; avoid speculative global provider scans."}}
{"run":317,"commit":"8c63f4b","metric":234,"metrics":{"remaining_gates":0},"status":"keep","description":"Reject checkpoint artifacts with mapping-version drift.","timestamp":1787210958501,"segment":5,"confidence":4.069565217391304,"asi":{"hypothesis":"A linked verification artifact carries one mappingVersion and must match the checkpoint's eligible operation cohort; otherwise a valid signature can certify facts under a different provider mapping.","what_learned":"Checkpoint now loads the persisted artifact mapping version and fails with mapping_version_mismatch when it differs from the single eligible operation version. PostgreSQL evidence records a signed version-2 artifact against version-1 facts and proves rejection; full checks passed.","next_action_hint":"Continue with another concrete ADR-0040 artifact/reconciliation invariant, such as artifact hash/projection parity or non-accepted operation visibility; avoid speculative provider-wide scans."}}
{"run":318,"commit":"8a928514","metric":235,"metrics":{"remaining_gates":0},"status":"keep","description":"Block checkpoints that omit in-flight financial operations.","timestamp":1787211748856,"segment":5,"confidence":4.051724137931035,"asi":{"hypothesis":"Reconciliation must include intent, submitted, and unknown operations in its scoped cohort; otherwise an empty or otherwise healthy checkpoint can falsely verify while financial work is still unresolved.","what_learned":"Financial operation facts now preserve all eligible lifecycle states, checkpoint selection includes in-flight states, and PostgreSQL evidence proves an unsubmitted intent produces a blocked checkpoint. Full checks passed.","next_action_hint":"Continue with another concrete ADR-0040 parity gap, likely linked artifact fact-hash binding or stale intent mapping-policy fencing; avoid speculative global scans."}}
{"run":319,"commit":"aac602b","metric":236,"metrics":{"remaining_gates":0},"status":"keep","description":"Bind linked checkpoint evidence to its persisted fact hashes.","timestamp":1787212155984,"segment":5,"confidence":4.068965517241379,"asi":{"hypothesis":"A signed verified artifact linked to a reconciliation checkpoint must carry the same operation, balance, transfer, and projection hashes as the freshly computed checkpoint evidence; scope, provenance, and mapping alone are insufficient.","what_learned":"Checkpoint now loads and compares persisted fact hashes, and PostgreSQL evidence uses the prior cutover artifact's deliberately stale hashes to prove a typed hash_mismatch while unlinked verification still succeeds. Full checks passed.","next_action_hint":"Continue with another concrete ADR-0040 parity invariant, likely stale intent policy fencing or approval/checkpoint binding; avoid speculative global provider scans."}}
{"run":320,"commit":"defd01e","metric":237,"metrics":{"remaining_gates":0},"status":"keep","description":"Require a matching verified reconciliation checkpoint before cutover approval.","timestamp":1787213391292,"segment":5,"confidence":4.086206896551724,"asi":{"hypothesis":"Cutover approval must not rely on an unrelated signed artifact; it must find a verified TigerBeetle checkpoint linked to that artifact with matching watermarks, snapshots, fact hashes, and zero mismatches/orphans.","what_learned":"Approval now verifies the persisted checkpoint/artifact binding. PostgreSQL evidence proves a no-checkpoint artifact is rejected, a matching checkpoint permits the original approval, and manual-recovery work remains independently fenced. Full checks passed.","next_action_hint":"Continue with another concrete financial control invariant, likely checkpoint immutability/linkage or stale intent policy fencing; avoid adding provider-wide scan infrastructure."}}
{"run":321,"commit":"acff12d","metric":238,"metrics":{"remaining_gates":0},"status":"keep","description":"Enforce zero mismatch and orphan counts for verified checkpoints.","timestamp":1787214323396,"segment":5,"confidence":4.033898305084746,"asi":{"hypothesis":"A verified financial reconciliation checkpoint is a durable claim and must be impossible at the PostgreSQL boundary when mismatch_count or orphan_count is nonzero; immutability alone would preserve forged drift.","what_learned":"Accounting schema and generated migration now enforce verified checkpoints have zero mismatch/orphan counts. PostgreSQL evidence attempts an invalid verified checkpoint and observes the named constraint; full checks passed.","next_action_hint":"Continue with another concrete financial persistence invariant, likely provider/global orphan semantics only if a bounded provider capability exists; otherwise audit remaining checkpoint state constraints."}}
{"run":322,"commit":"e810061","metric":239,"metrics":{"remaining_gates":0},"status":"keep","description":"Bound public financial reconciliation checkpoint counts to PostgreSQL int4.","timestamp":1787215561516,"segment":5,"confidence":4.0508474576271185,"asi":{"hypothesis":"The Accounting checkpoint database already requires non-negative PostgreSQL integer mismatch/orphan counts, but the public FinancialReconciliationCheckpoint schema accepted negative and overflowing values; reuse the existing NonNegativeInt boundary and add contract evidence.","what_learned":"Both public checkpoint count fields now reject -1 and 2_147_483_648, the readiness portfolio increased to 239 with zero remaining gates, and all backpressure checks passed.","next_action_hint":"Continue with one concrete current-ADR persistence/public-contract parity gap; timestamps are the next bounded candidate, while provider-wide scans and gated infrastructure remain out of scope."}}
{"run":323,"commit":"e2c33d9","metric":240,"metrics":{"remaining_gates":0},"status":"keep","description":"Validate financial reconciliation checkpoint timestamps as persisted instants.","timestamp":1787215858709,"segment":5,"confidence":4.067796610169491,"asi":{"hypothesis":"Checkpoint checkedAt is persisted as PostgreSQL timestamptz, but the public schema accepted date-only and malformed strings; reuse Messaging's canonical timezone-qualified instant schema at the Accounting boundary.","what_learned":"FinancialReconciliationCheckpoint.checkedAt now shares EventEnvelope's validated instant contract; date-only and malformed inputs fail, the portfolio reaches 240 gates with zero remaining, and all checks pass.","next_action_hint":"Continue with one bounded current-ADR persistence/public-contract parity gap; financial-operation timestamps are the next candidate, without introducing a shared infrastructure abstraction or gated runtime."}}
{"run":324,"commit":"a07b90f","metric":241,"metrics":{"remaining_gates":0},"status":"keep","description":"Validate financial-operation timestamps as persisted instants.","timestamp":1787216127167,"segment":5,"confidence":4.084745762711864,"asi":{"hypothesis":"Financial operations persist scheduledAt, submittedAt, and reconciledAt as PostgreSQL timestamptz, but the public FinancialOperation schema accepted date-only and malformed strings; reuse the canonical InstantString schema for all three fields.","what_learned":"All three public operation timestamp fields now reject invalid timestamp shapes, the portfolio reaches 241 gates with zero remaining, and all backpressure checks pass.","next_action_hint":"Continue with one concrete current-ADR parity invariant only; inspect remaining Accounting control and operation fields before considering another bounded contract check."}}
{"run":325,"commit":"d6ea85e","metric":242,"metrics":{"remaining_gates":0},"status":"keep","description":"Enforce financial verification evidence time ordering at the public boundary.","timestamp":1787216512434,"segment":5,"confidence":4.067226890756302,"asi":{"hypothesis":"Verification artifacts persist startedAt/completedAt as timestamptz and the database requires completedAt >= startedAt, but the public evidence schema accepted arbitrary nonempty strings and inverted intervals; reuse the canonical instant schema and mirror the ordering check.","what_learned":"FinancialVerificationEvidence now validates timezone-qualified instants and rejects completion before start; the portfolio reaches 242 gates with zero remaining and all checks pass.","next_action_hint":"Continue with one bounded current-ADR Accounting invariant only; inspect remaining public numeric/state fields before adding further gates."}}
{"run":326,"commit":"9b9fb1a","metric":243,"metrics":{"remaining_gates":0},"status":"keep","description":"Align public journal reversal state with PostgreSQL constraints.","timestamp":1787216913191,"segment":5,"confidence":4.05,"asi":{"hypothesis":"The Accounting database requires posted journals without reversesEntryId and reversed journals with one, but the public JournalEntry schema allowed both contradictory states; mirror the existing reversal-state check before callers consume the DTO.","what_learned":"JournalEntry now rejects reversed entries without a source and posted entries with a source; the portfolio reaches 243 gates with zero remaining and all checks pass.","next_action_hint":"Continue with one concrete current-ADR Accounting state/constraint parity gap; avoid broad refactoring or gated infrastructure."}}
{"run":327,"commit":"c3b174f","metric":244,"metrics":{"remaining_gates":0},"status":"keep","description":"Align public journal-line amounts with the database single-sided invariant.","timestamp":1787217392292,"segment":5,"confidence":4.033057851239669,"asi":{"hypothesis":"The journal_lines_amount_check requires exactly one positive debit or credit, but the public JournalLine schema accepted zero-sided and double-sided amounts; compare exact minor-unit values after the existing Money schema.","what_learned":"JournalLine now rejects both zero-sided and double-sided amounts, the portfolio reaches 244 gates with zero remaining, and all backpressure checks pass.","next_action_hint":"Continue with one bounded current-ADR Accounting constraint parity gap; prefer an existing database invariant with a minimal public regression."}}
{"run":328,"commit":"b4fd57a","metric":245,"metrics":{"remaining_gates":0},"status":"keep","description":"Align public accounting period dates with PostgreSQL ordering constraints.","timestamp":1787217843046,"segment":5,"confidence":4.083333333333333,"asi":{"hypothesis":"Accounting periods persist startsOn <= endsOn, but both public period schemas accepted reversed ISO dates; mirror the database invariant on OpenPeriodInput and AccountingPeriod.","what_learned":"Both public period schemas now reject August 20, 2026 through August 19, 2026 ranges, the portfolio reaches 245 gates with zero remaining, and all backpressure checks pass.","next_action_hint":"Continue with one concrete current-ADR Accounting constraint parity gap; avoid speculative redesign or gated infrastructure."}}
{"run":329,"commit":"4182da3","metric":246,"metrics":{"remaining_gates":0},"status":"keep","description":"Align public revenue-posting account identities with the database constraint.","timestamp":1787218283527,"segment":5,"confidence":4.066115702479339,"asi":{"hypothesis":"Accounting revenue-posting persistence requires receivableAccountId and revenueAccountId to differ, but both public configuration and profile schemas accepted equal IDs; mirror the existing distinct-account check at both boundaries.","what_learned":"Both public revenue-posting schemas now reject equal account IDs, the portfolio reaches 246 gates with zero remaining, and all backpressure checks pass.","next_action_hint":"Continue with one concrete current-ADR Accounting constraint parity gap; keep changes limited to existing public schemas and their owning database invariants."}}
{"run":330,"commit":"e2213b8","metric":247,"metrics":{"remaining_gates":0},"status":"keep","description":"Align financial-operation type and source-journal metadata with PostgreSQL.","timestamp":1787218790405,"segment":5,"confidence":4.049180327868853,"asi":{"hypothesis":"PostgreSQL requires journal_reverse operations to carry a source journal and journal_post/revenue_post operations to omit one, but public FinancialOperation and journal-intent schemas accepted contradictory combinations; share one typed cross-field check.","what_learned":"Both public financial-operation schemas now reject missing reverse sources and unexpected post sources, the portfolio reaches 247 gates with zero remaining, and all checks pass.","next_action_hint":"Continue with one concrete current-ADR Accounting constraint parity gap; avoid speculative infrastructure and gated ledger activation."}}
{"run":331,"commit":"5468930","metric":248,"metrics":{"remaining_gates":0},"status":"keep","description":"Align financial-operation status metadata with PostgreSQL state constraints.","timestamp":1787219258034,"segment":5,"confidence":4.065573770491803,"asi":{"hypothesis":"The database state matrix requires status-specific acceptance, rejection, recovery, and reconciliation metadata, but public FinancialOperation accepted contradictory terminal fields; mirror the existing state check without adding extra manual-recovery restrictions.","what_learned":"FinancialOperation now rejects invalid intent, accepted, rejected, manual-recovery, and reconciled metadata combinations; the portfolio reaches 248 gates with zero remaining and all checks pass.","next_action_hint":"Continue with one concrete current-ADR Accounting persistence/public-contract invariant; preserve exact database semantics and avoid speculative timestamp ordering."}}
{"run":332,"commit":"ca0e39e","metric":249,"metrics":{"remaining_gates":0},"status":"keep","description":"Align financial-transfer facts with distinct-account persistence constraints.","timestamp":1787222699904,"segment":5,"confidence":4.081967213114754,"asi":{"hypothesis":"Financial operation transfer rows require debitAccountId and creditAccountId to differ, but the public FinancialTransferFact schema accepted self-transfers; mirror the existing database check before reconciliation evidence consumes the fact.","what_learned":"FinancialTransferFact now rejects identical debit and credit account IDs, the portfolio reaches 249 gates with zero remaining, and all backpressure checks pass.","next_action_hint":"Continue with one concrete current-ADR Accounting constraint parity gap; preserve existing public ownership and avoid speculative infrastructure."}}
{"run":333,"commit":"24daf29","metric":250,"metrics":{"remaining_gates":0},"status":"keep","description":"Align financial-transfer fact amounts with positive U128 persistence limits.","timestamp":1787223434136,"segment":5,"confidence":4.065040650406504,"asi":{"hypothesis":"Financial operation transfers persist amounts strictly above zero and at or below the U128 maximum, but the public FinancialTransferFact amount accepted zero and arbitrary-length integers; add one exact schema boundary.","what_learned":"FinancialTransferFact.amountMinor now rejects zero and 2^128, the portfolio reaches 250 gates with zero remaining, and all backpressure checks pass.","next_action_hint":"Continue with one concrete current-ADR Accounting invariant; inspect remaining transfer/projection constraints without widening beyond persisted semantics."}}
{"run":334,"commit":"deb46db","metric":251,"metrics":{"remaining_gates":0},"status":"keep","description":"Align financial-transfer positions with PostgreSQL integer bounds.","timestamp":1787223766590,"segment":5,"confidence":4.048387096774194,"asi":{"hypothesis":"Financial operation transfer positions persist as non-negative PostgreSQL integers, but FinancialTransferFact.position only enforced non-negativity and could accept int4 overflow; reuse the existing Count boundary.","what_learned":"FinancialTransferFact.position now rejects -1 and 2_147_483_648, the portfolio reaches 251 gates with zero remaining, and all backpressure checks pass.","next_action_hint":"Continue with one concrete current-ADR Accounting invariant; inspect remaining transfer mapping/state fields without speculative infrastructure."}}
{"run":335,"commit":"deb46db","metric":251,"metrics":{"remaining_gates":1},"status":"checks_failed","description":"Bound financial fact mapping versions to PostgreSQL integer range.","timestamp":1787223848641,"segment":5,"confidence":4.048387096774194,"asi":{"hypothesis":"Financial operation and transfer facts carry persisted positive PostgreSQL integer mapping versions, but the readiness schemas accepted int4 overflow; share the existing PositiveInt boundary.","rollback_reason":"The candidate failed repository checks because FinancialOperationFact was not imported into packages/accounting/tests/financial-readiness.test.ts; the benchmark reached 251 but no source result was accepted and the candidate was reverted.","next_action_hint":"Reapply the same PositiveInt schema change and add the missing FinancialOperationFact public import before rerunning the complete portfolio."}}
