{"run":109,"commit":"8e42739","metric":71,"metrics":{"remaining_gates":0},"status":"keep","description":"Enforce exclusive Process workflow state metadata.","timestamp":1786751657272,"segment":5,"confidence":4.303030303030303,"asi":{"hypothesis":"Workflow runs should not combine recovery metadata with running or succeeded states, or completion metadata with manual recovery, at either the public schema or PostgreSQL boundary.","result":"WorkflowRun and workflow_runs_state_check now enforce mutually exclusive running, succeeded, and manual-recovery metadata; contract and PostgreSQL tests reject all contradictory combinations, and the manual-recovery fixture now transitions from a valid running row.","validation":"All seventy-one readiness gates passed; full formatting, lint, type, migration, skills, boundary, contract, and 140-test portfolio passed.","migration":"Added generated process-owned migration 20260814235005_tighten_process_workflow_state with reviewed ownership headers."}}
{"run":110,"commit":"3eb2e0e","metric":72,"metrics":{"remaining_gates":0},"status":"keep","description":"Constrain persisted Process workflow types to the registered vocabulary.","timestamp":1786751942074,"segment":5,"confidence":4.5,"asi":{"hypothesis":"PostgreSQL workflow rows must accept only the confirmation, cancellation, and fulfillment types exposed by the public ProcessWorkflowType schema, otherwise durable rows can become undecodable.","result":"process.workflow_runs now enforces the registered lifecycle workflow vocabulary with a named check constraint, and the PostgreSQL test rejects sales.order.unknown while preserving all current owner workflows.","validation":"All seventy-two readiness gates passed; full formatting, lint, type, migration, skills, boundary, contract, and 140-test portfolio passed.","migration":"Added generated process-owned migration 20260814235552_constrain_process_workflow_types with reviewed ownership headers."}}
{"run":111,"commit":"8a715cd","metric":73,"metrics":{"remaining_gates":0},"status":"keep","description":"Constrain persisted Process job types to the registered vocabulary.","timestamp":1786752136935,"segment":5,"confidence":4.424242424242424,"asi":{"hypothesis":"PostgreSQL process jobs must accept only the three post-commit job types exposed by ProcessPostCommitJobType, otherwise durable rows can become undecodable and unroutable.","result":"process.jobs now enforces the registered confirmation, cancellation, and fulfillment job vocabulary with a named check constraint, and the PostgreSQL test rejects process.unknown.post_commit.","validation":"All seventy-three readiness gates passed; full formatting, lint, type, migration, skills, boundary, contract, and 140-test portfolio passed.","migration":"Added generated process-owned migration 20260814235927_constrain_process_job_types with reviewed ownership headers."}}
{"run":112,"commit":"db4f29b","metric":74,"metrics":{"remaining_gates":0},"status":"keep","description":"Constrain persisted Process routing metadata to nonblank values.","timestamp":1786752385518,"segment":5,"confidence":4.352941176470588,"asi":{"hypothesis":"Workflow and job idempotency keys plus job correlation IDs must preserve the public NonEmptyString invariant in PostgreSQL, otherwise durable replay and routing identities can become blank and undecodable.","result":"process.workflow_runs and process.jobs now reject whitespace-only idempotency keys, and jobs reject whitespace-only correlation IDs; PostgreSQL tests verify each named constraint.","validation":"All seventy-four readiness gates passed; full formatting, lint, type, migration, skills, boundary, contract, and 140-test portfolio passed.","migration":"Added generated process-owned migration 20260815000306_constrain_process_routing_metadata with reviewed ownership headers dated August 14, 2026."}}
{"run":113,"commit":"66c05d5","metric":75,"metrics":{"remaining_gates":0},"status":"keep","description":"Constrain persisted Messaging identities to nonblank values.","timestamp":1786752627893,"segment":5,"confidence":4.411764705882353,"asi":{"hypothesis":"Messaging event routing identities and consumer receipt identities must preserve the public NonEmptyString contract in PostgreSQL so durable envelopes and receipts cannot become blank or undecodable.","result":"The messaging outbox now rejects blank event, aggregate, command, correlation, causation, idempotency, and actor identities; consumer receipts reject blank consumer IDs; one PostgreSQL proof verifies every named constraint.","validation":"All seventy-five readiness gates passed; full formatting, lint, type, migration, skills, boundary, contract, and 141-test portfolio passed.","migration":"Added generated messaging-owned migration 20260815000731_constrain_messaging_identities with review date August 14, 2026."}}
{"run":114,"commit":"869757d","metric":76,"metrics":{"remaining_gates":0},"status":"keep","description":"Align the Messaging test layer with source-event and rollback semantics.","timestamp":1786753251729,"segment":5,"confidence":4.470588235294118,"asi":{"hypothesis":"The in-memory Messaging test layer must require the same tenant-scoped source event as PostgreSQL and roll back event, dedupe, and receipt state when receipt completion cannot commit.","result":"Test-layer consumeOnce now snapshots all internal durable state, rejects missing or cross-tenant source events with DatabaseFailure, and restores nested messaging effects; consumer tests append source events and prove a cross-tenant failure remains cleanly retriable.","validation":"All seventy-six readiness gates passed; full formatting, lint, type, skills, boundary, contract, and 142-test portfolio passed.","parity":"The test substitution now matches the live consumer receipt foreign-key and rollback behavior without adding a new public error."}}
{"run":115,"commit":"869757d","metric":76,"metrics":{"remaining_gates":1},"status":"discard","description":"Serialize concurrent Messaging test-layer consumers.","timestamp":1786753519100,"segment":5,"confidence":4.3428571428571425,"asi":{"hypothesis":"A global test-layer consumer permit should match PostgreSQL duplicate suppression and prevent global snapshot rollback from racing unrelated in-memory consumer effects.","rollback_reason":"Behavior and all 143 tests passed, but the new readiness gate did not match the formatter's Semaphore.withPermit layout, so the primary metric did not improve and changes were reverted.","next_action_hint":"Reapply the unchanged global semaphore and concurrent duplicate regression, inspect the formatted call shape, then correct only the gate expression.","validated_behavior":"The unchanged full correctness portfolio passed with one winner, one duplicate, and one consumer effect execution."}}
{"run":116,"commit":"ca9668e","metric":77,"metrics":{"remaining_gates":0},"status":"keep","description":"Serialize concurrent Messaging test-layer consumers.","timestamp":1786753709829,"segment":5,"confidence":4.277777777777778,"asi":{"hypothesis":"A global test-layer consumer permit should match PostgreSQL duplicate suppression and prevent global snapshot rollback from racing concurrent in-memory consumer effects.","result":"makeMessagingTestLayer now serializes consumeOnce through one semaphore; a concurrent regression proves one winner, one duplicate, and one effect execution.","validation":"All seventy-seven readiness gates passed; full formatting, lint, type, skills, boundary, contract, and 143-test portfolio passed.","deliberate_simplification":"The test layer uses a global lock; keyed permits are only warranted if test consumer throughput becomes material.","retry_note":"The unchanged implementation was rerun after correcting the metric for deno-fmt's multiline Semaphore.withPermit layout."}}
{"run":117,"commit":"28c6a0e","metric":78,"metrics":{"remaining_gates":0},"status":"keep","description":"Reject cross-linked Process lifecycle replay results.","timestamp":1786754067415,"segment":5,"confidence":4.333333333333333,"asi":{"hypothesis":"Cancellation and fulfillment idempotent replay must verify that a schema-valid stored result belongs to the workflow row being replayed, not only that its fields decode.","result":"The shared lifecycle replay resolver now requires result.workflowRunId to equal the durable workflow row ID; a PostgreSQL corruption regression proves cancellation replay returns WorkflowResultCorrupt for a valid but cross-linked UUID.","validation":"All seventy-eight readiness gates passed; full formatting, lint, type, skills, boundary, contract, and 143-test portfolio passed.","coverage":"The shared resolver protects both cancellation and fulfillment replay paths."}}
{"run":118,"commit":"28c6a0e","metric":78,"metrics":{"remaining_gates":0},"status":"discard","description":"Recheck the current P3 readiness baseline.","timestamp":1786874030039,"segment":5,"confidence":4.333333333333333,"asi":{"hypothesis":"The current implementation should still satisfy all 78 readiness gates and the full backpressure validation portfolio before the next hardening experiment.","rollback_reason":"The baseline is unchanged at 78 gates, so it provides no improvement to the primary metric.","next_action_hint":"Harden confirmation idempotent replay against a schema-valid result cross-linked to another workflow run, then add a focused PostgreSQL regression gate."}}
{"run":119,"commit":"8953dc5","metric":79,"metrics":{"remaining_gates":0},"status":"keep","description":"Reject cross-linked confirmation replay results.","timestamp":1786874215347,"segment":5,"confidence":4.388888888888889,"asi":{"hypothesis":"Confirmation idempotent replay must verify that a schema-valid stored result belongs to the workflow row being replayed, just as cancellation and fulfillment replay already do.","result":"The confirmation replay resolver now rejects a result whose workflowRunId differs from the durable row ID; a PostgreSQL regression corrupts a persisted result with another UUID and proves confirmOrder returns WorkflowResultCorrupt without re-executing domain effects.","validation":"All seventy-nine readiness gates passed; full formatting, lint, type, skills, boundary, contract, and 143-test portfolio passed.","coverage":"The check closes the remaining confirmation path in the shared idempotent replay model."}}
{"run":120,"commit":"9d600ae","metric":80,"metrics":{"remaining_gates":0},"status":"keep","description":"Validate confirmation replay result ownership.","timestamp":1786874431653,"segment":5,"confidence":4.444444444444445,"asi":{"hypothesis":"A schema-valid confirmation result is still unsafe to replay if its durable row or nested order, reservation, or journal belongs to another tenant or order.","result":"Confirmation idempotent replay now checks row tenant and aggregate ownership plus nested order, reservation, and journal tenant identity; the PostgreSQL proof rejects both a detached order result and a cross-linked workflow result without replaying effects.","validation":"All eighty readiness gates passed; full formatting, lint, type, skills, boundary, contract, and 143-test portfolio passed.","parity":"The direct confirmation replay now applies the same ownership checks already used when cancellation and fulfillment load their confirmation."}}
{"run":121,"commit":"9d600ae","metric":80,"metrics":{"remaining_gates":1},"status":"discard","description":"Apply shared lifecycle replay ownership checks.","timestamp":1786874600686,"segment":5,"confidence":4.444444444444445,"asi":{"hypothesis":"Lifecycle idempotent replay should reject schema-valid results whose nested order is detached from the requested tenant/order, in addition to rejecting cross-linked workflow IDs.","rollback_reason":"The implementation and full correctness portfolio passed, but the new textual readiness gate did not match the formatter's generic type layout, leaving one gate unmet.","next_action_hint":"Reapply the same shared order-ownership check and inspect the exact formatted source before correcting only the gate expression."}}
{"run":122,"commit":"e10bb2d","metric":81,"metrics":{"remaining_gates":0},"status":"keep","description":"Reject cross-linked lifecycle replay results.","timestamp":1786874773935,"segment":5,"confidence":4.5,"asi":{"hypothesis":"Cancellation and fulfillment idempotent replay must verify nested order ownership, not only the workflowRunId linkage already checked by the shared resolver.","result":"The shared lifecycle replay resolver now requires a typed order identity and matching requested order/tenant; the cancellation PostgreSQL proof rejects both a detached order and a cross-linked workflow result.","validation":"All eighty-one readiness gates passed; full formatting, lint, type, skills, boundary, contract, and 143-test portfolio passed.","coverage":"The shared resolver protects both cancellation and fulfillment replay paths."}}
{"run":123,"commit":"7e93eab","metric":82,"metrics":{"remaining_gates":0},"status":"keep","description":"Validate nested lifecycle replay ownership.","timestamp":1786874970211,"segment":5,"confidence":4.4324324324324325,"asi":{"hypothesis":"Lifecycle replay results remain unsafe when their returned reservations or reversal journal cross tenant boundaries even if workflow and order identities match.","result":"The shared resolver now accepts owner-specific nested identity checks; cancellation verifies every released reservation and reversal journal tenant, while fulfillment verifies every fulfilled reservation. PostgreSQL regressions cover both paths.","validation":"All eighty-two readiness gates passed; full formatting, lint, type, skills, boundary, contract, and 143-test portfolio passed.","design":"The resolver keeps common workflow/order checks centralized and lets each result shape enforce its own nested ownership invariant."}}
{"run":124,"commit":"7e93ea","metric":80,"metrics":{"remaining_gates":3},"status":"checks_failed","description":"Bind Inventory and Accounting publication to typed event contracts.","timestamp":1786875277208,"segment":5,"confidence":4.315789473684211,"asi":{"hypothesis":"Owner services should derive event identity and payload validation from their public catalog declarations instead of duplicating raw strings and unvalidated JSON.","failure":"The full test portfolio failed because in-memory Inventory and Accounting layers intentionally generate non-UUID IDs while the public event payload schemas require PostgreSQL UUIDs; three contract publication tests returned SchemaError before the expected effects.","rollback_reason":"Backpressure checks failed; all implementation changes were reverted while autoresearch files were preserved.","next_action_hint":"Reapply typed event modules and either make test-layer generated identifiers UUID-shaped, or keep runtime catalog decoding only on PostgreSQL paths without weakening the public payload schemas."}}
{"run":125,"commit":"7e93ea","metric":81,"metrics":{"remaining_gates":2},"status":"discard","description":"Bind typed event declarations after UUID test-layer parity adjustment.","timestamp":1786875611382,"segment":5,"confidence":4.315789473684211,"asi":{"hypothesis":"Typed Inventory and Accounting publication can validate UUID payloads in PostgreSQL paths while test layers use UUID-shaped generated IDs and preserve arbitrary legal-entity fixture inputs in their local substitution.","rollback_reason":"The full portfolio passed, but the readiness metric fell to 81/83 because two existing textual gates no longer matched the refactor, so this candidate was not kept.","next_action_hint":"Inspect the two unmet readiness gates, then reapply the typed-event refactor with gate expressions updated only for the intentional event-module layout."}}
{"run":126,"commit":"7e93ea","metric":81,"metrics":{"remaining_gates":2},"status":"discard","description":"Retry typed Inventory and Accounting event publication with UUID-shaped test IDs.","timestamp":1786875882006,"segment":5,"confidence":4.315789473684211,"asi":{"hypothesis":"The typed event refactor should pass once PostgreSQL-only payload validation is paired with UUID-shaped generated test-layer IDs.","rollback_reason":"Checks passed, but the readiness metric remained 81/83; the candidate did not increase the baseline and was reverted.","next_action_hint":"Use bash tracing to identify the two existing gates affected by the event-module refactor before another reapplication."}}
{"run":127,"commit":"7e93ea","metric":82,"metrics":{"remaining_gates":1},"status":"discard","description":"Align readiness gates with typed event module ownership.","timestamp":1786876062381,"segment":5,"confidence":4.205128205128205,"asi":{"hypothesis":"Moving Inventory and Accounting event declarations into cycle-free event modules should satisfy the existing public-event gates once their ownership path is updated.","rollback_reason":"The full portfolio passed, but one readiness gate remained unmet after the module split; the candidate did not improve the primary metric and was reverted.","next_action_hint":"Inspect the typed-event gate's exact count or path assumptions, then reapply only the gate-compatible source layout."}}
{"run":128,"commit":"7e93ea","metric":82,"metrics":{"remaining_gates":1},"status":"discard","description":"Verify typed event gate after updating declaration ownership paths.","timestamp":1786876267482,"segment":5,"confidence":4.315789473684211,"asi":{"hypothesis":"The typed event gate should pass after deriving its PUBLIC stability check from the new event modules and confirming both owner append paths use catalog identities.","rollback_reason":"Direct count checks passed and the full portfolio passed, but one other readiness gate remained unmet; the candidate did not improve the primary metric and was reverted.","next_action_hint":"Trace the complete measure script under the candidate or split the remaining event gate expressions to identify the stale check."}}
{"run":129,"commit":"ee1e120","metric":83,"metrics":{"remaining_gates":0},"status":"keep","description":"Bind Inventory and Accounting events to typed owner declarations.","timestamp":1786876690336,"segment":5,"confidence":4.256410256410256,"asi":{"hypothesis":"Inventory and Accounting owner services should use cycle-free public event declarations for event identity and validate PostgreSQL event payloads against those schemas, rather than duplicating raw event metadata.","result":"Moved Inventory and Accounting event payload/catalog declarations into owner event modules, bound both production and test publication identities to the declarations, validated PostgreSQL payloads, and made generated test IDs UUID-shaped so the substitution remains compatible with public event schemas. Existing readiness gates now follow the declaration owner modules.","validation":"All eighty-three readiness gates passed; full formatting, lint, type, skills, boundary, contract, and 143-test portfolio passed.","tradeoff":"Test-layer legal-entity fixtures remain arbitrary strings, so only PostgreSQL owner paths decode UUID event payloads; test publication still uses the typed event identity and exact payload assertions."}}
{"run":130,"commit":"ee1e120","metric":83,"metrics":{"remaining_gates":1},"status":"discard","description":"Bind Sales publication to its typed event declaration.","timestamp":1786876918020,"segment":5,"confidence":4.15,"asi":{"hypothesis":"Sales should use the same cycle-free typed event declaration pattern as Inventory and Accounting, including production payload validation and catalog-derived event identity.","rollback_reason":"The full portfolio passed, but moving the Sales payload declaration exposed one stale readiness gate still looking in the old catalog file; the primary metric did not improve.","next_action_hint":"Update the UUID declaration gate to follow the Sales event module, then rerun the unchanged Sales refactor."}}
{"run":131,"commit":"8c421c4","metric":84,"metrics":{"remaining_gates":0},"status":"keep","description":"Bind Sales publication to its typed event declaration.","timestamp":1786877116407,"segment":5,"confidence":4.2,"asi":{"hypothesis":"Sales owner publication should derive event identity and payload validation from a cycle-free public declaration, matching Inventory and Accounting.","result":"Moved Sales confirmation event payload/catalog declaration into an event module, bound both production and test publication paths to catalog identity, and validated both payload paths against the public event schema.","validation":"All eighty-four readiness gates passed; full formatting, lint, type, skills, boundary, contract, and 143-test portfolio passed.","consistency":"All three owner domain event publication paths now use typed declaration identities; Process already followed the same pattern."}}
{"run":132,"commit":"eab8144","metric":85,"metrics":{"remaining_gates":0},"status":"keep","description":"Constrain Process job lease state metadata.","timestamp":1786877469929,"segment":5,"confidence":4.25,"asi":{"hypothesis":"A durable Process job must not appear pending, completed, failed, or manual-recovery while retaining a lease timestamp; only leased jobs may carry lease_until.","result":"ProcessJob now rejects contradictory lease metadata, process.jobs enforces the same invariant with process_jobs_lease_state_check, and a generated process-owned migration plus contract/PostgreSQL regressions cover invalid pending leases and valid leased rows.","validation":"All eighty-five readiness gates passed; full formatting, lint, type, skills, boundary, contract, and 143-test portfolio passed.","migration":"Added db/migrations/20260816104809_constrain_process_job_lease_state with process ownership and Drizzle Kit 1.0.0-rc.4 headers."}}
