{"run":133,"commit":"36de95c","metric":86,"metrics":{"remaining_gates":0},"status":"keep","description":"Constrain Process job terminal state metadata.","timestamp":1786877687634,"segment":5,"confidence":4.195121951219512,"asi":{"hypothesis":"Process jobs should use a coherent durable state machine: pending and leased jobs cannot be completed, completed jobs require completed_at, and failed/manual-recovery jobs cannot retain completion metadata.","result":"Added process_jobs_state_check as a new generated process-owned migration and PostgreSQL regression while retaining the lease-state contract; invalid pending completion metadata is now rejected.","validation":"All eighty-six readiness gates passed; full formatting, lint, type, skills, boundary, contract, and repository tests passed.","tradeoff":"The public ProcessJob contract remains intentionally free of internal lastError/completedAt fields; the PostgreSQL invariant protects those storage-only lifecycle columns."}}
{"run":134,"commit":"36de95c","metric":86,"metrics":{"remaining_gates":1},"status":"checks_failed","description":"Add Sales order confirmation metadata constraint.","timestamp":1786877947171,"segment":5,"confidence":4.095238095238095,"asi":{"hypothesis":"Sales orders should not carry a confirmation idempotency key while draft, and confirmed or cancelled orders should retain a nonblank key and confirmation timestamp.","rollback_reason":"The new PostgreSQL regression exposed a three-valued CHECK expression: confirmed rows with a null confirmation key passed because the regex term evaluated to NULL, so the contract test failed before the candidate could be kept.","next_action":"Add an explicit confirmation_idempotency_key is not null predicate to the metadata check, regenerate the migration from the prior snapshot, and rerun the focused Sales PostgreSQL test before the full portfolio.","error":"The candidate reached p3_ready_gates=86 but .auto/checks.sh failed one Sales contract test."}}
{"run":135,"commit":"36de95c","metric":85,"metrics":{"remaining_gates":2},"status":"checks_failed","description":"Retry Sales order confirmation metadata constraint after null-check fix.","timestamp":1786877986462,"segment":5,"confidence":4.095238095238095,"asi":{"hypothesis":"Adding an explicit non-null predicate should make the Sales confirmation metadata check reject both orphaned draft keys and confirmed rows without a key.","rollback_reason":"Focused PostgreSQL test passed, but backpressure checks failed because the new test was not deno-formatted and the readiness harness still referenced the reverted migration directory name 20260816105557 instead of regenerated 20260816105927; metric fell because checks stopped before the full portfolio.","next_action":"Reapply the corrected schema, test, and generated migration; run deno fmt on the test and update only the new readiness gate path to 20260816105927, then rerun.","error":"Benchmark reached p3_ready_gates=85, remaining_gates=2; .auto/checks.sh failed formatting and the stale migration-path gate."}}
{"run":136,"commit":"dc29a68","metric":87,"metrics":{"remaining_gates":0},"status":"keep","description":"Constrain Sales order confirmation metadata.","timestamp":1786878173568,"segment":5,"confidence":4.142857142857143,"asi":{"hypothesis":"Sales orders should not carry a confirmation idempotency key while draft, and confirmed or cancelled orders should retain a nonblank key and confirmation timestamp.","result":"Added orders_confirmation_metadata_check with explicit non-null and nonblank predicates, a generated sales-owned migration, and PostgreSQL regressions for orphaned draft keys and confirmed rows missing keys.","validation":"All eighty-seven readiness gates passed; full formatting, lint, type, skills, boundary, contract, and repository tests passed.","lesson":"PostgreSQL CHECK expressions require explicit IS NOT NULL predicates because NULL results satisfy CHECK constraints."}}
{"run":137,"commit":"dc29a68","metric":87,"metrics":{"remaining_gates":1},"status":"checks_failed","description":"Constrain Accounting journal reversal state metadata.","timestamp":1786878288142,"segment":5,"confidence":4.046511627906977,"asi":{"hypothesis":"A journal entry should only carry reverses_entry_id in the reversed terminal state; draft and posted entries should not masquerade as reversal rows.","rollback_reason":"The new PostgreSQL check rejected the existing transactional reversal path because reverseRevenueForOrder inserted a draft row with reverses_entry_id before adding lines and promoting it to reversed; checks failed in the cancellation lifecycle test with WorkflowOutcomeUnknown.","next_action":"Keep the stronger invariant but insert the reversal row as an ordinary draft, then set reverses_entry_id together with status and posted_at in the final update so the transaction has no invalid intermediate row.","error":"Benchmark remained at p3_ready_gates=87; .auto/checks.sh failed one process cancellation PostgreSQL test."}}
{"run":138,"commit":"3d7dcfd","metric":88,"metrics":{"remaining_gates":0},"status":"keep","description":"Constrain Accounting journal reversal state.","timestamp":1786878472660,"segment":5,"confidence":4,"asi":{"hypothesis":"Journal entries should only carry reverses_entry_id in the reversed terminal state; draft and posted entries must remain ordinary entries.","result":"Added journal_entries_reversal_state_check, a generated accounting-owned migration, and PostgreSQL regression coverage. The reversal service now inserts a plain draft, adds lines, then atomically sets reverses_entry_id with reversed status and posted_at, avoiding an invalid intermediate row.","validation":"All eighty-eight readiness gates passed; full formatting, lint, type, skills, boundary, contract, and repository tests passed.","lesson":"State constraints must account for transactional intermediate states; move metadata assignment into the terminal update rather than weakening the invariant."}}
{"run":139,"commit":"633d209","metric":89,"metrics":{"remaining_gates":0},"status":"keep","description":"Constrain Accounting journal references.","timestamp":1786878675879,"segment":5,"confidence":4.045454545454546,"asi":{"hypothesis":"Journal references are durable idempotency identities and must be nonblank at both the public command boundary and PostgreSQL storage boundary.","result":"PostJournalInput now uses NonEmptyString, journal_entries has journal_entries_reference_check, and pure plus PostgreSQL tests reject whitespace-only references.","validation":"All eighty-nine readiness gates passed; full formatting, lint, type, skills, boundary, contract, and repository tests passed.","compatibility":"Valid existing references and generated revenue references are unchanged; only invalid whitespace-only references are rejected earlier as SchemaError."}}
{"run":140,"commit":"57f9102","metric":90,"metrics":{"remaining_gates":0},"status":"keep","description":"Reject revenue posting against draft journal references.","timestamp":1786878863919,"segment":5,"confidence":4.090909090909091,"asi":{"hypothesis":"postRevenueForOrder must not treat a schema-valid but non-posted journal row occupying its deterministic reference as a successful replay.","result":"The Accounting service now returns JournalIdempotencyConflict for existing draft or timestamp-less rows before reading lines or asserting postedAt; a PostgreSQL regression creates a draft revenue reference and verifies the typed conflict.","validation":"All ninety readiness gates passed; full formatting, lint, type, skills, boundary, contract, and repository tests passed."}}
{"run":141,"commit":"39266e9","metric":91,"metrics":{"remaining_gates":0},"status":"keep","description":"Tighten JournalEntry public reference identity.","timestamp":1786879155445,"segment":5,"confidence":4.044444444444444,"asi":{"hypothesis":"The public JournalEntry DTO should enforce the same nonblank reference identity already required by PostJournalInput and PostgreSQL.","result":"JournalEntry.reference now uses NonEmptyString and a contract regression rejects whitespace-only references.","validation":"All ninety-one readiness gates passed; full formatting, lint, type, skills, boundary, contract, and repository tests passed."}}
{"run":142,"commit":"1f23432","metric":92,"metrics":{"remaining_gates":0},"status":"keep","description":"Make concurrent Inventory reservation retries idempotent.","timestamp":1786879488254,"segment":5,"confidence":4,"asi":{"hypothesis":"Concurrent reserveStock calls with the same tenant-scoped idempotency key and identical reservation payload should return one durable reservation, matching adjustStock duplicate semantics instead of surfacing a unique-key conflict.","result":"On a reservation unique-key race, the service now reloads the committed reservation and returns it when warehouse, item, and quantity match; mismatches still produce StockReservationIdempotencyConflict. PostgreSQL coverage exercises concurrent duplicates and a same-key mismatch.","validation":"All ninety-two readiness gates passed; full formatting, lint, type, skills, boundary, contract, and repository tests passed.","test_note":"The regression keeps the existing stock-correction concurrency headroom by reserving one idempotent unit plus three non-idempotent units before the correction race."}}
{"run":143,"commit":"1f23432","metric":92,"metrics":{"remaining_gates":1},"status":"discard","description":"Make concurrent Accounting revenue posting idempotent.","timestamp":1786879917507,"segment":5,"confidence":4,"asi":{"hypothesis":"Concurrent postRevenueForOrder calls for the same deterministic revenue reference should reload the committed posted journal after a unique-key race and return the same result instead of a typed conflict.","rollback_reason":"The implementation and full validation passed, but the readiness metric fell from 92 to 91/93 because the earlier guard gate still searched for the replaced inline existing[0].status expression; this was a stale harness assertion, not a behavioral failure.","next_action":"Reapply the helper and race regression, update the prior readiness gate to recognize the new loadExisting status guard, then rerun the full portfolio.","harness_issue":"Old gate grep -Fq existing[0].status !== \"posted\" no longer matches after the equivalent guard moved into loadExisting."}}
{"run":144,"commit":"fbe3367","metric":93,"metrics":{"remaining_gates":0},"status":"keep","description":"Make concurrent Accounting revenue posting idempotent.","timestamp":1786880110868,"segment":5,"confidence":4.043478260869565,"asi":{"hypothesis":"Concurrent postRevenueForOrder calls for the same deterministic revenue reference should reload the committed posted journal after a unique-key race and return the same result instead of a typed conflict.","result":"Factored posted-revenue replay loading into loadExisting, used it for both the fast path and the journal-reference unique-race recovery, preserved non-duplicate database/event/schema failures with catchIf, and added PostgreSQL concurrent duplicate coverage.","validation":"All ninety-three readiness gates passed; full formatting, lint, type, skills, boundary, contract, and repository tests passed.","lesson":"Effect.catch replaces the typed error channel; catchIf is required here to recover only the mapped DatabaseFailure while preserving other public failures."}}
{"run":145,"commit":"fbe3367","metric":93,"metrics":{"remaining_gates":1},"status":"discard","description":"Harden duplicate Inventory stock correction after balance-lock races.","timestamp":1786880388847,"segment":5,"confidence":4.043478260869565,"asi":{"hypothesis":"After a duplicate adjustStock caller waits for the stock-balance lock, it should recheck the idempotency movement before applying availability checks; otherwise a valid retry can be misclassified unavailable when the first adjustment consumes reserved headroom.","rollback_reason":"Implementation and full validation passed, but the readiness metric stayed at 93/94 because the new gate searched for the unformatted token const existingAfterLock while source correctly declares const [existingAfterLock].","next_action":"Reapply the balance-lock idempotency recheck and update the gate to grep the actual destructured declaration token, then rerun.","harness_issue":"The candidate gate used const existingAfterLock but formatted source uses const [existingAfterLock]."}}
{"run":146,"commit":"22279b4","metric":94,"metrics":{"remaining_gates":0},"status":"keep","description":"Recheck Inventory correction idempotency after balance locking.","timestamp":1786880577325,"segment":5,"confidence":4.086956521739131,"asi":{"hypothesis":"A duplicate adjustStock caller that waits for the stock-balance lock must recheck the idempotency movement before availability validation; otherwise a valid retry can be reported StockUnavailable when the first correction consumes the remaining unreserved stock headroom.","result":"Added a post-lock movement recheck for existing stock balances, preserving mismatch conflicts and returning the committed correction before applying a second adjustment. The existing PostgreSQL concurrency regression now runs with reserved headroom exactly at the duplicate correction boundary.","validation":"All ninety-four readiness gates passed; full formatting, lint, type, skills, boundary, contract, and repository tests passed.","scope":"The no-balance positive-adjustment path remains protected by the movement unique constraint and transaction rollback; the regression covers the balance-lock race that previously produced the false unavailable result."}}
{"run":147,"commit":"e21c68f","metric":95,"metrics":{"remaining_gates":0},"status":"keep","description":"Serialize concurrent Accounting revenue reversals.","timestamp":1786880794901,"segment":5,"confidence":4.042553191489362,"asi":{"hypothesis":"Concurrent reverseRevenueForOrder calls for the same deterministic reversal reference should recheck after the legal-entity profile lock and return the committed reversal instead of racing into a unique-reference failure.","result":"Added a post-profile-lock reversal lookup and PostgreSQL concurrent reversal coverage, preserving one reversal journal and identical results for both callers.","validation":"All ninety-five readiness gates passed; full formatting, lint, type, skills, boundary, contract, and repository tests passed.","transaction":"The second transaction waits on the existing profile lock; the recheck occurs before source reads, line copies, or reversal insertion."}}
{"run":148,"commit":"e81a007","metric":96,"metrics":{"remaining_gates":0},"status":"keep","description":"Reject corrupted draft revenue reversal identities.","timestamp":1786881080014,"segment":5,"confidence":4.173913043478261,"asi":{"hypothesis":"A deterministic revenue-reversal reference occupied by a draft or timestamp-less journal must not be replayed as a successful reversal; it should produce a typed JournalIdempotencyConflict.","result":"ReverseRevenueForOrder now validates existing and post-profile-lock concurrent rows before returning them, maps invalid reversal identities to JournalIdempotencyConflict, and Process propagates that actionable accounting conflict through OrderLifecycleFailure. PostgreSQL coverage inserts a draft reversal reference and verifies the conflict.","validation":"All ninety-six readiness gates passed; full formatting, lint, type, skills, boundary, contract, and repository tests passed.","boundary":"The new failure is business-actionable at the accounting/process boundary and does not expose database details."}}
{"run":149,"commit":"2adbb11","metric":97,"metrics":{"remaining_gates":0},"status":"keep","description":"Prevent fulfillment from consuming unavailable stock.","timestamp":1786881464208,"segment":5,"confidence":4.127659574468085,"asi":{"hypothesis":"fulfillReservation must verify that the stock balance update actually matches sufficient on-hand and reserved quantities before marking the reservation fulfilled and inserting an issue movement; otherwise a corrupted balance can leave a fulfilled reservation without stock deduction.","result":"The PostgreSQL fulfillment update now uses sufficient-stock predicates and requires a returned balance row; an unavailable result is mapped to StockUnavailable and propagated through Process. Regression coverage creates an active reservation, lowers its balance to zero, and verifies fulfillment leaves the reservation active with no issue movement.","validation":"All ninety-seven readiness gates passed; full formatting, lint, type, skills, boundary, contract, and repository tests passed.","deferred":"releaseReservation has the same ignored-update-count shape and remains a separate candidate; this change prevents the higher-risk issue/fulfillment corruption path."}}
{"run":150,"commit":"7f549e8","metric":98,"metrics":{"remaining_gates":0},"status":"keep","description":"Prevent release from consuming unavailable reservation balance.","timestamp":1786881687130,"segment":5,"confidence":4.083333333333333,"asi":{"hypothesis":"releaseReservation must verify that the reserved balance update affects a row with enough reserved quantity before marking the reservation released and inserting a release movement; otherwise a corrupted balance can silently lose reservation accounting.","result":"The PostgreSQL release update now requires sufficient reserved quantity and a returned row; an unavailable result maps to StockUnavailable and propagates through Process. The regression reuses a reservation whose balance was lowered to zero and verifies no release movement is written.","validation":"All ninety-eight readiness gates passed; full formatting, lint, type, skills, boundary, contract, and repository tests passed.","tradeoff":"StockUnavailable is used for an unavailable backing balance on both release and fulfillment, preserving existing stable domain failure vocabulary without adding an infrastructure-specific corruption error."}}
{"run":151,"commit":"7f549e8","metric":98,"metrics":{"remaining_gates":1},"status":"discard","description":"Reject cross-linked revenue reversal replay.","timestamp":1786882542759,"segment":5,"confidence":4.083333333333333,"asi":{"hypothesis":"A schema-valid reversed journal occupying a deterministic reversal reference is unsafe to replay when its reverses_entry_id does not point to the posted source journal for that order.","result":"Attempted to validate existing and post-profile-lock concurrent reversal rows against the source reference and added a balanced draft-to-reversed PostgreSQL corruption regression.","rollback_reason":"The implementation passed all correctness checks, but the readiness gate used the pre-format camelCase test token while the raw SQL regression correctly uses reverses_entry_id, so the primary metric stayed at 98/99.","next_action_hint":"Reapply the unchanged source-link validation and update the textual gate to the formatted SQL token before rerunning."}}
{"run":152,"commit":"525c38f","metric":99,"metrics":{"remaining_gates":0},"status":"keep","description":"Reject cross-linked revenue reversal replay.","timestamp":1786882722249,"segment":5,"confidence":4.125,"asi":{"hypothesis":"A schema-valid reversed journal occupying a deterministic reversal reference is unsafe to replay when its reverses_entry_id does not point to the posted source journal for that order.","result":"ReverseRevenueForOrder now validates existing and post-profile-lock concurrent rows against the posted source journal identity before returning them; a balanced draft-to-reversed corruption regression now yields JournalIdempotencyConflict.","validation":"All ninety-nine readiness gates passed; full formatting, lint, type, skills, boundary, contract, and repository tests passed.","transaction":"Source and reversal rows are locked within the same transaction, so concurrent valid replay remains idempotent while corrupted cross-links are rejected."}}
{"run":153,"commit":"199cda2","metric":100,"metrics":{"remaining_gates":0},"status":"keep","description":"Reject corrupted revenue reversal lines.","timestamp":1786882939182,"segment":5,"confidence":4.25531914893617,"asi":{"hypothesis":"A reversed journal should replay only when its persisted lines are the exact inverse of the posted source journal; source-link validation alone still permits a balanced but semantically wrong reversal to be returned.","result":"Added transaction-local source/reversal line comparison for initial and post-profile-lock concurrent replay, with normalized inverse lines and a PostgreSQL regression using balanced but non-inverse reversal lines.","validation":"All one-hundred readiness gates passed; full formatting, lint, type, skills, boundary, contract, and repository tests passed.","invariant":"The check preserves valid replay and rejects mismatched line identities before callers receive a corrupted reversal result."}}
