{"run":233,"commit":"64be9b5","metric":172,"metrics":{"remaining_gates":0},"status":"keep","description":"Require all owner capabilities on confirmation replay.","timestamp":1786926019311,"segment":5,"confidence":4.467532467532467,"asi":{"hypothesis":"A completed Process confirmation replay must re-check the Sales, Inventory, and Accounting owner capabilities before returning a durable result; the replay test and readiness gates now prove each capability is required.","next_action_hint":"Run the corrected measurement once to confirm all 172 gates are counted and identify any remaining bounded ADR-0033 or consumer invariant beyond the authorization portfolio."}}
{"run":234,"commit":"998f231","metric":173,"metrics":{"remaining_gates":0},"status":"keep","description":"Prove fulfillment rolls back prior reservation changes when a later reservation is invalid.","timestamp":1786926426178,"segment":5,"confidence":4.435897435897436,"asi":{"hypothesis":"Fulfillment must run every reservation mutation in one transaction; if a later reservation is already released, the earlier reservation and stock balance changes must roll back along with the workflow, event, and job.","next_action_hint":"Continue with a distinct in-scope provenance or lifecycle invariant; the full validation portfolio and the new rollback evidence pass."}}
{"run":235,"commit":"998f231","metric":173,"metrics":{"remaining_gates":1},"status":"checks_failed","description":"Derive Accounting revenue amount from the Sales confirmed-order fact.","timestamp":1786926810118,"segment":5,"confidence":4.379746835443038,"asi":{"hypothesis":"Accounting revenue posting must ignore caller-supplied amount and derive journal lines from the Sales-owned confirmed order total through a public cross-domain query.","rollback_reason":"Backpressure checks failed because the new tampering assertion was inserted before an existing event-count assertion, so the test saw the intentional second event instead of the first posting event.","next_action_hint":"Reapply the cross-domain Sales total query and Accounting wiring, then place the tampering post after the existing one-event assertions."}}
{"run":236,"commit":"3eec977","metric":174,"metrics":{"remaining_gates":0},"status":"keep","description":"Derive Accounting revenue amount from the Sales confirmed-order fact.","timestamp":1786927147280,"segment":5,"confidence":4.35,"asi":{"hypothesis":"Accounting revenue posting must ignore caller-supplied amount and derive journal lines from the Sales-owned confirmed order total through a public cross-domain query in the ambient transaction.","next_action_hint":"Continue with a distinct provenance or lifecycle invariant; the full validation portfolio and cross-domain dependency checks pass, while PostgreSQL integration tests remain environment-dependent."}}
{"run":237,"commit":"3eec977","metric":174,"metrics":{"remaining_gates":0},"status":"discard","description":"Document Sales-owned revenue provenance in ADR-0033.","timestamp":1786927348380,"segment":5,"confidence":4.35,"asi":{"hypothesis":"The ADR should explicitly record that Accounting reads the confirmed Sales total through the public contract inside the ambient transaction.","rollback_reason":"Documentation-only candidate did not improve the primary readiness-gate metric, so autoresearch correctly discarded it; the wording can be included with the next substantive keep.","next_action_hint":"Choose a distinct bounded lifecycle or messaging invariant before updating canonical documentation again."}}
{"run":238,"commit":"303e98b","metric":175,"metrics":{"remaining_gates":0},"status":"keep","description":"Reject missing Messaging source events before running consumer effects.","timestamp":1786927583934,"segment":5,"confidence":4.375,"asi":{"hypothesis":"Durable consumer completion must verify a tenant-matching source event before executing a PostgreSQL-local effect; otherwise a missing source can trigger unnecessary work before the receipt foreign key rolls back.","next_action_hint":"Continue with a distinct durable consumer, provenance, or lifecycle invariant; full checks pass and the new PostgreSQL proof is environment-gated when DATABASE_URL is absent."}}
{"run":239,"commit":"303e98b","metric":175,"metrics":{"remaining_gates":1},"status":"checks_failed","description":"Prove Inventory transfer movement conservation and retry idempotency.","timestamp":1786927746489,"segment":5,"confidence":4.320987654320987,"asi":{"hypothesis":"A confirmed/completed transfer must create exactly one issue and one receipt movement per line, with quantities conserved across source and destination and no duplicate movements on completion retry.","rollback_reason":"The movement assertion used a fixed destination-first order while PostgreSQL ordered by warehouse UUID; the balances and movement data were correct but the test ordering was brittle.","next_action_hint":"Reapply the movement assertion and sort expected rows by the same warehouse/item/kind key as the query before rerunning."}}
{"run":240,"commit":"ca758f5","metric":176,"metrics":{"remaining_gates":0},"status":"keep","description":"Prove Inventory transfer movement conservation and retry idempotency.","timestamp":1786927927356,"segment":5,"confidence":4.2926829268292686,"asi":{"hypothesis":"A confirmed/completed transfer must create exactly one issue and one receipt movement per line, with quantities conserved across source and destination and no duplicate movements on completion retry.","next_action_hint":"Continue with a distinct durable consumer, provenance, or lifecycle invariant; full checks pass and the PostgreSQL proof is environment-gated when DATABASE_URL is absent."}}
{"run":241,"commit":"db0f042","metric":177,"metrics":{"remaining_gates":0},"status":"keep","description":"Prove Sales confirmed-order totals are tenant-scoped and state-gated.","timestamp":1786928148603,"segment":5,"confidence":4.317073170731708,"asi":{"hypothesis":"The Sales-owned accounting fact query must reject draft orders and foreign-tenant order IDs while returning only a confirmed order's server-derived total.","next_action_hint":"Continue with a distinct transaction, durable-consumer, or lifecycle invariant; the full validation portfolio passes."}}
{"run":242,"commit":"e78d4e3","metric":179,"metrics":{"remaining_gates":0},"status":"keep","description":"Authorize Sales confirmed-order total reads.","timestamp":1786928447918,"segment":5,"confidence":4.365853658536586,"asi":{"hypothesis":"The new Sales-owned fact query is a public tenant-scoped read and must deny by default; a narrow sales.order.read capability is enforced before draft/tenant lookup and rechecked on Process confirmation replay.","next_action_hint":"Continue with a distinct transaction, durable-consumer, or lifecycle invariant; full repository checks pass."}}
{"run":243,"commit":"e78d4e3","metric":179,"metrics":{"remaining_gates":0},"status":"discard","description":"Confirm the authorized Sales fact-query portfolio remains stable.","timestamp":1786928665174,"segment":5,"confidence":4.313253012048193,"asi":{"hypothesis":"The Sales order-read capability and Process replay authorization should remain stable under a second full portfolio run.","rollback_reason":"No source candidate was present and the primary metric was unchanged at 179; this was a confirmation run only.","next_action_hint":"Make a distinct source or regression-test improvement before the next benchmark."}}
{"run":244,"commit":"8d47140","metric":180,"metrics":{"remaining_gates":0},"status":"keep","description":"Restrict Sales cancellation to a coordinator-owned participant contract.","timestamp":1786929045713,"segment":5,"confidence":4.285714285714286,"asi":{"hypothesis":"A standalone SalesService.cancelOrder can cancel confirmed orders without Inventory or Accounting coordination; renaming the participant operation to cancelConfirmedOrder and removing the standalone command shape makes Process the explicit lifecycle command owner without cross-domain coupling.","next_action_hint":"Continue with a distinct lifecycle or transactional invariant, and update ADR-0033 documentation alongside the next substantive readiness improvement."}}
{"run":245,"commit":"97965be","metric":181,"metrics":{"remaining_gates":0},"status":"keep","description":"Lock Sales confirmed-order facts inside the Accounting transaction.","timestamp":1786929289456,"segment":5,"confidence":4.309523809523809,"asi":{"hypothesis":"Accounting's server-derived revenue amount must read and lock the confirmed Sales order row through the ambient transaction so cancellation/status transitions cannot race the financial fact lookup.","next_action_hint":"Continue with a distinct transactional, durable-consumer, or lifecycle invariant; update ADR-0033 documentation with the accumulated contract/ownership changes when the next substantive change lands."}}
{"run":246,"commit":"a27dd5a","metric":182,"metrics":{"remaining_gates":0},"status":"keep","description":"Release Accounting revenue posting as a public catalog action after owner-derived provenance.","timestamp":1786929647932,"segment":5,"confidence":4.333333333333333,"asi":{"hypothesis":"Accounting can now expose accounting.revenue.post as a PUBLIC Level 3 action because the transaction derives and locks the confirmed Sales order total instead of trusting caller-supplied amount; roadmap summaries should record the third bounded provider slice.","next_action_hint":"Continue with a distinct cancellation/fulfillment, durable-consumer, or public-contract invariant; avoid catalog-only changes unless they close an executable gap."}}
{"run":247,"commit":"049b7f5","metric":183,"metrics":{"remaining_gates":0},"status":"keep","description":"Declare the confirmed Sales-order precondition in the Accounting revenue action metadata.","timestamp":1786929933125,"segment":5,"confidence":4.357142857142857,"asi":{"hypothesis":"A public Accounting revenue action must declare its owner-derived Sales confirmation prerequisite in the bounded catalog vocabulary, not merely rely on implementation behavior.","next_action_hint":"Continue with a distinct cancellation/fulfillment, durable-consumer, or public-contract invariant; avoid catalog-only changes unless they close an executable gap."}}
{"run":248,"commit":"049b7f5","metric":183,"metrics":{"remaining_gates":1},"status":"checks_failed","description":"Replay Accounting revenue with a tampered amount using the server-derived Sales fact.","timestamp":1786930093161,"segment":5,"confidence":4.357142857142857,"asi":{"hypothesis":"An Accounting revenue replay must derive the expected journal amount from the confirmed Sales order rather than comparing against a caller-supplied tampered amount.","rollback_reason":"The new regression assertion expected integer-zero strings, while PostgreSQL correctly returned decimal-scaled 0.00 values; checks failed and the candidate was reverted.","next_action_hint":"Reapply the source-derived replay validation and compare normalized decimal values or the database-shaped 0.00 strings."}}
{"run":249,"commit":"5d44e65","metric":184,"metrics":{"remaining_gates":0},"status":"keep","description":"Validate Accounting replay amounts against the server-derived Sales fact.","timestamp":1786930257495,"segment":5,"confidence":4.329411764705882,"asi":{"hypothesis":"A replay with a caller-tampered amount must return the existing journal when the confirmed Sales total matches, rather than treating the ignored amount as an idempotency conflict.","next_action_hint":"Continue with a distinct cancellation/fulfillment, durable-consumer, or public-contract invariant; the remaining issue is likely in replay parity or lifecycle coordination."}}
{"run":250,"commit":"5c62cf8","metric":185,"metrics":{"remaining_gates":0},"status":"keep","description":"Make Accounting test layers derive revenue from a required Sales fact service.","timestamp":1786930591379,"segment":5,"confidence":4.3023255813953485,"asi":{"hypothesis":"The in-memory Accounting test layer must model production provenance and ignore tampered amounts, so it should require a SalesService fact port rather than using decoded.amount; bootstrap and unit layers provide explicit test facts.","next_action_hint":"Continue with a distinct cancellation/fulfillment, durable-consumer, or public-contract invariant; avoid redundant provenance checks now covered in both production and test layers."}}
{"run":251,"commit":"d8d977b","metric":186,"metrics":{"remaining_gates":0},"status":"keep","description":"Make the Accounting revenue amount optional and stop Process from sending an ignored caller amount.","timestamp":1786930877074,"segment":5,"confidence":4.325581395348837,"asi":{"hypothesis":"The public revenue-posting contract should allow server-derived amounts without requiring a misleading caller amount; legacy valid hints remain accepted but production and Process never use them.","next_action_hint":"Continue with a distinct cancellation/fulfillment, durable-consumer, or public-contract invariant; provenance and amount-shape gaps are now covered."}}
{"run":252,"commit":"d8d977b","metric":185,"metrics":{"remaining_gates":2},"status":"checks_failed","description":"Protect Messaging event identity with an outbox immutability trigger.","timestamp":1786931166756,"segment":5,"confidence":4.325581395348837,"asi":{"hypothesis":"A committed event envelope should not allow event type/version/idempotency metadata to change after a consumer receipt; a database trigger would prevent receipt identity drift.","rollback_reason":"The trigger correctly blocked envelope tampering, but existing PostgreSQL corruption-regression tests intentionally mutate actor and payload fields to validate Process replay defenses, and the broad trigger blocked those setup mutations. Checks failed.","next_action_hint":"Use receipt-side event identity snapshots instead of a broad outbox trigger, preserving existing corruption tests while detecting logical identity drift."}}
{"run":253,"commit":"b20e017","metric":187,"metrics":{"remaining_gates":0},"status":"keep","description":"Bind durable consumer receipts to the source event identity.","timestamp":1786931906133,"segment":5,"confidence":4.348837209302325,"asi":{"hypothesis":"A completed receipt keyed only by tenant, consumer, and event UUID can silently replay after source event type/version/idempotency metadata changes; storing and validating a source identity snapshot makes logical event identity durable.","next_action_hint":"Continue with a distinct cancellation/fulfillment, consumer rollback, or public-contract invariant; receipt identity drift is now covered in PostgreSQL and the test layer."}}
{"run":254,"commit":"306ae85","metric":188,"metrics":{"remaining_gates":0},"status":"keep","description":"Mark Accounting revenue posting idempotency as inherent in the public catalog.","timestamp":1786932202843,"segment":5,"confidence":4.372093023255814,"asi":{"hypothesis":"Accounting revenue posting is keyed by the tenant/legal-entity/order reference and its public input has no request idempotency key, so catalog metadata should declare inherent idempotency rather than requiring an absent stable key.","next_action_hint":"Continue with a distinct cancellation/fulfillment, durable-consumer, or public-contract invariant; avoid redundant catalog metadata adjustments."}}
{"run":255,"commit":"11dbe2a","metric":189,"metrics":{"remaining_gates":0},"status":"keep","description":"Validate Messaging receipt identity in primary-key conflict recovery.","timestamp":1786932566642,"segment":5,"confidence":4.395348837209302,"asi":{"hypothesis":"The losing consumer in a concurrent receipt insert race must validate the recovered receipt against the current source event identity, just like the normal duplicate path, rather than returning any receipt found after a constraint conflict.","next_action_hint":"Continue with a distinct cancellation/fulfillment or public-contract invariant; both normal and conflict-recovery receipt paths now validate identity."}}
{"run":256,"commit":"92be74c","metric":190,"metrics":{"remaining_gates":0},"status":"keep","description":"Document Messaging receipt identity snapshots and replay validation.","timestamp":1786932768179,"segment":5,"confidence":4.4186046511627906,"asi":{"hypothesis":"The canonical messaging architecture should explicitly describe the new receipt event-identity snapshot and duplicate validation so implementation, migration, and operational expectations agree.","next_action_hint":"Continue with a distinct cancellation/fulfillment or public-contract invariant; avoid documentation-only additions unless they reconcile another substantive change."}}
{"run":257,"commit":"fc403dd","metric":191,"metrics":{"remaining_gates":0},"status":"keep","description":"Add a Sales public-contract regression for the coordinator-only cancellation shape.","timestamp":1786932958461,"segment":5,"confidence":4.390804597701149,"asi":{"hypothesis":"The Sales package should not expose the old standalone cancelOrder command; the runtime contract must expose only the explicitly named confirmed-order participant used by Process.","next_action_hint":"Continue with a distinct cancellation/fulfillment, durable-consumer, or public-contract invariant; avoid repeating the already-covered Sales cancellation rename."}}
{"run":258,"commit":"898e68c","metric":192,"metrics":{"remaining_gates":0},"status":"keep","description":"Prove the Messaging test layer returns source event identity on receipts.","timestamp":1786933129598,"segment":5,"confidence":4.363636363636363,"asi":{"hypothesis":"The in-memory Messaging contract layer should expose the same durable receipt event type/version/idempotency snapshot as PostgreSQL so consumer tests cannot miss identity-binding regressions.","next_action_hint":"Continue with a distinct cancellation/fulfillment or public-contract invariant; avoid repeating receipt snapshot coverage."}}
{"run":259,"commit":"881f7f7","metric":193,"metrics":{"remaining_gates":0},"status":"keep","description":"Reconcile the domain-maturity roadmap checks with the completed bounded P3 evidence.","timestamp":1786933360574,"segment":5,"confidence":4.386363636363637,"asi":{"hypothesis":"The roadmap's workflow-runtime gate should mark the now-proven catalog failures, typed events, compensation/manual recovery, compatibility, and boundary checks complete while retaining procurement and billing prerequisites as future gates.","next_action_hint":"Continue with a distinct cancellation/fulfillment or public-contract invariant; avoid further roadmap-only changes unless implementation evidence changes."}}
{"run":260,"commit":"c3721d5","metric":194,"metrics":{"remaining_gates":0},"status":"keep","description":"Reconcile the Process Studio roadmap with the released Accounting action.","timestamp":1786933661309,"segment":5,"confidence":4.409090909090909,"asi":{"hypothesis":"The Process Studio roadmap still said Accounting revenue posting was unreleased even after owner-derived provenance and PUBLIC action metadata were complete; removing that stale blocker keeps canonical readiness evidence consistent.","next_action_hint":"Continue with a distinct cancellation/fulfillment or public-contract invariant; avoid further roadmap-only changes unless another stale source-of-truth statement is found."}}
{"run":261,"commit":"f268c7e","metric":195,"metrics":{"remaining_gates":0},"status":"keep","description":"Run Accounting revenue replay validation inside a transaction.","timestamp":1786934042239,"segment":5,"confidence":4.382022471910112,"asi":{"hypothesis":"The replay path must share the Sales row lock and journal/line validation in an explicit Accounting transaction; otherwise the newly added server-derived fact lock is ineffective before existing-journal return.","next_action_hint":"Continue with a distinct cancellation/fulfillment or public-contract invariant; Accounting replay now has the same transaction boundary as first posting."}}
{"run":262,"commit":"HEAD","metric":195,"metrics":{"remaining_gates":1},"status":"checks_failed","description":"Align Process stock reservations with the selected legal entity.","timestamp":1786934295624,"segment":5,"confidence":4.333333333333333,"asi":{"hypothesis":"Process confirmation should pass legalEntityId into Inventory so a warehouse from another legal entity cannot reserve stock for the order.","rollback_reason":"Backpressure formatting checks failed; candidate was auto-reverted.","next_action_hint":"Reapply the same candidate with deno formatting applied before rerunning."}}
{"run":263,"commit":"34756a2","metric":196,"metrics":{"remaining_gates":0},"status":"keep","description":"Align Process stock reservations with the selected legal entity.","timestamp":1786934532029,"segment":5,"confidence":4.355555555555555,"asi":{"hypothesis":"Process confirmation should pass legalEntityId into Inventory so a warehouse from another legal entity cannot reserve stock for the order; the Inventory boundary validates that relationship atomically and the test layer proves the rejection.","what_learned":"This closed the final measured gate: all 196 readiness gates now pass, including full repository checks."}}
{"run":264,"commit":"4eae412","metric":197,"metrics":{"remaining_gates":0},"status":"keep","description":"Document the legal-entity boundary for order confirmation.","timestamp":1786934720538,"segment":5,"confidence":4.377777777777778,"asi":{"hypothesis":"The accepted lifecycle decision should record that Inventory validates the selected warehouse against the Accounting legal entity inside the reservation transaction, keeping the new public contract and canonical ADR aligned.","what_learned":"Documentation and all validation checks pass; the readiness portfolio now has 197 explicit gates with no remaining failures."}}
